,agency,uploaded_on,value,uploaded_dt,dt_scrape,description
0,DEPARTMENT OF EDUCATION,2/7/2025,9475685.0,2025-02-07,2025-03-05-1332,
1,DEPARTMENT OF EDUCATION,2/7/2025,6862220.0,2025-02-07,2025-03-05-1332,
2,DEPARTMENT OF EDUCATION,2/7/2025,7323924.0,2025-02-07,2025-03-05-1332,
3,DEPARTMENT OF EDUCATION,2/10/2025,12192041.0,2025-02-10,2025-03-05-1332,
4,DEPARTMENT OF EDUCATION,2/10/2025,13757722.0,2025-02-10,2025-03-05-1332,
5,DEPARTMENT OF EDUCATION,2/10/2025,6262866.0,2025-02-10,2025-03-05-1332,
6,DEPARTMENT OF EDUCATION,2/10/2025,9999851.0,2025-02-10,2025-03-05-1332,
7,DEPARTMENT OF EDUCATION,2/10/2025,9219756.0,2025-02-10,2025-03-05-1332,
8,DEPARTMENT OF EDUCATION,2/10/2025,4525065.0,2025-02-10,2025-03-05-1332,
9,DEPARTMENT OF EDUCATION,2/10/2025,14252797.0,2025-02-10,2025-03-05-1332,
10,DEPARTMENT OF EDUCATION,2/10/2025,9876928.0,2025-02-10,2025-03-05-1332,
11,DEPARTMENT OF EDUCATION,2/10/2025,10261487.0,2025-02-10,2025-03-05-1332,
12,DEPARTMENT OF EDUCATION,2/10/2025,17731785.0,2025-02-10,2025-03-05-1332,
13,DEPARTMENT OF EDUCATION,2/10/2025,8652361.0,2025-02-10,2025-03-05-1332,
14,DEPARTMENT OF EDUCATION,2/10/2025,9146065.0,2025-02-10,2025-03-05-1332,
15,DEPARTMENT OF EDUCATION,2/10/2025,7220136.0,2025-02-10,2025-03-05-1332,
16,DEPARTMENT OF EDUCATION,2/10/2025,5406889.0,2025-02-10,2025-03-05-1332,
17,DEPARTMENT OF EDUCATION,2/10/2025,14797304.0,2025-02-10,2025-03-05-1332,
18,DEPARTMENT OF EDUCATION,2/10/2025,3348763.0,2025-02-10,2025-03-05-1332,
19,DEPARTMENT OF EDUCATION,2/10/2025,9150854.0,2025-02-10,2025-03-05-1332,
20,DEPARTMENT OF EDUCATION,2/10/2025,4506218.0,2025-02-10,2025-03-05-1332,
21,DEPARTMENT OF EDUCATION,2/10/2025,11653965.0,2025-02-10,2025-03-05-1332,
22,DEPARTMENT OF EDUCATION,2/10/2025,13318352.0,2025-02-10,2025-03-05-1332,
23,DEPARTMENT OF EDUCATION,2/10/2025,5277224.0,2025-02-10,2025-03-05-1332,
24,DEPARTMENT OF EDUCATION,2/10/2025,6903111.0,2025-02-10,2025-03-05-1332,
25,DEPARTMENT OF EDUCATION,2/10/2025,2775628.0,2025-02-10,2025-03-05-1332,
26,DEPARTMENT OF EDUCATION,2/10/2025,662744.0,2025-02-10,2025-03-05-1332,
27,DEPARTMENT OF EDUCATION,2/10/2025,15005675.0,2025-02-10,2025-03-05-1332,
28,DEPARTMENT OF EDUCATION,2/10/2025,5947162.0,2025-02-10,2025-03-05-1332,
29,DEPARTMENT OF EDUCATION,2/10/2025,3931044.0,2025-02-10,2025-03-05-1332,
30,DEPARTMENT OF EDUCATION,2/10/2025,2172133.0,2025-02-10,2025-03-05-1332,
31,DEPARTMENT OF EDUCATION,2/10/2025,3490854.0,2025-02-10,2025-03-05-1332,
32,USAID,1/24/2025,2365702.0,2025-01-24,2025-03-05-1332,
33,USAID,1/30/2025,8000000.0,2025-01-30,2025-03-05-1332,
34,USAID,2/10/2025,15700000.0,2025-02-10,2025-03-05-1332,
35,USAID,2/10/2025,24500000.0,2025-02-10,2025-03-05-1332,
36,USAID,2/10/2025,19526440.0,2025-02-10,2025-03-05-1332,
37,USAID,2/10/2025,1500000.0,2025-02-10,2025-03-05-1332,
38,USAID,2/10/2025,10000000.0,2025-02-10,2025-03-05-1332,
39,USAID,2/10/2025,1000000.0,2025-02-10,2025-03-05-1332,
40,USAID,2/10/2025,6000000.0,2025-02-10,2025-03-05-1332,
41,USAID,2/10/2025,28000000.0,2025-02-10,2025-03-05-1332,
42,USAID,2/10/2025,11000000.0,2025-02-10,2025-03-05-1332,
43,USAID,2/10/2025,15999654.0,2025-02-10,2025-03-05-1332,
44,USAID,2/10/2025,1466694.0,2025-02-10,2025-03-05-1332,
45,USAID,2/10/2025,185000.0,2025-02-10,2025-03-05-1332,
46,USAID,2/10/2025,16355000.0,2025-02-10,2025-03-05-1332,
47,USAID,2/10/2025,4700000.0,2025-02-10,2025-03-05-1332,
48,USAID,2/11/2025,21600000.0,2025-02-11,2025-03-05-1332,
49,USAID,2/11/2025,2399953.0,2025-02-11,2025-03-05-1332,
50,USAID,2/11/2025,26490383.0,2025-02-11,2025-03-05-1332,
51,USAID,2/11/2025,14950000.0,2025-02-11,2025-03-05-1332,
52,USAID,2/11/2025,500000.0,2025-02-11,2025-03-05-1332,
53,USAID,2/11/2025,14550000.0,2025-02-11,2025-03-05-1332,
54,USAID,2/11/2025,21000000.0,2025-02-11,2025-03-05-1332,
55,USAID,1/25/2025,9949533.0,2025-01-25,2025-03-05-1332,
56,USAID,2/11/2025,3020000.0,2025-02-11,2025-03-05-1332,
57,USAID,2/11/2025,1999451.0,2025-02-11,2025-03-05-1332,
58,USAID,2/11/2025,19800000.0,2025-02-11,2025-03-05-1332,
59,USAID,2/11/2025,4000000.0,2025-02-11,2025-03-05-1332,
60,USAID,2/11/2025,17500000.0,2025-02-11,2025-03-05-1332,
61,USAID,2/11/2025,6400000.0,2025-02-11,2025-03-05-1332,
62,USAID,2/11/2025,17000000.0,2025-02-11,2025-03-05-1332,
63,USAID,2/11/2025,24500000.0,2025-02-11,2025-03-05-1332,
64,USAID,2/11/2025,29000000.0,2025-02-11,2025-03-05-1332,
65,USAID,2/11/2025,25000000.0,2025-02-11,2025-03-05-1332,
66,USAID,2/11/2025,36000000.0,2025-02-11,2025-03-05-1332,
67,USAID,2/11/2025,20000000.0,2025-02-11,2025-03-05-1332,
68,USAID,2/11/2025,47000000.0,2025-02-11,2025-03-05-1332,
69,USAID,2/11/2025,4600000.0,2025-02-11,2025-03-05-1332,
70,USAID,2/11/2025,4186109.0,2025-02-11,2025-03-05-1332,
71,USAID,2/11/2025,10851354.0,2025-02-11,2025-03-05-1332,
72,USAID,2/11/2025,7000000.0,2025-02-11,2025-03-05-1332,
73,USAID,2/11/2025,20469999.0,2025-02-11,2025-03-05-1332,
74,USAID,2/11/2025,5000000.0,2025-02-11,2025-03-05-1332,
75,USAID,2/11/2025,26056000.0,2025-02-11,2025-03-05-1332,
76,USAID,1/30/2025,400000.0,2025-01-30,2025-03-05-1332,
77,USAID,2/11/2025,19477181.0,2025-02-11,2025-03-05-1332,
78,USAID,2/12/2025,2000000.0,2025-02-12,2025-03-05-1332,
79,USAID,2/12/2025,15550000.0,2025-02-12,2025-03-05-1332,
80,USAID,2/12/2025,19000000.0,2025-02-12,2025-03-05-1332,
81,USAID,2/12/2025,9500000.0,2025-02-12,2025-03-05-1332,
82,USAID,2/12/2025,17600000.0,2025-02-12,2025-03-05-1332,
83,USAID,2/12/2025,19600000.0,2025-02-12,2025-03-05-1332,
84,USAID,2/6/2025,1799150.0,2025-02-06,2025-03-05-1332,
85,USAID,2/10/2025,77500000.0,2025-02-10,2025-03-05-1332,
86,USAID,2/10/2025,62500000.0,2025-02-10,2025-03-05-1332,
87,USAID,2/6/2025,7500000.0,2025-02-06,2025-03-05-1332,
88,USAID,2/6/2025,49964668.0,2025-02-06,2025-03-05-1332,
89,USAID,2/6/2025,199251.0,2025-02-06,2025-03-05-1332,
90,USAID,2/10/2025,4377394.0,2025-02-10,2025-03-05-1332,
91,USAID,2/10/2025,2499995.0,2025-02-10,2025-03-05-1332,
92,USAID,2/10/2025,899858.0,2025-02-10,2025-03-05-1332,
93,USAID,2/10/2025,18735000.0,2025-02-10,2025-03-05-1332,
94,USAID,2/10/2025,700000.0,2025-02-10,2025-03-05-1332,
95,USAID,2/10/2025,5000000.0,2025-02-10,2025-03-05-1332,
96,USAID,2/10/2025,8250000.0,2025-02-10,2025-03-05-1332,
97,USAID,2/10/2025,2500000.0,2025-02-10,2025-03-05-1332,
98,USAID,2/12/0205,59552142.0,,2025-03-05-1332,
99,USAID,2/11/2025,20100000.0,2025-02-11,2025-03-05-1332,
100,USAID,2/11/2025,70000000.0,2025-02-11,2025-03-05-1332,
101,USAID,2/11/2025,35000000.0,2025-02-11,2025-03-05-1332,
102,USAID,2/11/2025,53264317.0,2025-02-11,2025-03-05-1332,
103,USAID,2/11/2025,24999825.0,2025-02-11,2025-03-05-1332,
104,USAID,2/11/2025,40000000.0,2025-02-11,2025-03-05-1332,
105,USAID,2/11/2025,79249987.0,2025-02-11,2025-03-05-1332,
106,USAID,2/11/2025,62000000.0,2025-02-11,2025-03-05-1332,
107,USAID,2/11/2025,42217035.0,2025-02-11,2025-03-05-1332,
108,USAID,2/11/2025,43000000.0,2025-02-11,2025-03-05-1332,
109,USAID,2/11/2025,49500000.0,2025-02-11,2025-03-05-1332,
110,USAID,2/11/2025,43568610.0,2025-02-11,2025-03-05-1332,
111,USAID,2/11/2025,54992940.0,2025-02-11,2025-03-05-1332,
112,USAID,2/11/2025,128500000.0,2025-02-11,2025-03-05-1332,
113,USAID,2/6/2025,1800000.0,2025-02-06,2025-03-05-1332,
114,USAID,2/11/2025,62900000.0,2025-02-11,2025-03-05-1332,
115,USAID,2/11/2025,38000000.0,2025-02-11,2025-03-05-1332,
116,USAID,2/11/2025,1323093.0,2025-02-11,2025-03-05-1332,
117,USAID,2/12/2025,93599994.0,2025-02-12,2025-03-05-1332,
118,USAID,2/12/2025,96999895.0,2025-02-12,2025-03-05-1332,
119,USAID,2/12/2025,47500000.0,2025-02-12,2025-03-05-1332,
120,USAID,2/12/2025,37495000.0,2025-02-12,2025-03-05-1332,
121,USAID,2/12/2025,60000000.0,2025-02-12,2025-03-05-1332,
122,USAID,2/6/2025,1500000.0,2025-02-06,2025-03-05-1332,
123,USAID,2/12/2025,25635960.0,2025-02-12,2025-03-05-1332,
124,USAID,2/6/2025,3467480.0,2025-02-06,2025-03-05-1332,
125,USAID,2/6/2025,1195836.0,2025-02-06,2025-03-05-1332,
126,USAID,2/7/2025,500000.0,2025-02-07,2025-03-05-1332,
127,USAID,2/10/2025,21823000.0,2025-02-10,2025-03-05-1332,
128,USAID,2/10/2025,40000000.0,2025-02-10,2025-03-05-1332,
129,USAID,2/10/2025,90000000.0,2025-02-10,2025-03-05-1332,
130,USAID,2/10/2025,55000000.0,2025-02-10,2025-03-05-1332,
131,USAID,2/11/2025,14500000.0,2025-02-11,2025-03-05-1332,
132,USAID,2/6/2025,318653764.0,2025-02-06,2025-03-05-1332,
133,USAID,2/11/2025,29946856.0,2025-02-11,2025-03-05-1332,
134,USAID,2/6/2025,30000000.0,2025-02-06,2025-03-05-1332,
135,USAID,2/6/2025,20759.0,2025-02-06,2025-03-05-1332,
136,USAID,2/11/2025,39484357.0,2025-02-11,2025-03-05-1332,
137,USAID,2/13/2025,60000000.0,2025-02-13,2025-03-05-1332,
138,USAID,2/13/2025,51310195.0,2025-02-13,2025-03-05-1332,
139,DEPARTMENT OF EDUCATION,2/12/2025,2165033.0,2025-02-12,2025-03-05-1332,
140,DEPARTMENT OF EDUCATION,2/12/2025,4882350.0,2025-02-12,2025-03-05-1332,
141,DEPARTMENT OF EDUCATION,2/12/2025,3692915.0,2025-02-12,2025-03-05-1332,
142,DEPARTMENT OF EDUCATION,2/12/2025,2371270.0,2025-02-12,2025-03-05-1332,
143,DEPARTMENT OF EDUCATION,2/12/2025,2804102.0,2025-02-12,2025-03-05-1332,
144,DEPARTMENT OF EDUCATION,2/12/2025,6513745.0,2025-02-12,2025-03-05-1332,
145,DEPARTMENT OF EDUCATION,2/12/2025,7117470.0,2025-02-12,2025-03-05-1332,
146,DEPARTMENT OF EDUCATION,2/12/2025,6657837.0,2025-02-12,2025-03-05-1332,
147,DEPARTMENT OF EDUCATION,2/12/2025,6568462.0,2025-02-12,2025-03-05-1332,
148,DEPARTMENT OF EDUCATION,2/12/2025,1319977.0,2025-02-12,2025-03-05-1332,
149,DEPARTMENT OF EDUCATION,2/12/2025,5930962.0,2025-02-12,2025-03-05-1332,
150,DEPARTMENT OF EDUCATION,2/12/2025,8378847.0,2025-02-12,2025-03-05-1332,
151,DEPARTMENT OF EDUCATION,2/12/2025,3050976.0,2025-02-12,2025-03-05-1332,
152,DEPARTMENT OF EDUCATION,2/12/2025,4006731.0,2025-02-12,2025-03-05-1332,
153,DEPARTMENT OF EDUCATION,2/12/2025,2370130.0,2025-02-12,2025-03-05-1332,
154,DEPARTMENT OF EDUCATION,2/12/2025,8389304.0,2025-02-12,2025-03-05-1332,
155,DEPARTMENT OF EDUCATION,2/12/2025,6007002.0,2025-02-12,2025-03-05-1332,
156,DEPARTMENT OF EDUCATION,2/12/2025,6241763.0,2025-02-12,2025-03-05-1332,
157,DEPARTMENT OF EDUCATION,2/12/2025,2616124.0,2025-02-12,2025-03-05-1332,
158,DEPARTMENT OF EDUCATION,2/12/2025,4171894.0,2025-02-12,2025-03-05-1332,
159,DEPARTMENT OF EDUCATION,2/12/2025,8545893.0,2025-02-12,2025-03-05-1332,
160,DEPARTMENT OF EDUCATION,2/12/2025,1414373.0,2025-02-12,2025-03-05-1332,
161,DEPARTMENT OF EDUCATION,2/12/2025,5649324.0,2025-02-12,2025-03-05-1332,
162,DEPARTMENT OF EDUCATION,2/12/2025,1106304.0,2025-02-12,2025-03-05-1332,
163,DEPARTMENT OF EDUCATION,2/12/2025,5293227.0,2025-02-12,2025-03-05-1332,
164,DEPARTMENT OF EDUCATION,2/12/2025,3335348.0,2025-02-12,2025-03-05-1332,
165,DEPARTMENT OF EDUCATION,2/12/2025,4503669.0,2025-02-12,2025-03-05-1332,
166,DEPARTMENT OF EDUCATION,2/12/2025,7878539.0,2025-02-12,2025-03-05-1332,
167,DEPARTMENT OF EDUCATION,2/12/2025,4228801.0,2025-02-12,2025-03-05-1332,
168,DEPARTMENT OF EDUCATION,2/12/2025,2375747.0,2025-02-12,2025-03-05-1332,
169,DEPARTMENT OF EDUCATION,2/12/2025,3356160.0,2025-02-12,2025-03-05-1332,
170,DEPARTMENT OF EDUCATION,2/12/2025,9719230.0,2025-02-12,2025-03-05-1332,
171,DEPARTMENT OF EDUCATION,2/12/2025,1303909.0,2025-02-12,2025-03-05-1332,
172,DEPARTMENT OF EDUCATION,2/12/2025,2294738.0,2025-02-12,2025-03-05-1332,
173,DEPARTMENT OF EDUCATION,2/12/2025,3285709.0,2025-02-12,2025-03-05-1332,
174,DEPARTMENT OF EDUCATION,2/12/2025,1261718.0,2025-02-12,2025-03-05-1332,
175,DEPARTMENT OF EDUCATION,2/12/2025,1186935.0,2025-02-12,2025-03-05-1332,
176,DEPARTMENT OF EDUCATION,2/12/2025,487807.0,2025-02-12,2025-03-05-1332,
177,DEPARTMENT OF EDUCATION,2/12/2025,3524401.0,2025-02-12,2025-03-05-1332,
178,DEPARTMENT OF EDUCATION,2/12/2025,1849011.0,2025-02-12,2025-03-05-1332,
179,DEPARTMENT OF EDUCATION,2/12/2025,4073691.0,2025-02-12,2025-03-05-1332,
180,DEPARTMENT OF EDUCATION,2/12/2025,1797750.0,2025-02-12,2025-03-05-1332,
181,DEPARTMENT OF EDUCATION,2/12/2025,3844820.0,2025-02-12,2025-03-05-1332,
182,DEPARTMENT OF EDUCATION,2/12/2025,8044648.0,2025-02-12,2025-03-05-1332,
183,DEPARTMENT OF EDUCATION,2/12/2025,3499999.0,2025-02-12,2025-03-05-1332,
184,DEPARTMENT OF EDUCATION,2/12/2025,4719035.0,2025-02-12,2025-03-05-1332,
185,DEPARTMENT OF EDUCATION,2/12/2025,5898695.0,2025-02-12,2025-03-05-1332,
186,DEPARTMENT OF EDUCATION,2/12/2025,7487510.0,2025-02-12,2025-03-05-1332,
187,DEPARTMENT OF EDUCATION,2/12/2025,631843.0,2025-02-12,2025-03-05-1332,
188,DEPARTMENT OF EDUCATION,2/12/2025,3791664.0,2025-02-12,2025-03-05-1332,
189,DEPARTMENT OF EDUCATION,2/12/2025,1184430.0,2025-02-12,2025-03-05-1332,
190,DEPARTMENT OF EDUCATION,2/12/2025,7469325.0,2025-02-12,2025-03-05-1332,
191,DEPARTMENT OF EDUCATION,2/12/2025,9306229.0,2025-02-12,2025-03-05-1332,
192,DEPARTMENT OF EDUCATION,2/12/2025,5747655.0,2025-02-12,2025-03-05-1332,
193,DEPARTMENT OF EDUCATION,2/12/2025,7975521.0,2025-02-12,2025-03-05-1332,
194,DEPARTMENT OF EDUCATION,2/12/2025,2361400.0,2025-02-12,2025-03-05-1332,
195,DEPARTMENT OF EDUCATION,2/12/2025,9056449.0,2025-02-12,2025-03-05-1332,
196,DEPARTMENT OF EDUCATION,2/12/2025,2158238.0,2025-02-12,2025-03-05-1332,
197,DEPARTMENT OF EDUCATION,2/12/2025,8502340.0,2025-02-12,2025-03-05-1332,
198,DEPARTMENT OF EDUCATION,2/12/2025,4676106.0,2025-02-12,2025-03-05-1332,
199,DEPARTMENT OF EDUCATION,2/12/2025,4237200.0,2025-02-12,2025-03-05-1332,
200,DEPARTMENT OF EDUCATION,2/12/2025,9258547.0,2025-02-12,2025-03-05-1332,
201,DEPARTMENT OF EDUCATION,2/12/2025,7988347.0,2025-02-12,2025-03-05-1332,
202,DEPARTMENT OF EDUCATION,2/12/2025,5153884.0,2025-02-12,2025-03-05-1332,
203,DEPARTMENT OF EDUCATION,2/12/2025,8017306.0,2025-02-12,2025-03-05-1332,
204,DEPARTMENT OF EDUCATION,2/12/2025,3380649.0,2025-02-12,2025-03-05-1332,
205,DEPARTMENT OF EDUCATION,2/12/2025,8407872.0,2025-02-12,2025-03-05-1332,
206,DEPARTMENT OF EDUCATION,2/12/2025,9913020.0,2025-02-12,2025-03-05-1332,
207,DEPARTMENT OF EDUCATION,2/12/2025,3067134.0,2025-02-12,2025-03-05-1332,
208,DEPARTMENT OF EDUCATION,2/12/2025,8510029.0,2025-02-12,2025-03-05-1332,
209,DEPARTMENT OF EDUCATION,2/13/2025,8218498.0,2025-02-13,2025-03-05-1332,
210,DEPARTMENT OF EDUCATION,2/13/2025,8226640.0,2025-02-13,2025-03-05-1332,
211,DEPARTMENT OF EDUCATION,2/13/2025,8294184.0,2025-02-13,2025-03-05-1332,
212,DEPARTMENT OF EDUCATION,2/13/2025,8107355.0,2025-02-13,2025-03-05-1332,
213,DEPARTMENT OF EDUCATION,2/18/2025,11396794.0,2025-02-18,2025-03-05-1332,
214,DEPARTMENT OF EDUCATION,2/18/2025,14126498.0,2025-02-18,2025-03-05-1332,
215,DEPARTMENT OF EDUCATION,2/18/2025,12144894.0,2025-02-18,2025-03-05-1332,
216,DEPARTMENT OF EDUCATION,2/18/2025,17763689.0,2025-02-18,2025-03-05-1332,
217,DEPARTMENT OF EDUCATION,2/18/2025,9022106.0,2025-02-18,2025-03-05-1332,
218,DEPARTMENT OF EDUCATION,2/18/2025,3610469.0,2025-02-18,2025-03-05-1332,
219,DEPARTMENT OF EDUCATION,2/18/2025,21275095.0,2025-02-18,2025-03-05-1332,
220,DEPARTMENT OF EDUCATION,2/18/2025,10270782.0,2025-02-18,2025-03-05-1332,
221,DEPARTMENT OF EDUCATION,2/18/2025,5715777.0,2025-02-18,2025-03-05-1332,
222,DEPARTMENT OF EDUCATION,2/18/2025,1763513.0,2025-02-18,2025-03-05-1332,
223,DEPARTMENT OF EDUCATION,2/18/2025,939768.0,2025-02-18,2025-03-05-1332,
224,DEPARTMENT OF EDUCATION,2/18/2025,6535968.0,2025-02-18,2025-03-05-1332,
225,DEPARTMENT OF EDUCATION,2/18/2025,12519835.0,2025-02-18,2025-03-05-1332,
226,DEPARTMENT OF EDUCATION,2/18/2025,6319419.0,2025-02-18,2025-03-05-1332,
227,DEPARTMENT OF EDUCATION,2/18/2025,7750850.0,2025-02-18,2025-03-05-1332,
228,DEPARTMENT OF EDUCATION,2/18/2025,8563751.0,2025-02-18,2025-03-05-1332,
229,DEPARTMENT OF EDUCATION,2/18/2025,6879974.0,2025-02-18,2025-03-05-1332,
230,DEPARTMENT OF EDUCATION,2/18/2025,10927183.0,2025-02-18,2025-03-05-1332,
231,DEPARTMENT OF EDUCATION,2/18/2025,7243753.0,2025-02-18,2025-03-05-1332,
232,DEPARTMENT OF EDUCATION,2/18/2025,17239813.0,2025-02-18,2025-03-05-1332,
233,DEPARTMENT OF EDUCATION,2/18/2025,1148881.0,2025-02-18,2025-03-05-1332,
234,DEPARTMENT OF EDUCATION,2/18/2025,11406253.0,2025-02-18,2025-03-05-1332,
235,DEPARTMENT OF EDUCATION,2/18/2025,6556437.0,2025-02-18,2025-03-05-1332,
236,DEPARTMENT OF EDUCATION,2/18/2025,5384154.0,2025-02-18,2025-03-05-1332,
237,DEPARTMENT OF EDUCATION,2/18/2025,13056227.0,2025-02-18,2025-03-05-1332,
238,DEPARTMENT OF EDUCATION,2/18/2025,2446069.0,2025-02-18,2025-03-05-1332,
239,DEPARTMENT OF EDUCATION,2/18/2025,13507563.0,2025-02-18,2025-03-05-1332,
240,DEPARTMENT OF EDUCATION,2/18/2025,7750000.0,2025-02-18,2025-03-05-1332,
241,DEPARTMENT OF EDUCATION,2/18/2025,9021560.0,2025-02-18,2025-03-05-1332,
242,DEPARTMENT OF EDUCATION,2/18/2025,25198845.0,2025-02-18,2025-03-05-1332,
243,DEPARTMENT OF EDUCATION,2/18/2025,22437090.0,2025-02-18,2025-03-05-1332,
244,DEPARTMENT OF EDUCATION,2/18/2025,30000000.0,2025-02-18,2025-03-05-1332,
245,DEPARTMENT OF EDUCATION,2/18/2025,5749996.0,2025-02-18,2025-03-05-1332,
246,DEPARTMENT OF EDUCATION,2/18/2025,12253440.0,2025-02-18,2025-03-05-1332,
247,DEPARTMENT OF EDUCATION,2/18/2025,11897855.0,2025-02-18,2025-03-05-1332,
248,DEPARTMENT OF EDUCATION,2/18/2025,23044104.0,2025-02-18,2025-03-05-1332,
249,DEPARTMENT OF EDUCATION,2/18/2025,9656886.9,2025-02-18,2025-03-05-1332,
250,DEPARTMENT OF EDUCATION,2/18/2025,11901866.0,2025-02-18,2025-03-05-1332,
251,DEPARTMENT OF EDUCATION,2/18/2025,11314749.0,2025-02-18,2025-03-05-1332,
252,DEPARTMENT OF EDUCATION,2/18/2025,15288255.0,2025-02-18,2025-03-05-1332,
253,DEPARTMENT OF EDUCATION,2/18/2025,5749999.0,2025-02-18,2025-03-05-1332,
254,DEPARTMENT OF EDUCATION,2/18/2025,5750000.0,2025-02-18,2025-03-05-1332,
255,DEPARTMENT OF HEALTH AND HUMAN SERVICES,2/20/2025,1000000.0,2025-02-20,2025-03-05-1332,
256,ENVIRONMENTAL PROTECTION AGENCY,2/22/2025,4000000.0,2025-02-22,2025-03-05-1332,
257,ENVIRONMENTAL PROTECTION AGENCY,2/22/2025,5100000.0,2025-02-22,2025-03-05-1332,
258,DEPARTMENT OF STATE,2/26/2025,22300.0,2025-02-26,2025-03-05-1332,
259,DEPARTMENT OF STATE,2/26/2025,250000000.0,2025-02-26,2025-03-05-1332,
260,DEPARTMENT OF STATE,2/26/2025,96325832.0,2025-02-26,2025-03-05-1332,
261,DEPARTMENT OF STATE,2/26/2025,63042000.0,2025-02-26,2025-03-05-1332,
262,DEPARTMENT OF STATE,2/26/2025,59250000.0,2025-02-26,2025-03-05-1332,
263,DEPARTMENT OF STATE,2/26/2025,53660000.0,2025-02-26,2025-03-05-1332,
264,DEPARTMENT OF STATE,2/26/2025,50850000.0,2025-02-26,2025-03-05-1332,
265,DEPARTMENT OF STATE,2/26/2025,50677151.0,2025-02-26,2025-03-05-1332,
266,DEPARTMENT OF STATE,2/26/2025,45000000.0,2025-02-26,2025-03-05-1332,
267,DEPARTMENT OF STATE,2/26/2025,43657781.0,2025-02-26,2025-03-05-1332,
268,DEPARTMENT OF STATE,2/26/2025,38213325.0,2025-02-26,2025-03-05-1332,
269,DEPARTMENT OF STATE,2/26/2025,35000000.0,2025-02-26,2025-03-05-1332,
270,DEPARTMENT OF STATE,2/26/2025,31510591.0,2025-02-26,2025-03-05-1332,
271,DEPARTMENT OF STATE,2/26/2025,30905027.0,2025-02-26,2025-03-05-1332,
272,DEPARTMENT OF STATE,2/26/2025,30147074.0,2025-02-26,2025-03-05-1332,
273,DEPARTMENT OF STATE,2/26/2025,30000000.0,2025-02-26,2025-03-05-1332,
274,DEPARTMENT OF STATE,2/26/2025,28410490.0,2025-02-26,2025-03-05-1332,
275,DEPARTMENT OF STATE,2/26/2025,28064399.0,2025-02-26,2025-03-05-1332,
276,DEPARTMENT OF STATE,2/26/2025,27729878.0,2025-02-26,2025-03-05-1332,
277,DEPARTMENT OF STATE,2/26/2025,25298782.0,2025-02-26,2025-03-05-1332,
278,DEPARTMENT OF STATE,2/26/2025,22469135.0,2025-02-26,2025-03-05-1332,
279,DEPARTMENT OF STATE,2/26/2025,21873120.0,2025-02-26,2025-03-05-1332,
280,DEPARTMENT OF STATE,2/26/2025,21728395.0,2025-02-26,2025-03-05-1332,
281,DEPARTMENT OF STATE,2/26/2025,20897571.0,2025-02-26,2025-03-05-1332,
282,DEPARTMENT OF STATE,2/26/2025,20450000.0,2025-02-26,2025-03-05-1332,
283,DEPARTMENT OF STATE,2/26/2025,20250000.0,2025-02-26,2025-03-05-1332,
284,DEPARTMENT OF STATE,2/26/2025,20176805.0,2025-02-26,2025-03-05-1332,
285,DEPARTMENT OF STATE,2/26/2025,19636020.0,2025-02-26,2025-03-05-1332,
286,DEPARTMENT OF STATE,2/26/2025,19119665.0,2025-02-26,2025-03-05-1332,
287,DEPARTMENT OF STATE,2/26/2025,19000000.0,2025-02-26,2025-03-05-1332,
288,DEPARTMENT OF STATE,2/26/2025,18930511.0,2025-02-26,2025-03-05-1332,
289,DEPARTMENT OF STATE,2/26/2025,18518518.0,2025-02-26,2025-03-05-1332,
290,DEPARTMENT OF STATE,2/26/2025,18390884.0,2025-02-26,2025-03-05-1332,
291,DEPARTMENT OF STATE,2/26/2025,18271605.0,2025-02-26,2025-03-05-1332,
292,DEPARTMENT OF STATE,2/26/2025,4885890.0,2025-02-26,2025-03-05-1332,
293,DEPARTMENT OF STATE,2/26/2025,18230357.0,2025-02-26,2025-03-05-1332,
294,DEPARTMENT OF STATE,2/26/2025,17981265.0,2025-02-26,2025-03-05-1332,
295,DEPARTMENT OF STATE,2/26/2025,17915753.0,2025-02-26,2025-03-05-1332,
296,DEPARTMENT OF STATE,2/26/2025,17500000.0,2025-02-26,2025-03-05-1332,
297,DEPARTMENT OF STATE,2/26/2025,17325101.0,2025-02-26,2025-03-05-1332,
298,DEPARTMENT OF STATE,2/26/2025,16218984.0,2025-02-26,2025-03-05-1332,
299,DEPARTMENT OF STATE,2/26/2025,16111638.0,2025-02-26,2025-03-05-1332,
300,DEPARTMENT OF STATE,2/26/2025,16045000.0,2025-02-26,2025-03-05-1332,
301,DEPARTMENT OF STATE,2/26/2025,15709203.0,2025-02-26,2025-03-05-1332,
302,DEPARTMENT OF STATE,2/26/2025,15331694.0,2025-02-26,2025-03-05-1332,
303,DEPARTMENT OF STATE,2/26/2025,15204563.0,2025-02-26,2025-03-05-1332,
304,DEPARTMENT OF STATE,2/26/2025,15111685.0,2025-02-26,2025-03-05-1332,
305,DEPARTMENT OF STATE,2/26/2025,14573933.0,2025-02-26,2025-03-05-1332,
306,DEPARTMENT OF STATE,2/26/2025,14469134.0,2025-02-26,2025-03-05-1332,
307,DEPARTMENT OF STATE,2/26/2025,13799360.0,2025-02-26,2025-03-05-1332,
308,DEPARTMENT OF STATE,2/26/2025,13749340.0,2025-02-26,2025-03-05-1332,
309,DEPARTMENT OF STATE,2/26/2025,13363942.39,2025-02-26,2025-03-05-1332,
310,DEPARTMENT OF STATE,2/26/2025,1958000.0,2025-02-26,2025-03-05-1332,
311,DEPARTMENT OF STATE,2/26/2025,13310000.0,2025-02-26,2025-03-05-1332,
312,DEPARTMENT OF STATE,2/26/2025,13216370.0,2025-02-26,2025-03-05-1332,
313,DEPARTMENT OF STATE,2/26/2025,16739.75,2025-02-26,2025-03-05-1332,
314,DEPARTMENT OF STATE,2/26/2025,12866082.0,2025-02-26,2025-03-05-1332,
315,DEPARTMENT OF STATE,2/26/2025,12819252.0,2025-02-26,2025-03-05-1332,
316,DEPARTMENT OF STATE,2/26/2025,12340000.0,2025-02-26,2025-03-05-1332,
317,DEPARTMENT OF STATE,2/26/2025,12218281.0,2025-02-26,2025-03-05-1332,
318,DEPARTMENT OF STATE,2/26/2025,11731000.0,2025-02-26,2025-03-05-1332,
319,DEPARTMENT OF STATE,2/26/2025,11417683.0,2025-02-26,2025-03-05-1332,
320,DEPARTMENT OF STATE,2/26/2025,10005000.0,2025-02-26,2025-03-05-1332,
321,DEPARTMENT OF STATE,2/26/2025,10000000.0,2025-02-26,2025-03-05-1332,
322,DEPARTMENT OF STATE,2/26/2025,9899333.57,2025-02-26,2025-03-05-1332,
323,DEPARTMENT OF STATE,2/26/2025,9816954.0,2025-02-26,2025-03-05-1332,
324,DEPARTMENT OF STATE,2/26/2025,9795900.0,2025-02-26,2025-03-05-1332,
325,DEPARTMENT OF STATE,2/26/2025,9693005.0,2025-02-26,2025-03-05-1332,
326,DEPARTMENT OF STATE,2/26/2025,9500000.0,2025-02-26,2025-03-05-1332,
327,DEPARTMENT OF STATE,2/26/2025,9410000.0,2025-02-26,2025-03-05-1332,
328,DEPARTMENT OF STATE,2/26/2025,9389378.0,2025-02-26,2025-03-05-1332,
329,DEPARTMENT OF STATE,2/26/2025,9277725.0,2025-02-26,2025-03-05-1332,
330,DEPARTMENT OF STATE,2/26/2025,8990000.0,2025-02-26,2025-03-05-1332,
331,DEPARTMENT OF STATE,2/26/2025,8887911.0,2025-02-26,2025-03-05-1332,
332,DEPARTMENT OF STATE,2/26/2025,8814297.0,2025-02-26,2025-03-05-1332,
333,DEPARTMENT OF STATE,2/26/2025,8600000.0,2025-02-26,2025-03-05-1332,
334,DEPARTMENT OF STATE,2/26/2025,8540733.23,2025-02-26,2025-03-05-1332,
335,DEPARTMENT OF STATE,2/26/2025,8520000.0,2025-02-26,2025-03-05-1332,
336,DEPARTMENT OF STATE,2/26/2025,8500000.0,2025-02-26,2025-03-05-1332,
337,DEPARTMENT OF STATE,2/26/2025,8391000.0,2025-02-26,2025-03-05-1332,
338,DEPARTMENT OF STATE,2/26/2025,8139420.17,2025-02-26,2025-03-05-1332,
339,DEPARTMENT OF STATE,2/26/2025,8138499.0,2025-02-26,2025-03-05-1332,
340,DEPARTMENT OF STATE,2/26/2025,7990009.0,2025-02-26,2025-03-05-1332,
341,DEPARTMENT OF STATE,2/26/2025,7986318.0,2025-02-26,2025-03-05-1332,
342,DEPARTMENT OF STATE,2/26/2025,7950000.0,2025-02-26,2025-03-05-1332,
343,DEPARTMENT OF STATE,2/26/2025,7582729.0,2025-02-26,2025-03-05-1332,
344,DEPARTMENT OF STATE,2/26/2025,7500000.0,2025-02-26,2025-03-05-1332,
345,DEPARTMENT OF STATE,2/26/2025,7326835.0,2025-02-26,2025-03-05-1332,
346,DEPARTMENT OF STATE,2/26/2025,7293296.0,2025-02-26,2025-03-05-1332,
347,DEPARTMENT OF STATE,2/26/2025,7166557.0,2025-02-26,2025-03-05-1332,
348,DEPARTMENT OF STATE,2/26/2025,7087124.0,2025-02-26,2025-03-05-1332,
349,DEPARTMENT OF STATE,2/26/2025,6925760.93,2025-02-26,2025-03-05-1332,
350,DEPARTMENT OF STATE,2/26/2025,6913580.0,2025-02-26,2025-03-05-1332,
351,DEPARTMENT OF STATE,2/26/2025,6905500.0,2025-02-26,2025-03-05-1332,
352,DEPARTMENT OF STATE,2/26/2025,6800000.0,2025-02-26,2025-03-05-1332,
353,DEPARTMENT OF STATE,2/26/2025,6707723.0,2025-02-26,2025-03-05-1332,
354,DEPARTMENT OF STATE,2/26/2025,6625000.0,2025-02-26,2025-03-05-1332,
355,DEPARTMENT OF STATE,2/26/2025,6542068.0,2025-02-26,2025-03-05-1332,
356,DEPARTMENT OF STATE,2/26/2025,6457794.0,2025-02-26,2025-03-05-1332,
357,DEPARTMENT OF STATE,2/26/2025,6341000.0,2025-02-26,2025-03-05-1332,
358,DEPARTMENT OF STATE,2/26/2025,159000.0,2025-02-26,2025-03-05-1332,
359,DEPARTMENT OF STATE,2/26/2025,109650.0,2025-02-26,2025-03-05-1332,
360,DEPARTMENT OF STATE,2/26/2025,6085000.0,2025-02-26,2025-03-05-1332,
361,DEPARTMENT OF STATE,2/26/2025,28816.0,2025-02-26,2025-03-05-1332,
362,DEPARTMENT OF STATE,2/26/2025,23095.0,2025-02-26,2025-03-05-1332,
363,DEPARTMENT OF STATE,2/26/2025,6050000.0,2025-02-26,2025-03-05-1332,
364,DEPARTMENT OF STATE,2/26/2025,6045060.0,2025-02-26,2025-03-05-1332,
365,DEPARTMENT OF STATE,2/26/2025,6041748.0,2025-02-26,2025-03-05-1332,
366,DEPARTMENT OF STATE,2/26/2025,6000000.0,2025-02-26,2025-03-05-1332,
367,DEPARTMENT OF STATE,2/26/2025,5836318.0,2025-02-26,2025-03-05-1332,
368,DEPARTMENT OF STATE,2/26/2025,5789800.0,2025-02-26,2025-03-05-1332,
369,DEPARTMENT OF STATE,2/26/2025,5565367.0,2025-02-26,2025-03-05-1332,
370,DEPARTMENT OF STATE,2/26/2025,5499726.0,2025-02-26,2025-03-05-1332,
371,DEPARTMENT OF STATE,2/26/2025,5414893.0,2025-02-26,2025-03-05-1332,
372,DEPARTMENT OF STATE,2/26/2025,5400000.0,2025-02-26,2025-03-05-1332,
373,DEPARTMENT OF STATE,2/26/2025,5376418.0,2025-02-26,2025-03-05-1332,
374,DEPARTMENT OF STATE,2/26/2025,5340035.0,2025-02-26,2025-03-05-1332,
375,DEPARTMENT OF STATE,2/26/2025,5149886.0,2025-02-26,2025-03-05-1332,
376,DEPARTMENT OF STATE,2/26/2025,5133841.42,2025-02-26,2025-03-05-1332,
377,DEPARTMENT OF STATE,2/26/2025,5030562.0,2025-02-26,2025-03-05-1332,
378,DEPARTMENT OF STATE,2/26/2025,5005429.0,2025-02-26,2025-03-05-1332,
379,DEPARTMENT OF STATE,2/26/2025,4996785.0,2025-02-26,2025-03-05-1332,
380,DEPARTMENT OF STATE,2/26/2025,4987388.0,2025-02-26,2025-03-05-1332,
381,DEPARTMENT OF STATE,2/26/2025,4980000.0,2025-02-26,2025-03-05-1332,
382,DEPARTMENT OF STATE,2/26/2025,4979989.0,2025-02-26,2025-03-05-1332,
383,DEPARTMENT OF STATE,2/26/2025,4941589.0,2025-02-26,2025-03-05-1332,
384,DEPARTMENT OF STATE,2/26/2025,4938271.0,2025-02-26,2025-03-05-1332,
385,DEPARTMENT OF STATE,2/26/2025,4937500.0,2025-02-26,2025-03-05-1332,
386,DEPARTMENT OF STATE,2/26/2025,4900564.0,2025-02-26,2025-03-05-1332,
387,DEPARTMENT OF STATE,2/26/2025,4858569.0,2025-02-26,2025-03-05-1332,
388,DEPARTMENT OF STATE,2/26/2025,4852008.0,2025-02-26,2025-03-05-1332,
389,DEPARTMENT OF STATE,2/26/2025,4800000.0,2025-02-26,2025-03-05-1332,
390,DEPARTMENT OF STATE,2/26/2025,4754102.84,2025-02-26,2025-03-05-1332,
391,DEPARTMENT OF STATE,2/26/2025,4724000.0,2025-02-26,2025-03-05-1332,
392,DEPARTMENT OF STATE,2/26/2025,4539983.0,2025-02-26,2025-03-05-1332,
393,DEPARTMENT OF STATE,2/26/2025,4511431.0,2025-02-26,2025-03-05-1332,
394,DEPARTMENT OF STATE,2/26/2025,19301992.0,2025-02-26,2025-03-05-1332,
395,DEPARTMENT OF STATE,2/26/2025,4438645.0,2025-02-26,2025-03-05-1332,
396,DEPARTMENT OF STATE,2/26/2025,4324707.0,2025-02-26,2025-03-05-1332,
397,DEPARTMENT OF STATE,2/26/2025,4317060.0,2025-02-26,2025-03-05-1332,
398,DEPARTMENT OF STATE,2/26/2025,4265431.0,2025-02-26,2025-03-05-1332,
399,DEPARTMENT OF STATE,2/26/2025,4210000.0,2025-02-26,2025-03-05-1332,
400,DEPARTMENT OF STATE,2/26/2025,4199999.0,2025-02-26,2025-03-05-1332,
401,DEPARTMENT OF STATE,2/26/2025,4186480.0,2025-02-26,2025-03-05-1332,
402,DEPARTMENT OF STATE,2/26/2025,4158651.12,2025-02-26,2025-03-05-1332,
403,DEPARTMENT OF STATE,2/26/2025,4041000.0,2025-02-26,2025-03-05-1332,
404,DEPARTMENT OF STATE,2/26/2025,3998275.0,2025-02-26,2025-03-05-1332,
405,DEPARTMENT OF STATE,2/26/2025,3994041.0,2025-02-26,2025-03-05-1332,
406,DEPARTMENT OF STATE,2/26/2025,3975000.0,2025-02-26,2025-03-05-1332,
407,DEPARTMENT OF STATE,2/26/2025,3950616.0,2025-02-26,2025-03-05-1332,
408,DEPARTMENT OF STATE,2/26/2025,3948659.0,2025-02-26,2025-03-05-1332,
409,DEPARTMENT OF STATE,2/26/2025,3946719.0,2025-02-26,2025-03-05-1332,
410,DEPARTMENT OF STATE,2/26/2025,3932537.0,2025-02-26,2025-03-05-1332,
411,DEPARTMENT OF STATE,2/26/2025,3918519.0,2025-02-26,2025-03-05-1332,
412,DEPARTMENT OF STATE,2/26/2025,13337000.0,2025-02-26,2025-03-05-1332,
413,DEPARTMENT OF STATE,2/26/2025,3916000.0,2025-02-26,2025-03-05-1332,
414,DEPARTMENT OF STATE,2/26/2025,3900000.0,2025-02-26,2025-03-05-1332,
415,DEPARTMENT OF STATE,2/26/2025,3897473.0,2025-02-26,2025-03-05-1332,
416,DEPARTMENT OF STATE,2/26/2025,3885437.0,2025-02-26,2025-03-05-1332,
417,DEPARTMENT OF STATE,2/26/2025,13000000.0,2025-02-26,2025-03-05-1332,
418,DEPARTMENT OF STATE,2/26/2025,8925000.0,2025-02-26,2025-03-05-1332,
419,DEPARTMENT OF STATE,2/26/2025,3737641.0,2025-02-26,2025-03-05-1332,
420,DEPARTMENT OF STATE,2/26/2025,3727605.0,2025-02-26,2025-03-05-1332,
421,DEPARTMENT OF STATE,2/26/2025,3715913.0,2025-02-26,2025-03-05-1332,
422,DEPARTMENT OF STATE,2/26/2025,3699375.0,2025-02-26,2025-03-05-1332,
423,DEPARTMENT OF STATE,2/26/2025,3645029.0,2025-02-26,2025-03-05-1332,
424,DEPARTMENT OF STATE,2/26/2025,3640607.0,2025-02-26,2025-03-05-1332,
425,DEPARTMENT OF STATE,2/26/2025,3600640.0,2025-02-26,2025-03-05-1332,
426,DEPARTMENT OF STATE,2/26/2025,3560436.0,2025-02-26,2025-03-05-1332,
427,DEPARTMENT OF STATE,2/26/2025,3553539.0,2025-02-26,2025-03-05-1332,
428,DEPARTMENT OF STATE,2/26/2025,3530553.0,2025-02-26,2025-03-05-1332,
429,DEPARTMENT OF STATE,2/26/2025,3525979.0,2025-02-26,2025-03-05-1332,
430,DEPARTMENT OF STATE,2/26/2025,3499997.0,2025-02-26,2025-03-05-1332,
431,DEPARTMENT OF STATE,2/26/2025,3499487.0,2025-02-26,2025-03-05-1332,
432,DEPARTMENT OF STATE,2/26/2025,3457200.0,2025-02-26,2025-03-05-1332,
433,DEPARTMENT OF STATE,2/26/2025,3450000.0,2025-02-26,2025-03-05-1332,
434,DEPARTMENT OF STATE,2/26/2025,3425000.0,2025-02-26,2025-03-05-1332,
435,DEPARTMENT OF STATE,2/26/2025,3417749.0,2025-02-26,2025-03-05-1332,
436,DEPARTMENT OF STATE,2/26/2025,3417254.0,2025-02-26,2025-03-05-1332,
437,DEPARTMENT OF STATE,2/26/2025,3389000.0,2025-02-26,2025-03-05-1332,
438,DEPARTMENT OF STATE,2/26/2025,3375000.0,2025-02-26,2025-03-05-1332,
439,DEPARTMENT OF STATE,2/26/2025,3345211.0,2025-02-26,2025-03-05-1332,
440,DEPARTMENT OF STATE,2/26/2025,3342839.34,2025-02-26,2025-03-05-1332,
441,DEPARTMENT OF STATE,2/26/2025,3250000.0,2025-02-26,2025-03-05-1332,
442,DEPARTMENT OF STATE,2/26/2025,3185945.0,2025-02-26,2025-03-05-1332,
443,DEPARTMENT OF STATE,2/26/2025,3049524.0,2025-02-26,2025-03-05-1332,
444,DEPARTMENT OF STATE,2/26/2025,3032476.0,2025-02-26,2025-03-05-1332,
445,DEPARTMENT OF STATE,2/26/2025,3012344.0,2025-02-26,2025-03-05-1332,
446,DEPARTMENT OF STATE,2/26/2025,3010574.0,2025-02-26,2025-03-05-1332,
447,DEPARTMENT OF STATE,2/26/2025,2999999.0,2025-02-26,2025-03-05-1332,
448,DEPARTMENT OF STATE,2/26/2025,2999975.0,2025-02-26,2025-03-05-1332,
449,DEPARTMENT OF STATE,2/26/2025,2999702.0,2025-02-26,2025-03-05-1332,
450,DEPARTMENT OF STATE,2/26/2025,2998720.0,2025-02-26,2025-03-05-1332,
451,DEPARTMENT OF STATE,2/26/2025,2997636.0,2025-02-26,2025-03-05-1332,
452,DEPARTMENT OF STATE,2/26/2025,2994938.2,2025-02-26,2025-03-05-1332,
453,DEPARTMENT OF STATE,2/26/2025,2990184.85,2025-02-26,2025-03-05-1332,
454,DEPARTMENT OF STATE,2/26/2025,2974991.0,2025-02-26,2025-03-05-1332,
455,DEPARTMENT OF STATE,2/26/2025,2964205.0,2025-02-26,2025-03-05-1332,
456,DEPARTMENT OF STATE,2/26/2025,5114355.0,2025-02-26,2025-03-05-1332,
457,DEPARTMENT OF STATE,2/26/2025,2962396.0,2025-02-26,2025-03-05-1332,
458,DEPARTMENT OF STATE,2/26/2025,2961849.0,2025-02-26,2025-03-05-1332,
459,DEPARTMENT OF STATE,2/26/2025,2961500.0,2025-02-26,2025-03-05-1332,
460,DEPARTMENT OF STATE,2/26/2025,2959500.0,2025-02-26,2025-03-05-1332,
461,DEPARTMENT OF STATE,2/26/2025,2950273.0,2025-02-26,2025-03-05-1332,
462,DEPARTMENT OF STATE,2/26/2025,2937678.0,2025-02-26,2025-03-05-1332,
463,DEPARTMENT OF STATE,2/26/2025,2935000.0,2025-02-26,2025-03-05-1332,
464,DEPARTMENT OF STATE,2/26/2025,2919988.3,2025-02-26,2025-03-05-1332,
465,DEPARTMENT OF STATE,2/26/2025,2912844.0,2025-02-26,2025-03-05-1332,
466,DEPARTMENT OF STATE,2/26/2025,2910830.0,2025-02-26,2025-03-05-1332,
467,DEPARTMENT OF STATE,2/26/2025,2882715.0,2025-02-26,2025-03-05-1332,
468,DEPARTMENT OF STATE,2/26/2025,2863075.0,2025-02-26,2025-03-05-1332,
469,DEPARTMENT OF STATE,2/26/2025,2732760.0,2025-02-26,2025-03-05-1332,
470,DEPARTMENT OF STATE,2/26/2025,2700000.0,2025-02-26,2025-03-05-1332,
471,DEPARTMENT OF STATE,2/26/2025,2696334.0,2025-02-26,2025-03-05-1332,
472,DEPARTMENT OF STATE,2/26/2025,2637000.0,2025-02-26,2025-03-05-1332,
473,DEPARTMENT OF STATE,2/26/2025,2634231.0,2025-02-26,2025-03-05-1332,
474,DEPARTMENT OF STATE,2/26/2025,2618023.68,2025-02-26,2025-03-05-1332,
475,DEPARTMENT OF STATE,2/26/2025,2601977.0,2025-02-26,2025-03-05-1332,
476,DEPARTMENT OF STATE,2/26/2025,2599951.0,2025-02-26,2025-03-05-1332,
477,DEPARTMENT OF STATE,2/26/2025,2589506.0,2025-02-26,2025-03-05-1332,
478,DEPARTMENT OF STATE,2/26/2025,2577419.0,2025-02-26,2025-03-05-1332,
479,DEPARTMENT OF STATE,2/26/2025,2576000.0,2025-02-26,2025-03-05-1332,
480,DEPARTMENT OF STATE,2/26/2025,2575000.0,2025-02-26,2025-03-05-1332,
481,DEPARTMENT OF STATE,2/26/2025,2568790.0,2025-02-26,2025-03-05-1332,
482,DEPARTMENT OF STATE,2/26/2025,2561100.0,2025-02-26,2025-03-05-1332,
483,DEPARTMENT OF STATE,2/26/2025,2530860.0,2025-02-26,2025-03-05-1332,
484,DEPARTMENT OF STATE,2/26/2025,2498123.0,2025-02-26,2025-03-05-1332,
485,DEPARTMENT OF STATE,2/26/2025,2469135.0,2025-02-26,2025-03-05-1332,
486,DEPARTMENT OF STATE,2/26/2025,2467280.0,2025-02-26,2025-03-05-1332,
487,DEPARTMENT OF STATE,2/26/2025,2453223.0,2025-02-26,2025-03-05-1332,
488,DEPARTMENT OF STATE,2/26/2025,2448492.0,2025-02-26,2025-03-05-1332,
489,DEPARTMENT OF STATE,2/26/2025,2446452.0,2025-02-26,2025-03-05-1332,
490,DEPARTMENT OF STATE,2/26/2025,2434835.0,2025-02-26,2025-03-05-1332,
491,DEPARTMENT OF STATE,2/26/2025,2432000.0,2025-02-26,2025-03-05-1332,
492,DEPARTMENT OF STATE,2/26/2025,3640000.0,2025-02-26,2025-03-05-1332,
493,DEPARTMENT OF STATE,2/26/2025,2420597.0,2025-02-26,2025-03-05-1332,
494,DEPARTMENT OF STATE,2/26/2025,2414000.0,2025-02-26,2025-03-05-1332,
495,DEPARTMENT OF STATE,2/26/2025,2407060.0,2025-02-26,2025-03-05-1332,
496,DEPARTMENT OF STATE,2/26/2025,2390369.0,2025-02-26,2025-03-05-1332,
497,DEPARTMENT OF STATE,2/26/2025,2385000.0,2025-02-26,2025-03-05-1332,
498,DEPARTMENT OF STATE,2/26/2025,2373575.0,2025-02-26,2025-03-05-1332,
499,DEPARTMENT OF STATE,2/26/2025,2368000.0,2025-02-26,2025-03-05-1332,
500,DEPARTMENT OF STATE,2/26/2025,2348446.0,2025-02-26,2025-03-05-1332,
501,DEPARTMENT OF STATE,2/26/2025,2338320.0,2025-02-26,2025-03-05-1332,
502,DEPARTMENT OF STATE,2/26/2025,2329219.0,2025-02-26,2025-03-05-1332,
503,DEPARTMENT OF STATE,2/26/2025,2303077.0,2025-02-26,2025-03-05-1332,
504,DEPARTMENT OF STATE,2/26/2025,2301911.0,2025-02-26,2025-03-05-1332,
505,DEPARTMENT OF STATE,2/26/2025,2301409.0,2025-02-26,2025-03-05-1332,
506,DEPARTMENT OF STATE,2/26/2025,2300094.0,2025-02-26,2025-03-05-1332,
507,DEPARTMENT OF STATE,2/26/2025,2300000.0,2025-02-26,2025-03-05-1332,
508,DEPARTMENT OF STATE,2/26/2025,2299778.3,2025-02-26,2025-03-05-1332,
509,DEPARTMENT OF STATE,2/26/2025,2281481.0,2025-02-26,2025-03-05-1332,
510,DEPARTMENT OF STATE,2/26/2025,2276628.0,2025-02-26,2025-03-05-1332,
511,DEPARTMENT OF STATE,2/26/2025,2276160.0,2025-02-26,2025-03-05-1332,
512,DEPARTMENT OF STATE,2/26/2025,2221235.0,2025-02-26,2025-03-05-1332,
513,DEPARTMENT OF STATE,2/26/2025,2211824.0,2025-02-26,2025-03-05-1332,
514,DEPARTMENT OF STATE,2/26/2025,2211616.0,2025-02-26,2025-03-05-1332,
515,DEPARTMENT OF STATE,2/26/2025,2198875.89,2025-02-26,2025-03-05-1332,
516,DEPARTMENT OF STATE,2/26/2025,2192919.0,2025-02-26,2025-03-05-1332,
517,DEPARTMENT OF STATE,2/26/2025,2182095.0,2025-02-26,2025-03-05-1332,
518,DEPARTMENT OF STATE,2/26/2025,2170993.0,2025-02-26,2025-03-05-1332,
519,DEPARTMENT OF STATE,2/26/2025,2170300.0,2025-02-26,2025-03-05-1332,
520,DEPARTMENT OF STATE,2/26/2025,2162675.0,2025-02-26,2025-03-05-1332,
521,DEPARTMENT OF STATE,2/26/2025,2124000.0,2025-02-26,2025-03-05-1332,
522,DEPARTMENT OF STATE,2/26/2025,2120493.0,2025-02-26,2025-03-05-1332,
523,DEPARTMENT OF STATE,2/26/2025,2120060.0,2025-02-26,2025-03-05-1332,
524,DEPARTMENT OF STATE,2/26/2025,2119944.0,2025-02-26,2025-03-05-1332,
525,DEPARTMENT OF STATE,2/26/2025,2103090.0,2025-02-26,2025-03-05-1332,
526,DEPARTMENT OF STATE,2/26/2025,2082734.0,2025-02-26,2025-03-05-1332,
527,DEPARTMENT OF STATE,2/26/2025,2077370.0,2025-02-26,2025-03-05-1332,
528,DEPARTMENT OF STATE,2/26/2025,2075000.0,2025-02-26,2025-03-05-1332,
529,DEPARTMENT OF STATE,2/26/2025,2073505.0,2025-02-26,2025-03-05-1332,
530,DEPARTMENT OF STATE,2/26/2025,2072928.9,2025-02-26,2025-03-05-1332,
531,DEPARTMENT OF STATE,2/26/2025,2070358.0,2025-02-26,2025-03-05-1332,
532,DEPARTMENT OF STATE,2/26/2025,2069335.37,2025-02-26,2025-03-05-1332,
533,DEPARTMENT OF STATE,2/26/2025,2055900.0,2025-02-26,2025-03-05-1332,
534,DEPARTMENT OF STATE,2/26/2025,2055414.71,2025-02-26,2025-03-05-1332,
535,DEPARTMENT OF STATE,2/26/2025,2053863.0,2025-02-26,2025-03-05-1332,
536,DEPARTMENT OF STATE,2/26/2025,2048416.0,2025-02-26,2025-03-05-1332,
537,DEPARTMENT OF STATE,2/26/2025,2020799.0,2025-02-26,2025-03-05-1332,
538,DEPARTMENT OF STATE,2/26/2025,2020768.0,2025-02-26,2025-03-05-1332,
539,DEPARTMENT OF STATE,2/26/2025,2020030.0,2025-02-26,2025-03-05-1332,
540,DEPARTMENT OF STATE,2/26/2025,2002343.0,2025-02-26,2025-03-05-1332,
541,DEPARTMENT OF STATE,2/26/2025,2962808.0,2025-02-26,2025-03-05-1332,
542,DEPARTMENT OF STATE,2/26/2025,1999999.35,2025-02-26,2025-03-05-1332,
543,DEPARTMENT OF STATE,2/26/2025,1999981.0,2025-02-26,2025-03-05-1332,
544,DEPARTMENT OF STATE,2/26/2025,1999720.0,2025-02-26,2025-03-05-1332,
545,DEPARTMENT OF STATE,2/26/2025,1996311.0,2025-02-26,2025-03-05-1332,
546,DEPARTMENT OF STATE,2/26/2025,1989694.32,2025-02-26,2025-03-05-1332,
547,DEPARTMENT OF STATE,2/26/2025,2900000.0,2025-02-26,2025-03-05-1332,
548,DEPARTMENT OF STATE,2/26/2025,1987206.0,2025-02-26,2025-03-05-1332,
549,DEPARTMENT OF STATE,2/26/2025,1986110.0,2025-02-26,2025-03-05-1332,
550,DEPARTMENT OF STATE,2/26/2025,1983288.0,2025-02-26,2025-03-05-1332,
551,DEPARTMENT OF STATE,2/26/2025,1975308.0,2025-02-26,2025-03-05-1332,
552,DEPARTMENT OF STATE,2/26/2025,1975305.0,2025-02-26,2025-03-05-1332,
553,DEPARTMENT OF STATE,2/26/2025,1975300.0,2025-02-26,2025-03-05-1332,
554,DEPARTMENT OF STATE,2/26/2025,1975000.0,2025-02-26,2025-03-05-1332,
555,DEPARTMENT OF STATE,2/26/2025,1974794.0,2025-02-26,2025-03-05-1332,
556,DEPARTMENT OF STATE,2/26/2025,1974590.0,2025-02-26,2025-03-05-1332,
557,DEPARTMENT OF STATE,2/26/2025,1973358.0,2025-02-26,2025-03-05-1332,
558,DEPARTMENT OF STATE,2/26/2025,1969991.0,2025-02-26,2025-03-05-1332,
559,DEPARTMENT OF STATE,2/26/2025,1969750.0,2025-02-26,2025-03-05-1332,
560,DEPARTMENT OF STATE,2/26/2025,1961389.0,2025-02-26,2025-03-05-1332,
561,DEPARTMENT OF STATE,2/26/2025,1950000.0,2025-02-26,2025-03-05-1332,
562,DEPARTMENT OF STATE,2/26/2025,1947890.0,2025-02-26,2025-03-05-1332,
563,DEPARTMENT OF STATE,2/26/2025,1947472.0,2025-02-26,2025-03-05-1332,
564,DEPARTMENT OF STATE,2/26/2025,1940000.0,2025-02-26,2025-03-05-1332,
565,DEPARTMENT OF STATE,2/26/2025,1939461.0,2025-02-26,2025-03-05-1332,
566,DEPARTMENT OF STATE,2/26/2025,1938972.0,2025-02-26,2025-03-05-1332,
567,DEPARTMENT OF STATE,2/26/2025,1938907.0,2025-02-26,2025-03-05-1332,
568,DEPARTMENT OF STATE,2/26/2025,1925925.0,2025-02-26,2025-03-05-1332,
569,DEPARTMENT OF STATE,2/26/2025,1924995.0,2025-02-26,2025-03-05-1332,
570,DEPARTMENT OF STATE,2/26/2025,1920510.0,2025-02-26,2025-03-05-1332,
571,DEPARTMENT OF STATE,2/26/2025,1914000.0,2025-02-26,2025-03-05-1332,
572,DEPARTMENT OF STATE,2/26/2025,1908827.0,2025-02-26,2025-03-05-1332,
573,DEPARTMENT OF STATE,2/26/2025,2667552.0,2025-02-26,2025-03-05-1332,
574,DEPARTMENT OF STATE,2/26/2025,1899982.92,2025-02-26,2025-03-05-1332,
575,DEPARTMENT OF STATE,2/26/2025,1899947.0,2025-02-26,2025-03-05-1332,
576,DEPARTMENT OF STATE,2/26/2025,1892839.0,2025-02-26,2025-03-05-1332,
577,DEPARTMENT OF STATE,2/26/2025,1891134.0,2025-02-26,2025-03-05-1332,
578,DEPARTMENT OF STATE,2/26/2025,1879489.0,2025-02-26,2025-03-05-1332,
579,DEPARTMENT OF STATE,2/26/2025,1876543.0,2025-02-26,2025-03-05-1332,
580,DEPARTMENT OF STATE,2/26/2025,1876540.0,2025-02-26,2025-03-05-1332,
581,DEPARTMENT OF STATE,2/26/2025,1875661.0,2025-02-26,2025-03-05-1332,
582,DEPARTMENT OF STATE,2/26/2025,1857862.0,2025-02-26,2025-03-05-1332,
583,DEPARTMENT OF STATE,2/26/2025,1856145.0,2025-02-26,2025-03-05-1332,
584,DEPARTMENT OF STATE,2/26/2025,1854957.0,2025-02-26,2025-03-05-1332,
585,DEPARTMENT OF STATE,2/26/2025,1854449.0,2025-02-26,2025-03-05-1332,
586,DEPARTMENT OF STATE,2/26/2025,1854000.0,2025-02-26,2025-03-05-1332,
587,DEPARTMENT OF STATE,2/26/2025,1852301.0,2025-02-26,2025-03-05-1332,
588,DEPARTMENT OF STATE,2/26/2025,1848868.0,2025-02-26,2025-03-05-1332,
589,DEPARTMENT OF STATE,2/26/2025,1832305.0,2025-02-26,2025-03-05-1332,
590,DEPARTMENT OF STATE,2/26/2025,1830198.0,2025-02-26,2025-03-05-1332,
591,DEPARTMENT OF STATE,2/26/2025,1826465.0,2025-02-26,2025-03-05-1332,
592,DEPARTMENT OF STATE,2/26/2025,1822987.0,2025-02-26,2025-03-05-1332,
593,DEPARTMENT OF STATE,2/26/2025,1805843.0,2025-02-26,2025-03-05-1332,
594,DEPARTMENT OF STATE,2/26/2025,1790733.2,2025-02-26,2025-03-05-1332,
595,DEPARTMENT OF STATE,2/26/2025,1784408.0,2025-02-26,2025-03-05-1332,
596,DEPARTMENT OF STATE,2/26/2025,1780138.0,2025-02-26,2025-03-05-1332,
597,DEPARTMENT OF STATE,2/26/2025,1779174.0,2025-02-26,2025-03-05-1332,
598,DEPARTMENT OF STATE,2/26/2025,1777776.0,2025-02-26,2025-03-05-1332,
599,DEPARTMENT OF STATE,2/26/2025,1776854.0,2025-02-26,2025-03-05-1332,
600,DEPARTMENT OF STATE,2/26/2025,1776023.0,2025-02-26,2025-03-05-1332,
601,DEPARTMENT OF STATE,2/26/2025,1745802.0,2025-02-26,2025-03-05-1332,
602,DEPARTMENT OF STATE,2/26/2025,1740000.0,2025-02-26,2025-03-05-1332,
603,DEPARTMENT OF STATE,2/26/2025,1737654.0,2025-02-26,2025-03-05-1332,
604,DEPARTMENT OF STATE,2/26/2025,1735000.0,2025-02-26,2025-03-05-1332,
605,DEPARTMENT OF STATE,2/26/2025,1728150.0,2025-02-26,2025-03-05-1332,
606,DEPARTMENT OF STATE,2/26/2025,1727375.0,2025-02-26,2025-03-05-1332,
607,DEPARTMENT OF STATE,2/26/2025,1725654.0,2025-02-26,2025-03-05-1332,
608,DEPARTMENT OF STATE,2/26/2025,1688438.0,2025-02-26,2025-03-05-1332,
609,DEPARTMENT OF STATE,2/26/2025,1685000.0,2025-02-26,2025-03-05-1332,
610,DEPARTMENT OF STATE,2/26/2025,1680864.0,2025-02-26,2025-03-05-1332,
611,DEPARTMENT OF STATE,2/26/2025,1663062.57,2025-02-26,2025-03-05-1332,
612,DEPARTMENT OF STATE,2/26/2025,1652027.0,2025-02-26,2025-03-05-1332,
613,DEPARTMENT OF STATE,2/26/2025,1650000.0,2025-02-26,2025-03-05-1332,
614,DEPARTMENT OF STATE,2/26/2025,1642510.0,2025-02-26,2025-03-05-1332,
615,DEPARTMENT OF STATE,2/26/2025,1641000.0,2025-02-26,2025-03-05-1332,
616,DEPARTMENT OF STATE,2/26/2025,1637513.0,2025-02-26,2025-03-05-1332,
617,DEPARTMENT OF STATE,2/26/2025,1629625.0,2025-02-26,2025-03-05-1332,
618,DEPARTMENT OF STATE,2/26/2025,1628751.0,2025-02-26,2025-03-05-1332,
619,DEPARTMENT OF STATE,2/26/2025,1626908.0,2025-02-26,2025-03-05-1332,
620,DEPARTMENT OF STATE,2/26/2025,1603942.32,2025-02-26,2025-03-05-1332,
621,DEPARTMENT OF STATE,2/26/2025,1584205.0,2025-02-26,2025-03-05-1332,
622,DEPARTMENT OF STATE,2/26/2025,1583030.0,2025-02-26,2025-03-05-1332,
623,DEPARTMENT OF STATE,2/26/2025,1579419.0,2025-02-26,2025-03-05-1332,
624,DEPARTMENT OF STATE,2/26/2025,1558642.0,2025-02-26,2025-03-05-1332,
625,DEPARTMENT OF STATE,2/26/2025,1556642.0,2025-02-26,2025-03-05-1332,
626,DEPARTMENT OF STATE,2/26/2025,1550000.0,2025-02-26,2025-03-05-1332,
627,DEPARTMENT OF STATE,2/26/2025,1537836.45,2025-02-26,2025-03-05-1332,
628,DEPARTMENT OF STATE,2/26/2025,1530374.0,2025-02-26,2025-03-05-1332,
629,DEPARTMENT OF STATE,2/26/2025,1511991.0,2025-02-26,2025-03-05-1332,
630,DEPARTMENT OF STATE,2/26/2025,1511150.0,2025-02-26,2025-03-05-1332,
631,DEPARTMENT OF STATE,2/26/2025,1507500.0,2025-02-26,2025-03-05-1332,
632,DEPARTMENT OF STATE,2/26/2025,2424725.0,2025-02-26,2025-03-05-1332,
633,DEPARTMENT OF STATE,2/26/2025,2349967.0,2025-02-26,2025-03-05-1332,
634,DEPARTMENT OF STATE,2/26/2025,1499939.0,2025-02-26,2025-03-05-1332,
635,DEPARTMENT OF STATE,2/26/2025,1499888.0,2025-02-26,2025-03-05-1332,
636,DEPARTMENT OF STATE,2/26/2025,1495061.0,2025-02-26,2025-03-05-1332,
637,DEPARTMENT OF STATE,2/26/2025,1490989.0,2025-02-26,2025-03-05-1332,
638,DEPARTMENT OF STATE,2/26/2025,1487500.0,2025-02-26,2025-03-05-1332,
639,DEPARTMENT OF STATE,2/26/2025,1486110.0,2025-02-26,2025-03-05-1332,
640,DEPARTMENT OF STATE,2/26/2025,1485000.0,2025-02-26,2025-03-05-1332,
641,DEPARTMENT OF STATE,2/26/2025,1484000.0,2025-02-26,2025-03-05-1332,
642,DEPARTMENT OF STATE,2/26/2025,1483690.0,2025-02-26,2025-03-05-1332,
643,DEPARTMENT OF STATE,2/26/2025,1481480.0,2025-02-26,2025-03-05-1332,
644,DEPARTMENT OF STATE,2/26/2025,1481466.67,2025-02-26,2025-03-05-1332,
645,DEPARTMENT OF STATE,2/26/2025,1481250.0,2025-02-26,2025-03-05-1332,
646,DEPARTMENT OF STATE,2/26/2025,1480993.0,2025-02-26,2025-03-05-1332,
647,DEPARTMENT OF STATE,2/26/2025,1480785.0,2025-02-26,2025-03-05-1332,
648,DEPARTMENT OF STATE,2/26/2025,1480740.0,2025-02-26,2025-03-05-1332,
649,DEPARTMENT OF STATE,2/26/2025,1480625.0,2025-02-26,2025-03-05-1332,
650,DEPARTMENT OF STATE,2/26/2025,1480019.73,2025-02-26,2025-03-05-1332,
651,DEPARTMENT OF STATE,2/26/2025,1479387.0,2025-02-26,2025-03-05-1332,
652,DEPARTMENT OF STATE,2/26/2025,1478324.0,2025-02-26,2025-03-05-1332,
653,DEPARTMENT OF STATE,2/26/2025,1475898.07,2025-02-26,2025-03-05-1332,
654,DEPARTMENT OF STATE,2/26/2025,1470000.0,2025-02-26,2025-03-05-1332,
655,DEPARTMENT OF STATE,2/26/2025,1464945.0,2025-02-26,2025-03-05-1332,
656,DEPARTMENT OF STATE,2/26/2025,1462945.0,2025-02-26,2025-03-05-1332,
657,DEPARTMENT OF STATE,2/26/2025,1457204.0,2025-02-26,2025-03-05-1332,
658,DEPARTMENT OF STATE,2/26/2025,1454835.0,2025-02-26,2025-03-05-1332,
659,DEPARTMENT OF STATE,2/26/2025,1449724.0,2025-02-26,2025-03-05-1332,
660,DEPARTMENT OF STATE,2/26/2025,1442592.0,2025-02-26,2025-03-05-1332,
661,DEPARTMENT OF STATE,2/26/2025,1440000.0,2025-02-26,2025-03-05-1332,
662,DEPARTMENT OF STATE,2/26/2025,1439000.0,2025-02-26,2025-03-05-1332,
663,DEPARTMENT OF STATE,2/26/2025,1434422.0,2025-02-26,2025-03-05-1332,
664,DEPARTMENT OF STATE,2/26/2025,1431945.0,2025-02-26,2025-03-05-1332,
665,DEPARTMENT OF STATE,2/26/2025,1431756.0,2025-02-26,2025-03-05-1332,
666,DEPARTMENT OF STATE,2/26/2025,1431752.0,2025-02-26,2025-03-05-1332,
667,DEPARTMENT OF STATE,2/26/2025,1431415.0,2025-02-26,2025-03-05-1332,
668,DEPARTMENT OF STATE,2/26/2025,1425000.0,2025-02-26,2025-03-05-1332,
669,DEPARTMENT OF STATE,2/26/2025,1424490.0,2025-02-26,2025-03-05-1332,
670,DEPARTMENT OF STATE,2/26/2025,1415821.0,2025-02-26,2025-03-05-1332,
671,DEPARTMENT OF STATE,2/26/2025,1412390.0,2025-02-26,2025-03-05-1332,
672,DEPARTMENT OF STATE,2/26/2025,2145375.0,2025-02-26,2025-03-05-1332,
673,DEPARTMENT OF STATE,2/26/2025,1404796.0,2025-02-26,2025-03-05-1332,
674,DEPARTMENT OF STATE,2/26/2025,1390000.0,2025-02-26,2025-03-05-1332,
675,DEPARTMENT OF STATE,2/26/2025,1388888.0,2025-02-26,2025-03-05-1332,
676,DEPARTMENT OF STATE,2/26/2025,1382965.0,2025-02-26,2025-03-05-1332,
677,DEPARTMENT OF STATE,2/26/2025,1379650.0,2025-02-26,2025-03-05-1332,
678,DEPARTMENT OF STATE,2/26/2025,1375000.0,2025-02-26,2025-03-05-1332,
679,DEPARTMENT OF STATE,2/26/2025,1364778.0,2025-02-26,2025-03-05-1332,
680,DEPARTMENT OF STATE,2/26/2025,1360889.0,2025-02-26,2025-03-05-1332,
681,DEPARTMENT OF STATE,2/26/2025,1358259.0,2025-02-26,2025-03-05-1332,
682,DEPARTMENT OF STATE,2/26/2025,1357760.0,2025-02-26,2025-03-05-1332,
683,DEPARTMENT OF STATE,2/26/2025,1987540.0,2025-02-26,2025-03-05-1332,
684,DEPARTMENT OF STATE,2/26/2025,1333330.0,2025-02-26,2025-03-05-1332,
685,DEPARTMENT OF STATE,2/26/2025,1317564.0,2025-02-26,2025-03-05-1332,
686,DEPARTMENT OF STATE,2/26/2025,1309514.0,2025-02-26,2025-03-05-1332,
687,DEPARTMENT OF STATE,2/26/2025,1299674.0,2025-02-26,2025-03-05-1332,
688,DEPARTMENT OF STATE,2/26/2025,1298000.0,2025-02-26,2025-03-05-1332,
689,DEPARTMENT OF STATE,2/26/2025,1293165.0,2025-02-26,2025-03-05-1332,
690,DEPARTMENT OF STATE,2/26/2025,1286594.0,2025-02-26,2025-03-05-1332,
691,DEPARTMENT OF STATE,2/26/2025,1284000.0,2025-02-26,2025-03-05-1332,
692,DEPARTMENT OF STATE,2/26/2025,1282683.0,2025-02-26,2025-03-05-1332,
693,DEPARTMENT OF STATE,2/26/2025,1281402.0,2025-02-26,2025-03-05-1332,
694,DEPARTMENT OF STATE,2/26/2025,1278000.0,2025-02-26,2025-03-05-1332,
695,DEPARTMENT OF STATE,2/26/2025,1271611.0,2025-02-26,2025-03-05-1332,
696,DEPARTMENT OF STATE,2/26/2025,1270818.0,2025-02-26,2025-03-05-1332,
697,DEPARTMENT OF STATE,2/26/2025,1262547.0,2025-02-26,2025-03-05-1332,
698,DEPARTMENT OF STATE,2/26/2025,1900000.0,2025-02-26,2025-03-05-1332,
699,DEPARTMENT OF STATE,2/26/2025,1259062.5,2025-02-26,2025-03-05-1332,
700,DEPARTMENT OF STATE,2/26/2025,1256975.0,2025-02-26,2025-03-05-1332,
701,DEPARTMENT OF STATE,2/26/2025,1252401.0,2025-02-26,2025-03-05-1332,
702,DEPARTMENT OF STATE,2/26/2025,493250.0,2025-02-26,2025-03-05-1332,
703,DEPARTMENT OF STATE,2/26/2025,1787500.0,2025-02-26,2025-03-05-1332,
704,DEPARTMENT OF STATE,2/26/2025,1246174.0,2025-02-26,2025-03-05-1332,
705,DEPARTMENT OF STATE,2/26/2025,1556420.0,2025-02-26,2025-03-05-1332,
706,DEPARTMENT OF STATE,2/26/2025,1234490.0,2025-02-26,2025-03-05-1332,
707,DEPARTMENT OF STATE,2/26/2025,1234079.0,2025-02-26,2025-03-05-1332,
708,DEPARTMENT OF STATE,2/26/2025,1233350.0,2025-02-26,2025-03-05-1332,
709,DEPARTMENT OF STATE,2/26/2025,1233335.0,2025-02-26,2025-03-05-1332,
710,DEPARTMENT OF STATE,2/26/2025,1230495.0,2025-02-26,2025-03-05-1332,
711,DEPARTMENT OF STATE,2/26/2025,1214975.0,2025-02-26,2025-03-05-1332,
712,DEPARTMENT OF STATE,2/26/2025,1203521.0,2025-02-26,2025-03-05-1332,
713,DEPARTMENT OF STATE,2/26/2025,1199999.0,2025-02-26,2025-03-05-1332,
714,DEPARTMENT OF STATE,2/26/2025,1199000.0,2025-02-26,2025-03-05-1332,
715,DEPARTMENT OF STATE,2/26/2025,1185122.0,2025-02-26,2025-03-05-1332,
716,DEPARTMENT OF STATE,2/26/2025,1174999.0,2025-02-26,2025-03-05-1332,
717,DEPARTMENT OF STATE,2/26/2025,1167089.0,2025-02-26,2025-03-05-1332,
718,DEPARTMENT OF STATE,2/26/2025,1155000.0,2025-02-26,2025-03-05-1332,
719,DEPARTMENT OF STATE,2/26/2025,1147740.0,2025-02-26,2025-03-05-1332,
720,DEPARTMENT OF STATE,2/26/2025,1147122.0,2025-02-26,2025-03-05-1332,
721,DEPARTMENT OF STATE,2/26/2025,1145000.0,2025-02-26,2025-03-05-1332,
722,DEPARTMENT OF STATE,2/26/2025,1135740.0,2025-02-26,2025-03-05-1332,
723,DEPARTMENT OF STATE,2/26/2025,1135355.0,2025-02-26,2025-03-05-1332,
724,DEPARTMENT OF STATE,2/26/2025,1130000.0,2025-02-26,2025-03-05-1332,
725,DEPARTMENT OF STATE,2/26/2025,1128133.0,2025-02-26,2025-03-05-1332,
726,DEPARTMENT OF STATE,2/26/2025,1126498.0,2025-02-26,2025-03-05-1332,
727,DEPARTMENT OF STATE,2/26/2025,1125000.0,2025-02-26,2025-03-05-1332,
728,DEPARTMENT OF STATE,2/26/2025,1123766.0,2025-02-26,2025-03-05-1332,
729,DEPARTMENT OF STATE,2/26/2025,1105325.0,2025-02-26,2025-03-05-1332,
730,DEPARTMENT OF STATE,2/26/2025,1100281.46,2025-02-26,2025-03-05-1332,
731,DEPARTMENT OF STATE,2/26/2025,1098701.0,2025-02-26,2025-03-05-1332,
732,DEPARTMENT OF STATE,2/26/2025,1095378.0,2025-02-26,2025-03-05-1332,
733,DEPARTMENT OF STATE,2/26/2025,1086243.0,2025-02-26,2025-03-05-1332,
734,DEPARTMENT OF STATE,2/26/2025,1075000.0,2025-02-26,2025-03-05-1332,
735,DEPARTMENT OF STATE,2/26/2025,1071707.0,2025-02-26,2025-03-05-1332,
736,DEPARTMENT OF STATE,2/26/2025,1070731.0,2025-02-26,2025-03-05-1332,
737,DEPARTMENT OF STATE,2/26/2025,1070000.0,2025-02-26,2025-03-05-1332,
738,DEPARTMENT OF STATE,2/26/2025,1060000.0,2025-02-26,2025-03-05-1332,
739,DEPARTMENT OF STATE,2/26/2025,1059958.0,2025-02-26,2025-03-05-1332,
740,DEPARTMENT OF STATE,2/26/2025,1056158.0,2025-02-26,2025-03-05-1332,
741,DEPARTMENT OF STATE,2/26/2025,1987654.0,2025-02-26,2025-03-05-1332,
742,DEPARTMENT OF STATE,2/26/2025,1045250.0,2025-02-26,2025-03-05-1332,
743,DEPARTMENT OF STATE,2/26/2025,1045193.0,2025-02-26,2025-03-05-1332,
744,DEPARTMENT OF STATE,2/26/2025,1041860.0,2025-02-26,2025-03-05-1332,
745,DEPARTMENT OF STATE,2/26/2025,1032253.04,2025-02-26,2025-03-05-1332,
746,DEPARTMENT OF STATE,2/26/2025,1027940.0,2025-02-26,2025-03-05-1332,
747,DEPARTMENT OF STATE,2/26/2025,1027159.0,2025-02-26,2025-03-05-1332,
748,DEPARTMENT OF STATE,2/26/2025,1025000.0,2025-02-26,2025-03-05-1332,
749,DEPARTMENT OF STATE,2/26/2025,1008823.0,2025-02-26,2025-03-05-1332,
750,DEPARTMENT OF STATE,2/26/2025,1499219.0,2025-02-26,2025-03-05-1332,
751,DEPARTMENT OF STATE,2/26/2025,1409689.6,2025-02-26,2025-03-05-1332,
752,DEPARTMENT OF STATE,2/26/2025,1260549.0,2025-02-26,2025-03-05-1332,
753,DEPARTMENT OF STATE,2/26/2025,1450000.0,2025-02-26,2025-03-05-1332,
754,DEPARTMENT OF STATE,2/26/2025,999999.0,2025-02-26,2025-03-05-1332,
755,DEPARTMENT OF STATE,2/26/2025,999998.0,2025-02-26,2025-03-05-1332,
756,DEPARTMENT OF STATE,2/26/2025,999962.04,2025-02-26,2025-03-05-1332,
757,DEPARTMENT OF STATE,2/26/2025,999960.0,2025-02-26,2025-03-05-1332,
758,DEPARTMENT OF STATE,2/26/2025,999465.54,2025-02-26,2025-03-05-1332,
759,DEPARTMENT OF STATE,2/26/2025,999172.0,2025-02-26,2025-03-05-1332,
760,DEPARTMENT OF STATE,2/26/2025,996500.0,2025-02-26,2025-03-05-1332,
761,DEPARTMENT OF STATE,2/26/2025,996486.86,2025-02-26,2025-03-05-1332,
762,DEPARTMENT OF STATE,2/26/2025,994991.32,2025-02-26,2025-03-05-1332,
763,DEPARTMENT OF STATE,2/26/2025,992099.0,2025-02-26,2025-03-05-1332,
764,DEPARTMENT OF STATE,2/26/2025,987653.55,2025-02-26,2025-03-05-1332,
765,DEPARTMENT OF STATE,2/26/2025,987562.0,2025-02-26,2025-03-05-1332,
766,DEPARTMENT OF STATE,2/26/2025,987540.0,2025-02-26,2025-03-05-1332,
767,DEPARTMENT OF STATE,2/26/2025,987522.0,2025-02-26,2025-03-05-1332,
768,DEPARTMENT OF STATE,2/26/2025,987409.0,2025-02-26,2025-03-05-1332,
769,DEPARTMENT OF STATE,2/26/2025,987166.0,2025-02-26,2025-03-05-1332,
770,DEPARTMENT OF STATE,2/26/2025,987163.0,2025-02-26,2025-03-05-1332,
771,DEPARTMENT OF STATE,2/26/2025,987161.0,2025-02-26,2025-03-05-1332,
772,DEPARTMENT OF STATE,2/26/2025,987000.0,2025-02-26,2025-03-05-1332,
773,DEPARTMENT OF STATE,2/26/2025,986679.0,2025-02-26,2025-03-05-1332,
774,DEPARTMENT OF STATE,2/26/2025,985007.0,2025-02-26,2025-03-05-1332,
775,DEPARTMENT OF STATE,2/26/2025,983666.0,2025-02-26,2025-03-05-1332,
776,DEPARTMENT OF STATE,2/26/2025,983527.0,2025-02-26,2025-03-05-1332,
777,DEPARTMENT OF STATE,2/26/2025,983269.0,2025-02-26,2025-03-05-1332,
778,DEPARTMENT OF STATE,2/26/2025,979580.0,2025-02-26,2025-03-05-1332,
779,DEPARTMENT OF STATE,2/26/2025,978000.0,2025-02-26,2025-03-05-1332,
780,DEPARTMENT OF STATE,2/26/2025,975500.0,2025-02-26,2025-03-05-1332,
781,DEPARTMENT OF STATE,2/26/2025,975000.0,2025-02-26,2025-03-05-1332,
782,DEPARTMENT OF STATE,2/26/2025,970874.0,2025-02-26,2025-03-05-1332,
783,DEPARTMENT OF STATE,2/26/2025,969890.0,2025-02-26,2025-03-05-1332,
784,DEPARTMENT OF STATE,2/26/2025,964337.1,2025-02-26,2025-03-05-1332,
785,DEPARTMENT OF STATE,2/26/2025,954016.0,2025-02-26,2025-03-05-1332,
786,DEPARTMENT OF STATE,2/26/2025,951561.0,2025-02-26,2025-03-05-1332,
787,DEPARTMENT OF STATE,2/26/2025,949991.0,2025-02-26,2025-03-05-1332,
788,DEPARTMENT OF STATE,2/26/2025,944719.0,2025-02-26,2025-03-05-1332,
789,DEPARTMENT OF STATE,2/26/2025,943111.0,2025-02-26,2025-03-05-1332,
790,DEPARTMENT OF STATE,2/26/2025,940741.0,2025-02-26,2025-03-05-1332,
791,DEPARTMENT OF STATE,2/26/2025,939709.0,2025-02-26,2025-03-05-1332,
792,DEPARTMENT OF STATE,2/26/2025,934200.0,2025-02-26,2025-03-05-1332,
793,DEPARTMENT OF STATE,2/26/2025,932911.0,2025-02-26,2025-03-05-1332,
794,DEPARTMENT OF STATE,2/26/2025,932136.0,2025-02-26,2025-03-05-1332,
795,DEPARTMENT OF STATE,2/26/2025,928395.0,2025-02-26,2025-03-05-1332,
796,DEPARTMENT OF STATE,2/26/2025,925850.0,2025-02-26,2025-03-05-1332,
797,DEPARTMENT OF STATE,2/26/2025,925000.0,2025-02-26,2025-03-05-1332,
798,DEPARTMENT OF STATE,2/26/2025,919588.0,2025-02-26,2025-03-05-1332,
799,DEPARTMENT OF STATE,2/26/2025,916000.0,2025-02-26,2025-03-05-1332,
800,DEPARTMENT OF STATE,2/26/2025,914076.0,2025-02-26,2025-03-05-1332,
801,DEPARTMENT OF STATE,2/26/2025,909254.0,2025-02-26,2025-03-05-1332,
802,DEPARTMENT OF STATE,2/26/2025,901951.0,2025-02-26,2025-03-05-1332,
803,DEPARTMENT OF STATE,2/26/2025,901443.0,2025-02-26,2025-03-05-1332,
804,DEPARTMENT OF STATE,2/26/2025,900004.0,2025-02-26,2025-03-05-1332,
805,DEPARTMENT OF STATE,2/26/2025,899998.31,2025-02-26,2025-03-05-1332,
806,DEPARTMENT OF STATE,2/26/2025,893574.0,2025-02-26,2025-03-05-1332,
807,DEPARTMENT OF STATE,2/26/2025,891876.0,2025-02-26,2025-03-05-1332,
808,DEPARTMENT OF STATE,2/26/2025,890000.0,2025-02-26,2025-03-05-1332,
809,DEPARTMENT OF STATE,2/26/2025,888877.0,2025-02-26,2025-03-05-1332,
810,DEPARTMENT OF STATE,2/26/2025,887781.6,2025-02-26,2025-03-05-1332,
811,DEPARTMENT OF STATE,2/26/2025,887530.69,2025-02-26,2025-03-05-1332,
812,DEPARTMENT OF STATE,2/26/2025,883139.0,2025-02-26,2025-03-05-1332,
813,DEPARTMENT OF STATE,2/26/2025,875000.0,2025-02-26,2025-03-05-1332,
814,DEPARTMENT OF STATE,2/26/2025,874804.0,2025-02-26,2025-03-05-1332,
815,DEPARTMENT OF STATE,2/26/2025,869170.0,2025-02-26,2025-03-05-1332,
816,DEPARTMENT OF STATE,2/26/2025,869041.0,2025-02-26,2025-03-05-1332,
817,DEPARTMENT OF STATE,2/26/2025,868278.0,2025-02-26,2025-03-05-1332,
818,DEPARTMENT OF STATE,2/26/2025,865005.0,2025-02-26,2025-03-05-1332,
819,DEPARTMENT OF STATE,2/26/2025,864060.0,2025-02-26,2025-03-05-1332,
820,DEPARTMENT OF STATE,2/26/2025,860000.0,2025-02-26,2025-03-05-1332,
821,DEPARTMENT OF STATE,2/26/2025,855620.0,2025-02-26,2025-03-05-1332,
822,DEPARTMENT OF STATE,2/26/2025,848566.0,2025-02-26,2025-03-05-1332,
823,DEPARTMENT OF STATE,2/26/2025,845597.17,2025-02-26,2025-03-05-1332,
824,DEPARTMENT OF STATE,2/26/2025,843000.0,2025-02-26,2025-03-05-1332,
825,DEPARTMENT OF STATE,2/26/2025,839272.0,2025-02-26,2025-03-05-1332,
826,DEPARTMENT OF STATE,2/26/2025,838677.0,2025-02-26,2025-03-05-1332,
827,DEPARTMENT OF STATE,2/26/2025,824083.0,2025-02-26,2025-03-05-1332,
828,DEPARTMENT OF STATE,2/26/2025,820000.0,2025-02-26,2025-03-05-1332,
829,DEPARTMENT OF STATE,2/26/2025,816795.0,2025-02-26,2025-03-05-1332,
830,DEPARTMENT OF STATE,2/26/2025,815028.0,2025-02-26,2025-03-05-1332,
831,DEPARTMENT OF STATE,2/26/2025,1086196.0,2025-02-26,2025-03-05-1332,
832,DEPARTMENT OF STATE,2/26/2025,808086.0,2025-02-26,2025-03-05-1332,
833,DEPARTMENT OF STATE,2/26/2025,806995.0,2025-02-26,2025-03-05-1332,
834,DEPARTMENT OF STATE,2/26/2025,802066.0,2025-02-26,2025-03-05-1332,
835,DEPARTMENT OF STATE,2/26/2025,801450.0,2025-02-26,2025-03-05-1332,
836,DEPARTMENT OF STATE,2/26/2025,799999.0,2025-02-26,2025-03-05-1332,
837,DEPARTMENT OF STATE,2/26/2025,799976.01,2025-02-26,2025-03-05-1332,
838,DEPARTMENT OF STATE,2/26/2025,799959.0,2025-02-26,2025-03-05-1332,
839,DEPARTMENT OF STATE,2/26/2025,799855.0,2025-02-26,2025-03-05-1332,
840,DEPARTMENT OF STATE,2/26/2025,799614.0,2025-02-26,2025-03-05-1332,
841,DEPARTMENT OF STATE,2/26/2025,794620.0,2025-02-26,2025-03-05-1332,
842,DEPARTMENT OF STATE,2/26/2025,790120.0,2025-02-26,2025-03-05-1332,
843,DEPARTMENT OF STATE,2/26/2025,789343.0,2025-02-26,2025-03-05-1332,
844,DEPARTMENT OF STATE,2/26/2025,789177.0,2025-02-26,2025-03-05-1332,
845,DEPARTMENT OF STATE,2/26/2025,785053.0,2025-02-26,2025-03-05-1332,
846,DEPARTMENT OF STATE,2/26/2025,784825.0,2025-02-26,2025-03-05-1332,
847,DEPARTMENT OF STATE,2/26/2025,776919.0,2025-02-26,2025-03-05-1332,
848,DEPARTMENT OF STATE,2/26/2025,771441.0,2025-02-26,2025-03-05-1332,
849,DEPARTMENT OF STATE,2/26/2025,765000.0,2025-02-26,2025-03-05-1332,
850,DEPARTMENT OF STATE,2/26/2025,761665.0,2025-02-26,2025-03-05-1332,
851,DEPARTMENT OF STATE,2/26/2025,759067.0,2025-02-26,2025-03-05-1332,
852,DEPARTMENT OF STATE,2/26/2025,756000.0,2025-02-26,2025-03-05-1332,
853,DEPARTMENT OF STATE,2/26/2025,754951.1,2025-02-26,2025-03-05-1332,
854,DEPARTMENT OF STATE,2/26/2025,754480.0,2025-02-26,2025-03-05-1332,
855,DEPARTMENT OF STATE,2/26/2025,749996.0,2025-02-26,2025-03-05-1332,
856,DEPARTMENT OF STATE,2/26/2025,749932.0,2025-02-26,2025-03-05-1332,
857,DEPARTMENT OF STATE,2/26/2025,749918.12,2025-02-26,2025-03-05-1332,
858,DEPARTMENT OF STATE,2/26/2025,749890.0,2025-02-26,2025-03-05-1332,
859,DEPARTMENT OF STATE,2/26/2025,749358.0,2025-02-26,2025-03-05-1332,
860,DEPARTMENT OF STATE,2/26/2025,748374.0,2025-02-26,2025-03-05-1332,
861,DEPARTMENT OF STATE,2/26/2025,747583.21,2025-02-26,2025-03-05-1332,
862,DEPARTMENT OF STATE,2/26/2025,741887.0,2025-02-26,2025-03-05-1332,
863,DEPARTMENT OF STATE,2/26/2025,741300.0,2025-02-26,2025-03-05-1332,
864,DEPARTMENT OF STATE,2/26/2025,740644.0,2025-02-26,2025-03-05-1332,
865,DEPARTMENT OF STATE,2/26/2025,740335.0,2025-02-26,2025-03-05-1332,
866,DEPARTMENT OF STATE,2/26/2025,740009.0,2025-02-26,2025-03-05-1332,
867,DEPARTMENT OF STATE,2/26/2025,740000.0,2025-02-26,2025-03-05-1332,
868,DEPARTMENT OF STATE,2/26/2025,728804.0,2025-02-26,2025-03-05-1332,
869,DEPARTMENT OF STATE,2/26/2025,725000.0,2025-02-26,2025-03-05-1332,
870,DEPARTMENT OF STATE,2/26/2025,723389.0,2025-02-26,2025-03-05-1332,
871,DEPARTMENT OF STATE,2/26/2025,714853.0,2025-02-26,2025-03-05-1332,
872,DEPARTMENT OF STATE,2/26/2025,714237.0,2025-02-26,2025-03-05-1332,
873,DEPARTMENT OF STATE,2/26/2025,712803.0,2025-02-26,2025-03-05-1332,
874,DEPARTMENT OF STATE,2/26/2025,709450.0,2025-02-26,2025-03-05-1332,
875,DEPARTMENT OF STATE,2/26/2025,709140.0,2025-02-26,2025-03-05-1332,
876,DEPARTMENT OF STATE,2/26/2025,707832.0,2025-02-26,2025-03-05-1332,
877,DEPARTMENT OF STATE,2/26/2025,707000.0,2025-02-26,2025-03-05-1332,
878,DEPARTMENT OF STATE,2/26/2025,703645.0,2025-02-26,2025-03-05-1332,
879,DEPARTMENT OF STATE,2/26/2025,702308.0,2025-02-26,2025-03-05-1332,
880,DEPARTMENT OF STATE,2/26/2025,695018.0,2025-02-26,2025-03-05-1332,
881,DEPARTMENT OF STATE,2/26/2025,692295.0,2025-02-26,2025-03-05-1332,
882,DEPARTMENT OF STATE,2/26/2025,691250.0,2025-02-26,2025-03-05-1332,
883,DEPARTMENT OF STATE,2/26/2025,690009.0,2025-02-26,2025-03-05-1332,
884,DEPARTMENT OF STATE,2/26/2025,677726.0,2025-02-26,2025-03-05-1332,
885,DEPARTMENT OF STATE,2/26/2025,676384.0,2025-02-26,2025-03-05-1332,
886,DEPARTMENT OF STATE,2/26/2025,674000.0,2025-02-26,2025-03-05-1332,
887,DEPARTMENT OF STATE,2/26/2025,670547.0,2025-02-26,2025-03-05-1332,
888,DEPARTMENT OF STATE,2/26/2025,670000.0,2025-02-26,2025-03-05-1332,
889,DEPARTMENT OF STATE,2/26/2025,666969.0,2025-02-26,2025-03-05-1332,
890,DEPARTMENT OF STATE,2/26/2025,664930.0,2025-02-26,2025-03-05-1332,
891,DEPARTMENT OF STATE,2/26/2025,663704.0,2025-02-26,2025-03-05-1332,
892,DEPARTMENT OF STATE,2/26/2025,663266.45,2025-02-26,2025-03-05-1332,
893,DEPARTMENT OF STATE,2/26/2025,659961.0,2025-02-26,2025-03-05-1332,
894,DEPARTMENT OF STATE,2/26/2025,659486.0,2025-02-26,2025-03-05-1332,
895,DEPARTMENT OF STATE,2/26/2025,659032.0,2025-02-26,2025-03-05-1332,
896,DEPARTMENT OF STATE,2/26/2025,657665.0,2025-02-26,2025-03-05-1332,
897,DEPARTMENT OF STATE,2/26/2025,652675.0,2025-02-26,2025-03-05-1332,
898,DEPARTMENT OF STATE,2/26/2025,651477.0,2025-02-26,2025-03-05-1332,
899,DEPARTMENT OF STATE,2/26/2025,650000.0,2025-02-26,2025-03-05-1332,
900,DEPARTMENT OF STATE,2/26/2025,649993.7,2025-02-26,2025-03-05-1332,
901,DEPARTMENT OF STATE,2/26/2025,649216.0,2025-02-26,2025-03-05-1332,
902,DEPARTMENT OF STATE,2/26/2025,648342.0,2025-02-26,2025-03-05-1332,
903,DEPARTMENT OF STATE,2/26/2025,645033.06,2025-02-26,2025-03-05-1332,
904,DEPARTMENT OF STATE,2/26/2025,644037.0,2025-02-26,2025-03-05-1332,
905,DEPARTMENT OF STATE,2/26/2025,642710.0,2025-02-26,2025-03-05-1332,
906,DEPARTMENT OF STATE,2/26/2025,641975.0,2025-02-26,2025-03-05-1332,
907,DEPARTMENT OF STATE,2/26/2025,641745.0,2025-02-26,2025-03-05-1332,
908,DEPARTMENT OF STATE,2/26/2025,640600.0,2025-02-26,2025-03-05-1332,
909,DEPARTMENT OF STATE,2/26/2025,635928.0,2025-02-26,2025-03-05-1332,
910,DEPARTMENT OF STATE,2/26/2025,635365.0,2025-02-26,2025-03-05-1332,
911,DEPARTMENT OF STATE,2/26/2025,626218.95,2025-02-26,2025-03-05-1332,
912,DEPARTMENT OF STATE,2/26/2025,625000.0,2025-02-26,2025-03-05-1332,
913,DEPARTMENT OF STATE,2/26/2025,620000.0,2025-02-26,2025-03-05-1332,
914,DEPARTMENT OF STATE,2/26/2025,618928.0,2025-02-26,2025-03-05-1332,
915,DEPARTMENT OF STATE,2/26/2025,612233.0,2025-02-26,2025-03-05-1332,
916,DEPARTMENT OF STATE,2/26/2025,3917825.0,2025-02-26,2025-03-05-1332,
917,DEPARTMENT OF STATE,2/26/2025,604273.0,2025-02-26,2025-03-05-1332,
918,DEPARTMENT OF STATE,2/26/2025,599827.0,2025-02-26,2025-03-05-1332,
919,DEPARTMENT OF STATE,2/26/2025,594550.0,2025-02-26,2025-03-05-1332,
920,DEPARTMENT OF STATE,2/26/2025,592500.0,2025-02-26,2025-03-05-1332,
921,DEPARTMENT OF STATE,2/26/2025,581300.0,2025-02-26,2025-03-05-1332,
922,DEPARTMENT OF STATE,2/26/2025,575160.0,2025-02-26,2025-03-05-1332,
923,DEPARTMENT OF STATE,2/26/2025,574564.0,2025-02-26,2025-03-05-1332,
924,DEPARTMENT OF STATE,2/26/2025,574562.0,2025-02-26,2025-03-05-1332,
925,DEPARTMENT OF STATE,2/26/2025,573783.0,2025-02-26,2025-03-05-1332,
926,DEPARTMENT OF STATE,2/26/2025,565915.0,2025-02-26,2025-03-05-1332,
927,DEPARTMENT OF STATE,2/26/2025,562731.93,2025-02-26,2025-03-05-1332,
928,DEPARTMENT OF STATE,2/26/2025,562125.0,2025-02-26,2025-03-05-1332,
929,DEPARTMENT OF STATE,2/26/2025,561194.0,2025-02-26,2025-03-05-1332,
930,DEPARTMENT OF STATE,2/26/2025,560628.0,2025-02-26,2025-03-05-1332,
931,DEPARTMENT OF STATE,2/26/2025,560000.0,2025-02-26,2025-03-05-1332,
932,DEPARTMENT OF STATE,2/26/2025,558008.0,2025-02-26,2025-03-05-1332,
933,DEPARTMENT OF STATE,2/26/2025,553413.0,2025-02-26,2025-03-05-1332,
934,DEPARTMENT OF STATE,2/26/2025,552114.6,2025-02-26,2025-03-05-1332,
935,DEPARTMENT OF STATE,2/26/2025,550750.0,2025-02-26,2025-03-05-1332,
936,DEPARTMENT OF STATE,2/26/2025,550000.0,2025-02-26,2025-03-05-1332,
937,DEPARTMENT OF STATE,2/26/2025,549160.0,2025-02-26,2025-03-05-1332,
938,DEPARTMENT OF STATE,2/26/2025,549069.0,2025-02-26,2025-03-05-1332,
939,DEPARTMENT OF STATE,2/26/2025,546660.0,2025-02-26,2025-03-05-1332,
940,DEPARTMENT OF STATE,2/26/2025,543086.5,2025-02-26,2025-03-05-1332,
941,DEPARTMENT OF STATE,2/26/2025,541983.0,2025-02-26,2025-03-05-1332,
942,DEPARTMENT OF STATE,2/26/2025,540000.0,2025-02-26,2025-03-05-1332,
943,DEPARTMENT OF STATE,2/26/2025,30021.0,2025-02-26,2025-03-05-1332,
944,DEPARTMENT OF STATE,2/26/2025,530000.0,2025-02-26,2025-03-05-1332,
945,DEPARTMENT OF STATE,2/26/2025,526176.0,2025-02-26,2025-03-05-1332,
946,DEPARTMENT OF STATE,2/26/2025,524990.52,2025-02-26,2025-03-05-1332,
947,DEPARTMENT OF STATE,2/26/2025,522089.0,2025-02-26,2025-03-05-1332,
948,DEPARTMENT OF STATE,2/26/2025,522082.0,2025-02-26,2025-03-05-1332,
949,DEPARTMENT OF STATE,2/26/2025,520255.0,2025-02-26,2025-03-05-1332,
950,DEPARTMENT OF STATE,2/26/2025,518997.0,2025-02-26,2025-03-05-1332,
951,DEPARTMENT OF STATE,2/26/2025,513065.0,2025-02-26,2025-03-05-1332,
952,DEPARTMENT OF STATE,2/26/2025,512635.0,2025-02-26,2025-03-05-1332,
953,DEPARTMENT OF STATE,2/26/2025,511557.0,2025-02-26,2025-03-05-1332,
954,DEPARTMENT OF STATE,2/26/2025,510610.0,2025-02-26,2025-03-05-1332,
955,DEPARTMENT OF STATE,2/26/2025,510070.0,2025-02-26,2025-03-05-1332,
956,DEPARTMENT OF STATE,2/26/2025,506250.0,2025-02-26,2025-03-05-1332,
957,DEPARTMENT OF STATE,2/26/2025,505306.5,2025-02-26,2025-03-05-1332,
958,DEPARTMENT OF STATE,2/26/2025,499970.0,2025-02-26,2025-03-05-1332,
959,DEPARTMENT OF STATE,2/26/2025,499938.0,2025-02-26,2025-03-05-1332,
960,DEPARTMENT OF STATE,2/26/2025,499927.0,2025-02-26,2025-03-05-1332,
961,DEPARTMENT OF STATE,2/26/2025,499923.0,2025-02-26,2025-03-05-1332,
962,DEPARTMENT OF STATE,2/26/2025,499851.0,2025-02-26,2025-03-05-1332,
963,DEPARTMENT OF STATE,2/26/2025,499765.0,2025-02-26,2025-03-05-1332,
964,DEPARTMENT OF STATE,2/26/2025,499713.0,2025-02-26,2025-03-05-1332,
965,DEPARTMENT OF STATE,2/26/2025,499680.0,2025-02-26,2025-03-05-1332,
966,DEPARTMENT OF STATE,2/26/2025,499663.91,2025-02-26,2025-03-05-1332,
967,DEPARTMENT OF STATE,2/26/2025,499651.0,2025-02-26,2025-03-05-1332,
968,DEPARTMENT OF STATE,2/26/2025,499396.0,2025-02-26,2025-03-05-1332,
969,DEPARTMENT OF STATE,2/26/2025,499390.0,2025-02-26,2025-03-05-1332,
970,DEPARTMENT OF STATE,2/26/2025,499043.0,2025-02-26,2025-03-05-1332,
971,DEPARTMENT OF STATE,2/26/2025,498788.0,2025-02-26,2025-03-05-1332,
972,DEPARTMENT OF STATE,2/26/2025,498271.0,2025-02-26,2025-03-05-1332,
973,DEPARTMENT OF STATE,2/26/2025,496478.0,2025-02-26,2025-03-05-1332,
974,DEPARTMENT OF STATE,2/26/2025,496007.0,2025-02-26,2025-03-05-1332,
975,DEPARTMENT OF STATE,2/26/2025,495985.0,2025-02-26,2025-03-05-1332,
976,DEPARTMENT OF STATE,2/26/2025,495401.0,2025-02-26,2025-03-05-1332,
977,DEPARTMENT OF STATE,2/26/2025,493339.0,2025-02-26,2025-03-05-1332,
978,DEPARTMENT OF STATE,2/26/2025,492132.0,2025-02-26,2025-03-05-1332,
979,DEPARTMENT OF STATE,2/26/2025,491850.0,2025-02-26,2025-03-05-1332,
980,DEPARTMENT OF STATE,2/26/2025,490712.0,2025-02-26,2025-03-05-1332,
981,DEPARTMENT OF STATE,2/26/2025,490000.0,2025-02-26,2025-03-05-1332,
982,DEPARTMENT OF STATE,2/26/2025,480994.0,2025-02-26,2025-03-05-1332,
983,DEPARTMENT OF STATE,2/26/2025,480000.0,2025-02-26,2025-03-05-1332,
984,DEPARTMENT OF STATE,2/26/2025,479774.0,2025-02-26,2025-03-05-1332,
985,DEPARTMENT OF STATE,2/26/2025,478960.0,2025-02-26,2025-03-05-1332,
986,DEPARTMENT OF STATE,2/26/2025,478290.0,2025-02-26,2025-03-05-1332,
987,DEPARTMENT OF STATE,2/26/2025,477991.0,2025-02-26,2025-03-05-1332,
988,DEPARTMENT OF STATE,2/26/2025,475980.0,2025-02-26,2025-03-05-1332,
989,DEPARTMENT OF STATE,2/26/2025,473850.0,2025-02-26,2025-03-05-1332,
990,DEPARTMENT OF STATE,2/26/2025,471352.0,2025-02-26,2025-03-05-1332,
991,DEPARTMENT OF STATE,2/26/2025,470177.0,2025-02-26,2025-03-05-1332,
992,DEPARTMENT OF STATE,2/26/2025,469611.0,2025-02-26,2025-03-05-1332,
993,DEPARTMENT OF STATE,2/26/2025,464492.0,2025-02-26,2025-03-05-1332,
994,DEPARTMENT OF STATE,2/26/2025,463450.0,2025-02-26,2025-03-05-1332,
995,DEPARTMENT OF STATE,2/26/2025,463300.0,2025-02-26,2025-03-05-1332,
996,DEPARTMENT OF STATE,2/26/2025,459982.0,2025-02-26,2025-03-05-1332,
997,DEPARTMENT OF STATE,2/26/2025,459259.0,2025-02-26,2025-03-05-1332,
998,DEPARTMENT OF STATE,2/26/2025,458365.0,2025-02-26,2025-03-05-1332,
999,DEPARTMENT OF STATE,2/26/2025,450682.06,2025-02-26,2025-03-05-1332,
1000,DEPARTMENT OF STATE,2/26/2025,449981.0,2025-02-26,2025-03-05-1332,
1001,DEPARTMENT OF STATE,2/26/2025,449027.0,2025-02-26,2025-03-05-1332,
1002,DEPARTMENT OF STATE,2/26/2025,445182.0,2025-02-26,2025-03-05-1332,
1003,DEPARTMENT OF STATE,2/26/2025,444334.0,2025-02-26,2025-03-05-1332,
1004,DEPARTMENT OF STATE,2/26/2025,444005.0,2025-02-26,2025-03-05-1332,
1005,DEPARTMENT OF STATE,2/26/2025,441462.08,2025-02-26,2025-03-05-1332,
1006,DEPARTMENT OF STATE,2/26/2025,440824.0,2025-02-26,2025-03-05-1332,
1007,DEPARTMENT OF STATE,2/26/2025,440440.0,2025-02-26,2025-03-05-1332,
1008,DEPARTMENT OF STATE,2/26/2025,439560.0,2025-02-26,2025-03-05-1332,
1009,DEPARTMENT OF STATE,2/26/2025,435575.0,2025-02-26,2025-03-05-1332,
1010,DEPARTMENT OF STATE,2/26/2025,435224.0,2025-02-26,2025-03-05-1332,
1011,DEPARTMENT OF STATE,2/26/2025,435180.0,2025-02-26,2025-03-05-1332,
1012,DEPARTMENT OF STATE,2/26/2025,434098.0,2025-02-26,2025-03-05-1332,
1013,DEPARTMENT OF STATE,2/26/2025,432995.38,2025-02-26,2025-03-05-1332,
1014,DEPARTMENT OF STATE,2/26/2025,430537.6,2025-02-26,2025-03-05-1332,
1015,DEPARTMENT OF STATE,2/26/2025,429250.0,2025-02-26,2025-03-05-1332,
1016,DEPARTMENT OF STATE,2/26/2025,428437.0,2025-02-26,2025-03-05-1332,
1017,DEPARTMENT OF STATE,2/26/2025,428134.0,2025-02-26,2025-03-05-1332,
1018,DEPARTMENT OF STATE,2/26/2025,428000.0,2025-02-26,2025-03-05-1332,
1019,DEPARTMENT OF STATE,2/26/2025,427021.0,2025-02-26,2025-03-05-1332,
1020,DEPARTMENT OF STATE,2/26/2025,426757.0,2025-02-26,2025-03-05-1332,
1021,DEPARTMENT OF STATE,2/26/2025,420000.0,2025-02-26,2025-03-05-1332,
1022,DEPARTMENT OF STATE,2/26/2025,419802.21,2025-02-26,2025-03-05-1332,
1023,DEPARTMENT OF STATE,2/26/2025,416854.0,2025-02-26,2025-03-05-1332,
1024,DEPARTMENT OF STATE,2/26/2025,415093.43,2025-02-26,2025-03-05-1332,
1025,DEPARTMENT OF STATE,2/26/2025,414750.0,2025-02-26,2025-03-05-1332,
1026,DEPARTMENT OF STATE,2/26/2025,413558.0,2025-02-26,2025-03-05-1332,
1027,DEPARTMENT OF STATE,2/26/2025,410778.0,2025-02-26,2025-03-05-1332,
1028,DEPARTMENT OF STATE,2/26/2025,409794.0,2025-02-26,2025-03-05-1332,
1029,DEPARTMENT OF STATE,2/26/2025,408610.0,2025-02-26,2025-03-05-1332,
1030,DEPARTMENT OF STATE,2/26/2025,408451.0,2025-02-26,2025-03-05-1332,
1031,DEPARTMENT OF STATE,2/26/2025,405000.0,2025-02-26,2025-03-05-1332,
1032,DEPARTMENT OF STATE,2/26/2025,400175.0,2025-02-26,2025-03-05-1332,
1033,DEPARTMENT OF STATE,2/26/2025,399995.0,2025-02-26,2025-03-05-1332,
1034,DEPARTMENT OF STATE,2/26/2025,399975.0,2025-02-26,2025-03-05-1332,
1035,DEPARTMENT OF STATE,2/26/2025,399867.0,2025-02-26,2025-03-05-1332,
1036,DEPARTMENT OF STATE,2/26/2025,399203.0,2025-02-26,2025-03-05-1332,
1037,DEPARTMENT OF STATE,2/26/2025,398803.0,2025-02-26,2025-03-05-1332,
1038,DEPARTMENT OF STATE,2/26/2025,398765.0,2025-02-26,2025-03-05-1332,
1039,DEPARTMENT OF STATE,2/26/2025,397200.0,2025-02-26,2025-03-05-1332,
1040,DEPARTMENT OF STATE,2/26/2025,396123.4,2025-02-26,2025-03-05-1332,
1041,DEPARTMENT OF STATE,2/26/2025,394671.0,2025-02-26,2025-03-05-1332,
1042,DEPARTMENT OF STATE,2/26/2025,394220.0,2025-02-26,2025-03-05-1332,
1043,DEPARTMENT OF STATE,2/26/2025,392941.0,2025-02-26,2025-03-05-1332,
1044,DEPARTMENT OF STATE,2/26/2025,390000.0,2025-02-26,2025-03-05-1332,
1045,DEPARTMENT OF STATE,2/26/2025,387309.0,2025-02-26,2025-03-05-1332,
1046,DEPARTMENT OF STATE,2/26/2025,384900.0,2025-02-26,2025-03-05-1332,
1047,DEPARTMENT OF STATE,2/26/2025,382000.0,2025-02-26,2025-03-05-1332,
1048,DEPARTMENT OF STATE,2/26/2025,381954.0,2025-02-26,2025-03-05-1332,
1049,DEPARTMENT OF STATE,2/26/2025,377000.0,2025-02-26,2025-03-05-1332,
1050,DEPARTMENT OF STATE,2/26/2025,376622.0,2025-02-26,2025-03-05-1332,
1051,DEPARTMENT OF STATE,2/26/2025,375000.0,2025-02-26,2025-03-05-1332,
1052,DEPARTMENT OF STATE,2/26/2025,371196.0,2025-02-26,2025-03-05-1332,
1053,DEPARTMENT OF STATE,2/26/2025,370322.74,2025-02-26,2025-03-05-1332,
1054,DEPARTMENT OF STATE,2/26/2025,370000.0,2025-02-26,2025-03-05-1332,
1055,DEPARTMENT OF STATE,2/26/2025,17700.0,2025-02-26,2025-03-05-1332,
1056,DEPARTMENT OF STATE,2/26/2025,362468.55,2025-02-26,2025-03-05-1332,
1057,DEPARTMENT OF STATE,2/26/2025,359926.0,2025-02-26,2025-03-05-1332,
1058,DEPARTMENT OF STATE,2/26/2025,358840.0,2025-02-26,2025-03-05-1332,
1059,DEPARTMENT OF STATE,2/26/2025,353880.0,2025-02-26,2025-03-05-1332,
1060,DEPARTMENT OF STATE,2/26/2025,352494.16,2025-02-26,2025-03-05-1332,
1061,DEPARTMENT OF STATE,2/26/2025,351592.74,2025-02-26,2025-03-05-1332,
1062,DEPARTMENT OF STATE,2/26/2025,350241.0,2025-02-26,2025-03-05-1332,
1063,DEPARTMENT OF STATE,2/26/2025,348987.0,2025-02-26,2025-03-05-1332,
1064,DEPARTMENT OF STATE,2/26/2025,348040.0,2025-02-26,2025-03-05-1332,
1065,DEPARTMENT OF STATE,2/26/2025,343750.0,2025-02-26,2025-03-05-1332,
1066,DEPARTMENT OF STATE,2/26/2025,340541.0,2025-02-26,2025-03-05-1332,
1067,DEPARTMENT OF STATE,2/26/2025,340308.0,2025-02-26,2025-03-05-1332,
1068,DEPARTMENT OF STATE,2/26/2025,332349.0,2025-02-26,2025-03-05-1332,
1069,DEPARTMENT OF STATE,2/26/2025,330097.0,2025-02-26,2025-03-05-1332,
1070,DEPARTMENT OF STATE,2/26/2025,329951.0,2025-02-26,2025-03-05-1332,
1071,DEPARTMENT OF STATE,2/26/2025,324954.25,2025-02-26,2025-03-05-1332,
1072,DEPARTMENT OF STATE,2/26/2025,320000.0,2025-02-26,2025-03-05-1332,
1073,DEPARTMENT OF STATE,2/26/2025,317386.0,2025-02-26,2025-03-05-1332,
1074,DEPARTMENT OF STATE,2/26/2025,316000.0,2025-02-26,2025-03-05-1332,
1075,DEPARTMENT OF STATE,2/26/2025,311748.0,2025-02-26,2025-03-05-1332,
1076,DEPARTMENT OF STATE,2/26/2025,308881.0,2025-02-26,2025-03-05-1332,
1077,DEPARTMENT OF STATE,2/26/2025,308005.0,2025-02-26,2025-03-05-1332,
1078,DEPARTMENT OF STATE,2/26/2025,307446.0,2025-02-26,2025-03-05-1332,
1079,DEPARTMENT OF STATE,2/26/2025,306561.0,2025-02-26,2025-03-05-1332,
1080,DEPARTMENT OF STATE,2/26/2025,303050.0,2025-02-26,2025-03-05-1332,
1081,DEPARTMENT OF STATE,2/26/2025,301278.0,2025-02-26,2025-03-05-1332,
1082,DEPARTMENT OF STATE,2/26/2025,300704.0,2025-02-26,2025-03-05-1332,
1083,DEPARTMENT OF STATE,2/26/2025,300003.42,2025-02-26,2025-03-05-1332,
1084,DEPARTMENT OF STATE,2/26/2025,299998.88,2025-02-26,2025-03-05-1332,
1085,DEPARTMENT OF STATE,2/26/2025,299996.0,2025-02-26,2025-03-05-1332,
1086,DEPARTMENT OF STATE,2/26/2025,299995.89,2025-02-26,2025-03-05-1332,
1087,DEPARTMENT OF STATE,2/26/2025,299995.2,2025-02-26,2025-03-05-1332,
1088,DEPARTMENT OF STATE,2/26/2025,298499.5,2025-02-26,2025-03-05-1332,
1089,DEPARTMENT OF STATE,2/26/2025,298160.0,2025-02-26,2025-03-05-1332,
1090,DEPARTMENT OF STATE,2/26/2025,296284.0,2025-02-26,2025-03-05-1332,
1091,DEPARTMENT OF STATE,2/26/2025,295112.0,2025-02-26,2025-03-05-1332,
1092,DEPARTMENT OF STATE,2/26/2025,293360.0,2025-02-26,2025-03-05-1332,
1093,DEPARTMENT OF STATE,2/26/2025,290700.0,2025-02-26,2025-03-05-1332,
1094,DEPARTMENT OF STATE,2/26/2025,290000.0,2025-02-26,2025-03-05-1332,
1095,DEPARTMENT OF STATE,2/26/2025,289887.0,2025-02-26,2025-03-05-1332,
1096,DEPARTMENT OF STATE,2/26/2025,288854.0,2025-02-26,2025-03-05-1332,
1097,DEPARTMENT OF STATE,2/26/2025,288546.0,2025-02-26,2025-03-05-1332,
1098,DEPARTMENT OF STATE,2/26/2025,287779.0,2025-02-26,2025-03-05-1332,
1099,DEPARTMENT OF STATE,2/26/2025,285888.0,2025-02-26,2025-03-05-1332,
1100,DEPARTMENT OF STATE,2/26/2025,285046.0,2025-02-26,2025-03-05-1332,
1101,DEPARTMENT OF STATE,2/26/2025,285000.0,2025-02-26,2025-03-05-1332,
1102,DEPARTMENT OF STATE,2/26/2025,279725.0,2025-02-26,2025-03-05-1332,
1103,DEPARTMENT OF STATE,2/26/2025,278918.0,2025-02-26,2025-03-05-1332,
1104,DEPARTMENT OF STATE,2/26/2025,276325.0,2025-02-26,2025-03-05-1332,
1105,DEPARTMENT OF STATE,2/26/2025,276038.0,2025-02-26,2025-03-05-1332,
1106,DEPARTMENT OF STATE,2/26/2025,272321.0,2025-02-26,2025-03-05-1332,
1107,DEPARTMENT OF STATE,2/26/2025,266996.5,2025-02-26,2025-03-05-1332,
1108,DEPARTMENT OF STATE,2/26/2025,266970.0,2025-02-26,2025-03-05-1332,
1109,DEPARTMENT OF STATE,2/26/2025,265000.0,2025-02-26,2025-03-05-1332,
1110,DEPARTMENT OF STATE,2/26/2025,262979.0,2025-02-26,2025-03-05-1332,
1111,DEPARTMENT OF STATE,2/26/2025,260870.0,2025-02-26,2025-03-05-1332,
1112,DEPARTMENT OF STATE,2/26/2025,259996.13,2025-02-26,2025-03-05-1332,
1113,DEPARTMENT OF STATE,2/26/2025,259864.0,2025-02-26,2025-03-05-1332,
1114,DEPARTMENT OF STATE,2/26/2025,258966.39,2025-02-26,2025-03-05-1332,
1115,DEPARTMENT OF STATE,2/26/2025,258866.0,2025-02-26,2025-03-05-1332,
1116,DEPARTMENT OF STATE,2/26/2025,255574.0,2025-02-26,2025-03-05-1332,
1117,DEPARTMENT OF STATE,2/26/2025,254300.0,2025-02-26,2025-03-05-1332,
1118,DEPARTMENT OF STATE,2/26/2025,253000.0,2025-02-26,2025-03-05-1332,
1119,DEPARTMENT OF STATE,2/26/2025,21270.0,2025-02-26,2025-03-05-1332,
1120,DEPARTMENT OF STATE,2/26/2025,199099.0,2025-02-26,2025-03-05-1332,
1121,DEPARTMENT OF STATE,2/26/2025,249999.92,2025-02-26,2025-03-05-1332,
1122,DEPARTMENT OF STATE,2/26/2025,249999.64,2025-02-26,2025-03-05-1332,
1123,DEPARTMENT OF STATE,2/26/2025,249999.0,2025-02-26,2025-03-05-1332,
1124,DEPARTMENT OF STATE,2/26/2025,249997.0,2025-02-26,2025-03-05-1332,
1125,DEPARTMENT OF STATE,2/26/2025,249986.0,2025-02-26,2025-03-05-1332,
1126,DEPARTMENT OF STATE,2/26/2025,249964.0,2025-02-26,2025-03-05-1332,
1127,DEPARTMENT OF STATE,2/26/2025,249960.0,2025-02-26,2025-03-05-1332,
1128,DEPARTMENT OF STATE,2/26/2025,249940.0,2025-02-26,2025-03-05-1332,
1129,DEPARTMENT OF STATE,2/26/2025,249925.0,2025-02-26,2025-03-05-1332,
1130,DEPARTMENT OF STATE,2/26/2025,249912.0,2025-02-26,2025-03-05-1332,
1131,DEPARTMENT OF STATE,2/26/2025,249903.5,2025-02-26,2025-03-05-1332,
1132,DEPARTMENT OF STATE,2/26/2025,249887.51,2025-02-26,2025-03-05-1332,
1133,DEPARTMENT OF STATE,2/26/2025,249866.0,2025-02-26,2025-03-05-1332,
1134,DEPARTMENT OF STATE,2/26/2025,249834.0,2025-02-26,2025-03-05-1332,
1135,DEPARTMENT OF STATE,2/26/2025,249807.07,2025-02-26,2025-03-05-1332,
1136,DEPARTMENT OF STATE,2/26/2025,249780.0,2025-02-26,2025-03-05-1332,
1137,DEPARTMENT OF STATE,2/26/2025,249488.0,2025-02-26,2025-03-05-1332,
1138,DEPARTMENT OF STATE,2/26/2025,249470.5,2025-02-26,2025-03-05-1332,
1139,DEPARTMENT OF STATE,2/26/2025,249259.8,2025-02-26,2025-03-05-1332,
1140,DEPARTMENT OF STATE,2/26/2025,249047.0,2025-02-26,2025-03-05-1332,
1141,DEPARTMENT OF STATE,2/26/2025,248640.0,2025-02-26,2025-03-05-1332,
1142,DEPARTMENT OF STATE,2/26/2025,248391.0,2025-02-26,2025-03-05-1332,
1143,DEPARTMENT OF STATE,2/26/2025,248022.0,2025-02-26,2025-03-05-1332,
1144,DEPARTMENT OF STATE,2/26/2025,247982.1,2025-02-26,2025-03-05-1332,
1145,DEPARTMENT OF STATE,2/26/2025,247966.08,2025-02-26,2025-03-05-1332,
1146,DEPARTMENT OF STATE,2/26/2025,247000.0,2025-02-26,2025-03-05-1332,
1147,DEPARTMENT OF STATE,2/26/2025,246921.0,2025-02-26,2025-03-05-1332,
1148,DEPARTMENT OF STATE,2/26/2025,246750.0,2025-02-26,2025-03-05-1332,
1149,DEPARTMENT OF STATE,2/26/2025,246577.0,2025-02-26,2025-03-05-1332,
1150,DEPARTMENT OF STATE,2/26/2025,246295.5,2025-02-26,2025-03-05-1332,
1151,DEPARTMENT OF STATE,2/26/2025,246030.0,2025-02-26,2025-03-05-1332,
1152,DEPARTMENT OF STATE,2/26/2025,245000.0,2025-02-26,2025-03-05-1332,
1153,DEPARTMENT OF STATE,2/26/2025,244798.0,2025-02-26,2025-03-05-1332,
1154,DEPARTMENT OF STATE,2/26/2025,244182.0,2025-02-26,2025-03-05-1332,
1155,DEPARTMENT OF STATE,2/26/2025,243066.0,2025-02-26,2025-03-05-1332,
1156,DEPARTMENT OF STATE,2/26/2025,242437.0,2025-02-26,2025-03-05-1332,
1157,DEPARTMENT OF STATE,2/26/2025,241542.0,2025-02-26,2025-03-05-1332,
1158,DEPARTMENT OF STATE,2/26/2025,238970.0,2025-02-26,2025-03-05-1332,
1159,DEPARTMENT OF STATE,2/26/2025,238100.0,2025-02-26,2025-03-05-1332,
1160,DEPARTMENT OF STATE,2/26/2025,236123.0,2025-02-26,2025-03-05-1332,
1161,DEPARTMENT OF STATE,2/26/2025,4190346.64,2025-02-26,2025-03-05-1332,
1162,DEPARTMENT OF STATE,2/26/2025,235200.0,2025-02-26,2025-03-05-1332,
1163,DEPARTMENT OF STATE,2/26/2025,229389.0,2025-02-26,2025-03-05-1332,
1164,DEPARTMENT OF STATE,2/26/2025,226252.0,2025-02-26,2025-03-05-1332,
1165,DEPARTMENT OF STATE,2/26/2025,225460.0,2025-02-26,2025-03-05-1332,
1166,DEPARTMENT OF STATE,2/26/2025,224610.65,2025-02-26,2025-03-05-1332,
1167,DEPARTMENT OF STATE,2/26/2025,223000.0,2025-02-26,2025-03-05-1332,
1168,DEPARTMENT OF STATE,2/26/2025,222187.0,2025-02-26,2025-03-05-1332,
1169,DEPARTMENT OF STATE,2/26/2025,220809.26,2025-02-26,2025-03-05-1332,
1170,DEPARTMENT OF STATE,2/26/2025,216750.0,2025-02-26,2025-03-05-1332,
1171,DEPARTMENT OF STATE,2/26/2025,216540.0,2025-02-26,2025-03-05-1332,
1172,DEPARTMENT OF STATE,2/26/2025,215518.11,2025-02-26,2025-03-05-1332,
1173,DEPARTMENT OF STATE,2/26/2025,215000.66,2025-02-26,2025-03-05-1332,
1174,DEPARTMENT OF STATE,2/26/2025,214246.0,2025-02-26,2025-03-05-1332,
1175,DEPARTMENT OF STATE,2/26/2025,212500.0,2025-02-26,2025-03-05-1332,
1176,DEPARTMENT OF STATE,2/26/2025,209650.0,2025-02-26,2025-03-05-1332,
1177,DEPARTMENT OF STATE,2/26/2025,208760.0,2025-02-26,2025-03-05-1332,
1178,DEPARTMENT OF STATE,2/26/2025,206080.0,2025-02-26,2025-03-05-1332,
1179,DEPARTMENT OF STATE,2/26/2025,205908.0,2025-02-26,2025-03-05-1332,
1180,DEPARTMENT OF STATE,2/26/2025,204487.0,2025-02-26,2025-03-05-1332,
1181,DEPARTMENT OF STATE,2/26/2025,204120.0,2025-02-26,2025-03-05-1332,
1182,DEPARTMENT OF STATE,2/26/2025,202754.0,2025-02-26,2025-03-05-1332,
1183,DEPARTMENT OF STATE,2/26/2025,202530.0,2025-02-26,2025-03-05-1332,
1184,DEPARTMENT OF STATE,2/26/2025,202250.0,2025-02-26,2025-03-05-1332,
1185,DEPARTMENT OF STATE,2/26/2025,202000.0,2025-02-26,2025-03-05-1332,
1186,DEPARTMENT OF STATE,2/26/2025,201774.0,2025-02-26,2025-03-05-1332,
1187,DEPARTMENT OF STATE,2/26/2025,201012.0,2025-02-26,2025-03-05-1332,
1188,DEPARTMENT OF STATE,2/26/2025,200561.3,2025-02-26,2025-03-05-1332,
1189,DEPARTMENT OF STATE,2/26/2025,199994.0,2025-02-26,2025-03-05-1332,
1190,DEPARTMENT OF STATE,2/26/2025,199848.74,2025-02-26,2025-03-05-1332,
1191,DEPARTMENT OF STATE,2/26/2025,199826.0,2025-02-26,2025-03-05-1332,
1192,DEPARTMENT OF STATE,2/26/2025,199100.0,2025-02-26,2025-03-05-1332,
1193,DEPARTMENT OF STATE,2/26/2025,199000.0,2025-02-26,2025-03-05-1332,
1194,DEPARTMENT OF STATE,2/26/2025,198052.0,2025-02-26,2025-03-05-1332,
1195,DEPARTMENT OF STATE,2/26/2025,197761.58,2025-02-26,2025-03-05-1332,
1196,DEPARTMENT OF STATE,2/26/2025,195781.3,2025-02-26,2025-03-05-1332,
1197,DEPARTMENT OF STATE,2/26/2025,194759.04,2025-02-26,2025-03-05-1332,
1198,DEPARTMENT OF STATE,2/26/2025,192115.0,2025-02-26,2025-03-05-1332,
1199,DEPARTMENT OF STATE,2/26/2025,190738.2,2025-02-26,2025-03-05-1332,
1200,DEPARTMENT OF STATE,2/26/2025,190123.0,2025-02-26,2025-03-05-1332,
1201,DEPARTMENT OF STATE,2/26/2025,190120.0,2025-02-26,2025-03-05-1332,
1202,DEPARTMENT OF STATE,2/26/2025,189805.5,2025-02-26,2025-03-05-1332,
1203,DEPARTMENT OF STATE,2/26/2025,188660.0,2025-02-26,2025-03-05-1332,
1204,DEPARTMENT OF STATE,2/26/2025,188055.0,2025-02-26,2025-03-05-1332,
1205,DEPARTMENT OF STATE,2/26/2025,188000.0,2025-02-26,2025-03-05-1332,
1206,DEPARTMENT OF STATE,2/26/2025,187107.3,2025-02-26,2025-03-05-1332,
1207,DEPARTMENT OF STATE,2/26/2025,185938.5,2025-02-26,2025-03-05-1332,
1208,DEPARTMENT OF STATE,2/26/2025,185000.0,2025-02-26,2025-03-05-1332,
1209,DEPARTMENT OF STATE,2/26/2025,184276.0,2025-02-26,2025-03-05-1332,
1210,DEPARTMENT OF STATE,2/26/2025,181000.0,2025-02-26,2025-03-05-1332,
1211,DEPARTMENT OF STATE,2/26/2025,180400.0,2025-02-26,2025-03-05-1332,
1212,DEPARTMENT OF STATE,2/26/2025,180116.0,2025-02-26,2025-03-05-1332,
1213,DEPARTMENT OF STATE,2/26/2025,180000.0,2025-02-26,2025-03-05-1332,
1214,DEPARTMENT OF STATE,2/26/2025,176991.0,2025-02-26,2025-03-05-1332,
1215,DEPARTMENT OF STATE,2/26/2025,176651.54,2025-02-26,2025-03-05-1332,
1216,DEPARTMENT OF STATE,2/26/2025,176268.0,2025-02-26,2025-03-05-1332,
1217,DEPARTMENT OF STATE,2/26/2025,176074.0,2025-02-26,2025-03-05-1332,
1218,DEPARTMENT OF STATE,2/26/2025,175010.0,2025-02-26,2025-03-05-1332,
1219,DEPARTMENT OF STATE,2/26/2025,174681.04,2025-02-26,2025-03-05-1332,
1220,DEPARTMENT OF STATE,2/26/2025,173004.0,2025-02-26,2025-03-05-1332,
1221,DEPARTMENT OF STATE,2/26/2025,172944.0,2025-02-26,2025-03-05-1332,
1222,DEPARTMENT OF STATE,2/26/2025,172192.2,2025-02-26,2025-03-05-1332,
1223,DEPARTMENT OF STATE,2/26/2025,171070.0,2025-02-26,2025-03-05-1332,
1224,DEPARTMENT OF STATE,2/26/2025,169100.0,2025-02-26,2025-03-05-1332,
1225,DEPARTMENT OF STATE,2/26/2025,168341.0,2025-02-26,2025-03-05-1332,
1226,DEPARTMENT OF STATE,2/26/2025,168085.66,2025-02-26,2025-03-05-1332,
1227,DEPARTMENT OF STATE,2/26/2025,167410.0,2025-02-26,2025-03-05-1332,
1228,DEPARTMENT OF STATE,2/26/2025,166834.5,2025-02-26,2025-03-05-1332,
1229,DEPARTMENT OF STATE,2/26/2025,166730.8,2025-02-26,2025-03-05-1332,
1230,DEPARTMENT OF STATE,2/26/2025,165157.0,2025-02-26,2025-03-05-1332,
1231,DEPARTMENT OF STATE,2/26/2025,165053.0,2025-02-26,2025-03-05-1332,
1232,DEPARTMENT OF STATE,2/26/2025,164950.5,2025-02-26,2025-03-05-1332,
1233,DEPARTMENT OF STATE,2/26/2025,163290.0,2025-02-26,2025-03-05-1332,
1234,DEPARTMENT OF STATE,2/26/2025,162813.0,2025-02-26,2025-03-05-1332,
1235,DEPARTMENT OF STATE,2/26/2025,162131.07,2025-02-26,2025-03-05-1332,
1236,DEPARTMENT OF STATE,2/26/2025,161847.62,2025-02-26,2025-03-05-1332,
1237,DEPARTMENT OF STATE,2/26/2025,161400.0,2025-02-26,2025-03-05-1332,
1238,DEPARTMENT OF STATE,2/26/2025,161153.5,2025-02-26,2025-03-05-1332,
1239,DEPARTMENT OF STATE,2/26/2025,160000.0,2025-02-26,2025-03-05-1332,
1240,DEPARTMENT OF STATE,2/26/2025,159376.4,2025-02-26,2025-03-05-1332,
1241,DEPARTMENT OF STATE,2/26/2025,914000.0,2025-02-26,2025-03-05-1332,
1242,DEPARTMENT OF STATE,2/26/2025,158255.0,2025-02-26,2025-03-05-1332,
1243,DEPARTMENT OF STATE,2/26/2025,157499.9,2025-02-26,2025-03-05-1332,
1244,DEPARTMENT OF STATE,2/26/2025,157499.32,2025-02-26,2025-03-05-1332,
1245,DEPARTMENT OF STATE,2/26/2025,156955.0,2025-02-26,2025-03-05-1332,
1246,DEPARTMENT OF STATE,2/26/2025,156544.0,2025-02-26,2025-03-05-1332,
1247,DEPARTMENT OF STATE,2/26/2025,156250.0,2025-02-26,2025-03-05-1332,
1248,DEPARTMENT OF STATE,2/26/2025,154130.0,2025-02-26,2025-03-05-1332,
1249,DEPARTMENT OF STATE,2/26/2025,152590.0,2025-02-26,2025-03-05-1332,
1250,DEPARTMENT OF STATE,2/26/2025,152500.0,2025-02-26,2025-03-05-1332,
1251,DEPARTMENT OF STATE,2/26/2025,152012.0,2025-02-26,2025-03-05-1332,
1252,DEPARTMENT OF STATE,2/26/2025,151795.44,2025-02-26,2025-03-05-1332,
1253,DEPARTMENT OF STATE,2/26/2025,150453.0,2025-02-26,2025-03-05-1332,
1254,DEPARTMENT OF STATE,2/26/2025,78526.0,2025-02-26,2025-03-05-1332,
1255,DEPARTMENT OF STATE,2/26/2025,814000.0,2025-02-26,2025-03-05-1332,
1256,DEPARTMENT OF STATE,2/26/2025,149998.8,2025-02-26,2025-03-05-1332,
1257,DEPARTMENT OF STATE,2/26/2025,149998.45,2025-02-26,2025-03-05-1332,
1258,DEPARTMENT OF STATE,2/26/2025,149996.25,2025-02-26,2025-03-05-1332,
1259,DEPARTMENT OF STATE,2/26/2025,149970.0,2025-02-26,2025-03-05-1332,
1260,DEPARTMENT OF STATE,2/26/2025,149968.88,2025-02-26,2025-03-05-1332,
1261,DEPARTMENT OF STATE,2/26/2025,149903.45,2025-02-26,2025-03-05-1332,
1262,DEPARTMENT OF STATE,2/26/2025,149653.56,2025-02-26,2025-03-05-1332,
1263,DEPARTMENT OF STATE,2/26/2025,149644.5,2025-02-26,2025-03-05-1332,
1264,DEPARTMENT OF STATE,2/26/2025,149303.85,2025-02-26,2025-03-05-1332,
1265,DEPARTMENT OF STATE,2/26/2025,149189.0,2025-02-26,2025-03-05-1332,
1266,DEPARTMENT OF STATE,2/26/2025,148428.68,2025-02-26,2025-03-05-1332,
1267,DEPARTMENT OF STATE,2/26/2025,147394.0,2025-02-26,2025-03-05-1332,
1268,DEPARTMENT OF STATE,2/26/2025,145958.0,2025-02-26,2025-03-05-1332,
1269,DEPARTMENT OF STATE,2/26/2025,144767.54,2025-02-26,2025-03-05-1332,
1270,DEPARTMENT OF STATE,2/26/2025,143616.95,2025-02-26,2025-03-05-1332,
1271,DEPARTMENT OF STATE,2/26/2025,141108.0,2025-02-26,2025-03-05-1332,
1272,DEPARTMENT OF STATE,2/26/2025,140790.0,2025-02-26,2025-03-05-1332,
1273,DEPARTMENT OF STATE,2/26/2025,139997.16,2025-02-26,2025-03-05-1332,
1274,DEPARTMENT OF STATE,2/26/2025,139650.04,2025-02-26,2025-03-05-1332,
1275,DEPARTMENT OF STATE,2/26/2025,138667.0,2025-02-26,2025-03-05-1332,
1276,DEPARTMENT OF STATE,2/26/2025,138515.0,2025-02-26,2025-03-05-1332,
1277,DEPARTMENT OF STATE,2/26/2025,138400.23,2025-02-26,2025-03-05-1332,
1278,DEPARTMENT OF STATE,2/26/2025,136296.0,2025-02-26,2025-03-05-1332,
1279,DEPARTMENT OF STATE,2/26/2025,135000.0,2025-02-26,2025-03-05-1332,
1280,DEPARTMENT OF STATE,2/26/2025,134508.25,2025-02-26,2025-03-05-1332,
1281,DEPARTMENT OF STATE,2/26/2025,134340.0,2025-02-26,2025-03-05-1332,
1282,DEPARTMENT OF STATE,2/26/2025,133576.0,2025-02-26,2025-03-05-1332,
1283,DEPARTMENT OF STATE,2/26/2025,133540.0,2025-02-26,2025-03-05-1332,
1284,DEPARTMENT OF STATE,2/26/2025,132500.0,2025-02-26,2025-03-05-1332,
1285,DEPARTMENT OF STATE,2/26/2025,132380.0,2025-02-26,2025-03-05-1332,
1286,DEPARTMENT OF STATE,2/26/2025,131500.0,2025-02-26,2025-03-05-1332,
1287,DEPARTMENT OF STATE,2/26/2025,130804.0,2025-02-26,2025-03-05-1332,
1288,DEPARTMENT OF STATE,2/26/2025,130192.92,2025-02-26,2025-03-05-1332,
1289,DEPARTMENT OF STATE,2/26/2025,130000.0,2025-02-26,2025-03-05-1332,
1290,DEPARTMENT OF STATE,2/26/2025,129925.0,2025-02-26,2025-03-05-1332,
1291,DEPARTMENT OF STATE,2/26/2025,128483.0,2025-02-26,2025-03-05-1332,
1292,DEPARTMENT OF STATE,2/26/2025,128060.0,2025-02-26,2025-03-05-1332,
1293,DEPARTMENT OF STATE,2/26/2025,127294.0,2025-02-26,2025-03-05-1332,
1294,DEPARTMENT OF STATE,2/26/2025,127152.55,2025-02-26,2025-03-05-1332,
1295,DEPARTMENT OF STATE,2/26/2025,126500.0,2025-02-26,2025-03-05-1332,
1296,DEPARTMENT OF STATE,2/26/2025,126286.0,2025-02-26,2025-03-05-1332,
1297,DEPARTMENT OF STATE,2/26/2025,126000.0,2025-02-26,2025-03-05-1332,
1298,DEPARTMENT OF STATE,2/26/2025,125125.0,2025-02-26,2025-03-05-1332,
1299,DEPARTMENT OF STATE,2/26/2025,125050.0,2025-02-26,2025-03-05-1332,
1300,DEPARTMENT OF STATE,2/26/2025,124978.35,2025-02-26,2025-03-05-1332,
1301,DEPARTMENT OF STATE,2/26/2025,124806.0,2025-02-26,2025-03-05-1332,
1302,DEPARTMENT OF STATE,2/26/2025,124575.0,2025-02-26,2025-03-05-1332,
1303,DEPARTMENT OF STATE,2/26/2025,124000.0,2025-02-26,2025-03-05-1332,
1304,DEPARTMENT OF STATE,2/26/2025,123980.0,2025-02-26,2025-03-05-1332,
1305,DEPARTMENT OF STATE,2/26/2025,123450.0,2025-02-26,2025-03-05-1332,
1306,DEPARTMENT OF STATE,2/26/2025,122842.8,2025-02-26,2025-03-05-1332,
1307,DEPARTMENT OF STATE,2/26/2025,122700.0,2025-02-26,2025-03-05-1332,
1308,DEPARTMENT OF STATE,2/26/2025,121125.0,2025-02-26,2025-03-05-1332,
1309,DEPARTMENT OF STATE,2/26/2025,121114.0,2025-02-26,2025-03-05-1332,
1310,DEPARTMENT OF STATE,2/26/2025,120716.78,2025-02-26,2025-03-05-1332,
1311,DEPARTMENT OF STATE,2/26/2025,120250.5,2025-02-26,2025-03-05-1332,
1312,DEPARTMENT OF STATE,2/26/2025,120000.0,2025-02-26,2025-03-05-1332,
1313,DEPARTMENT OF STATE,2/26/2025,119999.0,2025-02-26,2025-03-05-1332,
1314,DEPARTMENT OF STATE,2/26/2025,119460.0,2025-02-26,2025-03-05-1332,
1315,DEPARTMENT OF STATE,2/26/2025,118871.39,2025-02-26,2025-03-05-1332,
1316,DEPARTMENT OF STATE,2/26/2025,117500.0,2025-02-26,2025-03-05-1332,
1317,DEPARTMENT OF STATE,2/26/2025,116518.0,2025-02-26,2025-03-05-1332,
1318,DEPARTMENT OF STATE,2/26/2025,113831.0,2025-02-26,2025-03-05-1332,
1319,DEPARTMENT OF STATE,2/26/2025,112863.0,2025-02-26,2025-03-05-1332,
1320,DEPARTMENT OF STATE,2/26/2025,111900.0,2025-02-26,2025-03-05-1332,
1321,DEPARTMENT OF STATE,2/26/2025,111843.0,2025-02-26,2025-03-05-1332,
1322,DEPARTMENT OF STATE,2/26/2025,110870.0,2025-02-26,2025-03-05-1332,
1323,DEPARTMENT OF STATE,2/26/2025,107032.3,2025-02-26,2025-03-05-1332,
1324,DEPARTMENT OF STATE,2/26/2025,106000.0,2025-02-26,2025-03-05-1332,
1325,DEPARTMENT OF STATE,2/26/2025,105139.0,2025-02-26,2025-03-05-1332,
1326,DEPARTMENT OF STATE,2/26/2025,105035.0,2025-02-26,2025-03-05-1332,
1327,DEPARTMENT OF STATE,2/26/2025,105000.0,2025-02-26,2025-03-05-1332,
1328,DEPARTMENT OF STATE,2/26/2025,104993.82,2025-02-26,2025-03-05-1332,
1329,DEPARTMENT OF STATE,2/26/2025,103553.0,2025-02-26,2025-03-05-1332,
1330,DEPARTMENT OF STATE,2/26/2025,102934.0,2025-02-26,2025-03-05-1332,
1331,DEPARTMENT OF STATE,2/26/2025,101491.0,2025-02-26,2025-03-05-1332,
1332,DEPARTMENT OF STATE,2/26/2025,101188.0,2025-02-26,2025-03-05-1332,
1333,DEPARTMENT OF STATE,2/26/2025,100931.0,2025-02-26,2025-03-05-1332,
1334,DEPARTMENT OF STATE,2/26/2025,100820.0,2025-02-26,2025-03-05-1332,
1335,DEPARTMENT OF STATE,2/26/2025,100710.0,2025-02-26,2025-03-05-1332,
1336,DEPARTMENT OF STATE,2/26/2025,100309.0,2025-02-26,2025-03-05-1332,
1337,DEPARTMENT OF STATE,2/26/2025,100245.0,2025-02-26,2025-03-05-1332,
1338,DEPARTMENT OF STATE,2/26/2025,100185.0,2025-02-26,2025-03-05-1332,
1339,DEPARTMENT OF STATE,2/26/2025,1546296.0,2025-02-26,2025-03-05-1332,
1340,DEPARTMENT OF STATE,2/26/2025,567901.0,2025-02-26,2025-03-05-1332,
1341,DEPARTMENT OF STATE,2/26/2025,99997.2,2025-02-26,2025-03-05-1332,
1342,DEPARTMENT OF STATE,2/26/2025,99996.72,2025-02-26,2025-03-05-1332,
1343,DEPARTMENT OF STATE,2/26/2025,99990.0,2025-02-26,2025-03-05-1332,
1344,DEPARTMENT OF STATE,2/26/2025,99984.42,2025-02-26,2025-03-05-1332,
1345,DEPARTMENT OF STATE,2/26/2025,99978.9,2025-02-26,2025-03-05-1332,
1346,DEPARTMENT OF STATE,2/26/2025,99964.31,2025-02-26,2025-03-05-1332,
1347,DEPARTMENT OF STATE,2/26/2025,99964.23,2025-02-26,2025-03-05-1332,
1348,DEPARTMENT OF STATE,2/26/2025,99934.0,2025-02-26,2025-03-05-1332,
1349,DEPARTMENT OF STATE,2/26/2025,99924.0,2025-02-26,2025-03-05-1332,
1350,DEPARTMENT OF STATE,2/26/2025,99788.0,2025-02-26,2025-03-05-1332,
1351,DEPARTMENT OF STATE,2/26/2025,99787.41,2025-02-26,2025-03-05-1332,
1352,DEPARTMENT OF STATE,2/26/2025,99764.23,2025-02-26,2025-03-05-1332,
1353,DEPARTMENT OF STATE,2/26/2025,99505.0,2025-02-26,2025-03-05-1332,
1354,DEPARTMENT OF STATE,2/26/2025,99445.0,2025-02-26,2025-03-05-1332,
1355,DEPARTMENT OF STATE,2/26/2025,99151.19,2025-02-26,2025-03-05-1332,
1356,DEPARTMENT OF STATE,2/26/2025,99000.0,2025-02-26,2025-03-05-1332,
1357,DEPARTMENT OF STATE,2/26/2025,98700.0,2025-02-26,2025-03-05-1332,
1358,DEPARTMENT OF STATE,2/26/2025,98670.69,2025-02-26,2025-03-05-1332,
1359,DEPARTMENT OF STATE,2/26/2025,98500.0,2025-02-26,2025-03-05-1332,
1360,DEPARTMENT OF STATE,2/26/2025,98000.0,2025-02-26,2025-03-05-1332,
1361,DEPARTMENT OF STATE,2/26/2025,97200.0,2025-02-26,2025-03-05-1332,
1362,DEPARTMENT OF STATE,2/26/2025,97007.5,2025-02-26,2025-03-05-1332,
1363,DEPARTMENT OF STATE,2/26/2025,96460.0,2025-02-26,2025-03-05-1332,
1364,DEPARTMENT OF STATE,2/26/2025,94909.0,2025-02-26,2025-03-05-1332,
1365,DEPARTMENT OF STATE,2/26/2025,94664.0,2025-02-26,2025-03-05-1332,
1366,DEPARTMENT OF STATE,2/26/2025,94357.0,2025-02-26,2025-03-05-1332,
1367,DEPARTMENT OF STATE,2/26/2025,93907.0,2025-02-26,2025-03-05-1332,
1368,DEPARTMENT OF STATE,2/26/2025,93333.0,2025-02-26,2025-03-05-1332,
1369,DEPARTMENT OF STATE,2/26/2025,93000.0,2025-02-26,2025-03-05-1332,
1370,DEPARTMENT OF STATE,2/26/2025,92544.0,2025-02-26,2025-03-05-1332,
1371,DEPARTMENT OF STATE,2/26/2025,91397.0,2025-02-26,2025-03-05-1332,
1372,DEPARTMENT OF STATE,2/26/2025,91100.0,2025-02-26,2025-03-05-1332,
1373,DEPARTMENT OF STATE,2/26/2025,91000.0,2025-02-26,2025-03-05-1332,
1374,DEPARTMENT OF STATE,2/26/2025,90909.0,2025-02-26,2025-03-05-1332,
1375,DEPARTMENT OF STATE,2/26/2025,89895.0,2025-02-26,2025-03-05-1332,
1376,DEPARTMENT OF STATE,2/26/2025,89804.0,2025-02-26,2025-03-05-1332,
1377,DEPARTMENT OF STATE,2/26/2025,89712.0,2025-02-26,2025-03-05-1332,
1378,DEPARTMENT OF STATE,2/26/2025,89412.0,2025-02-26,2025-03-05-1332,
1379,DEPARTMENT OF STATE,2/26/2025,89000.0,2025-02-26,2025-03-05-1332,
1380,DEPARTMENT OF STATE,2/26/2025,87598.0,2025-02-26,2025-03-05-1332,
1381,DEPARTMENT OF STATE,2/26/2025,87360.0,2025-02-26,2025-03-05-1332,
1382,DEPARTMENT OF STATE,2/26/2025,87215.34,2025-02-26,2025-03-05-1332,
1383,DEPARTMENT OF STATE,2/26/2025,87000.0,2025-02-26,2025-03-05-1332,
1384,DEPARTMENT OF STATE,2/26/2025,86994.0,2025-02-26,2025-03-05-1332,
1385,DEPARTMENT OF STATE,2/26/2025,86818.0,2025-02-26,2025-03-05-1332,
1386,DEPARTMENT OF STATE,2/26/2025,86730.0,2025-02-26,2025-03-05-1332,
1387,DEPARTMENT OF STATE,2/26/2025,86698.0,2025-02-26,2025-03-05-1332,
1388,DEPARTMENT OF STATE,2/26/2025,86482.0,2025-02-26,2025-03-05-1332,
1389,DEPARTMENT OF STATE,2/26/2025,86119.81,2025-02-26,2025-03-05-1332,
1390,DEPARTMENT OF STATE,2/26/2025,85439.0,2025-02-26,2025-03-05-1332,
1391,DEPARTMENT OF STATE,2/26/2025,43420.0,2025-02-26,2025-03-05-1332,
1392,DEPARTMENT OF STATE,2/26/2025,85100.0,2025-02-26,2025-03-05-1332,
1393,DEPARTMENT OF STATE,2/26/2025,85023.0,2025-02-26,2025-03-05-1332,
1394,DEPARTMENT OF STATE,2/26/2025,84333.0,2025-02-26,2025-03-05-1332,
1395,DEPARTMENT OF STATE,2/26/2025,83497.0,2025-02-26,2025-03-05-1332,
1396,DEPARTMENT OF STATE,2/26/2025,82566.96,2025-02-26,2025-03-05-1332,
1397,DEPARTMENT OF STATE,2/26/2025,82540.0,2025-02-26,2025-03-05-1332,
1398,DEPARTMENT OF STATE,2/26/2025,82500.0,2025-02-26,2025-03-05-1332,
1399,DEPARTMENT OF STATE,2/26/2025,81900.0,2025-02-26,2025-03-05-1332,
1400,DEPARTMENT OF STATE,2/26/2025,81363.0,2025-02-26,2025-03-05-1332,
1401,DEPARTMENT OF STATE,2/26/2025,81300.0,2025-02-26,2025-03-05-1332,
