agency,uploaded_on,value,uploaded_dt,dt_scrape,description
DEPARTMENT OF EDUCATION,2/7/2025,9475685.0,2025-02-07,2025-03-05-1332,
DEPARTMENT OF EDUCATION,2/7/2025,6862220.0,2025-02-07,2025-03-05-1332,
DEPARTMENT OF EDUCATION,2/7/2025,7323924.0,2025-02-07,2025-03-05-1332,
DEPARTMENT OF EDUCATION,2/10/2025,12192041.0,2025-02-10,2025-03-05-1332,
DEPARTMENT OF EDUCATION,2/10/2025,13757722.0,2025-02-10,2025-03-05-1332,
DEPARTMENT OF EDUCATION,2/10/2025,6262866.0,2025-02-10,2025-03-05-1332,
DEPARTMENT OF EDUCATION,2/10/2025,9999851.0,2025-02-10,2025-03-05-1332,
DEPARTMENT OF EDUCATION,2/10/2025,9219756.0,2025-02-10,2025-03-05-1332,
DEPARTMENT OF EDUCATION,2/10/2025,4525065.0,2025-02-10,2025-03-05-1332,
DEPARTMENT OF EDUCATION,2/10/2025,14252797.0,2025-02-10,2025-03-05-1332,
DEPARTMENT OF EDUCATION,2/10/2025,9876928.0,2025-02-10,2025-03-05-1332,
DEPARTMENT OF EDUCATION,2/10/2025,10261487.0,2025-02-10,2025-03-05-1332,
DEPARTMENT OF EDUCATION,2/10/2025,17731785.0,2025-02-10,2025-03-05-1332,
DEPARTMENT OF EDUCATION,2/10/2025,8652361.0,2025-02-10,2025-03-05-1332,
DEPARTMENT OF EDUCATION,2/10/2025,9146065.0,2025-02-10,2025-03-05-1332,
DEPARTMENT OF EDUCATION,2/10/2025,7220136.0,2025-02-10,2025-03-05-1332,
DEPARTMENT OF EDUCATION,2/10/2025,5406889.0,2025-02-10,2025-03-05-1332,
DEPARTMENT OF EDUCATION,2/10/2025,14797304.0,2025-02-10,2025-03-05-1332,
DEPARTMENT OF EDUCATION,2/10/2025,3348763.0,2025-02-10,2025-03-05-1332,
DEPARTMENT OF EDUCATION,2/10/2025,9150854.0,2025-02-10,2025-03-05-1332,
DEPARTMENT OF EDUCATION,2/10/2025,4506218.0,2025-02-10,2025-03-05-1332,
DEPARTMENT OF EDUCATION,2/10/2025,11653965.0,2025-02-10,2025-03-05-1332,
DEPARTMENT OF EDUCATION,2/10/2025,13318352.0,2025-02-10,2025-03-05-1332,
DEPARTMENT OF EDUCATION,2/10/2025,5277224.0,2025-02-10,2025-03-05-1332,
DEPARTMENT OF EDUCATION,2/10/2025,6903111.0,2025-02-10,2025-03-05-1332,
DEPARTMENT OF EDUCATION,2/10/2025,2775628.0,2025-02-10,2025-03-05-1332,
DEPARTMENT OF EDUCATION,2/10/2025,662744.0,2025-02-10,2025-03-05-1332,
DEPARTMENT OF EDUCATION,2/10/2025,15005675.0,2025-02-10,2025-03-05-1332,
DEPARTMENT OF EDUCATION,2/10/2025,5947162.0,2025-02-10,2025-03-05-1332,
DEPARTMENT OF EDUCATION,2/10/2025,3931044.0,2025-02-10,2025-03-05-1332,
DEPARTMENT OF EDUCATION,2/10/2025,2172133.0,2025-02-10,2025-03-05-1332,
DEPARTMENT OF EDUCATION,2/10/2025,3490854.0,2025-02-10,2025-03-05-1332,
USAID,1/24/2025,2365702.0,2025-01-24,2025-03-05-1332,
USAID,1/30/2025,8000000.0,2025-01-30,2025-03-05-1332,
USAID,2/10/2025,15700000.0,2025-02-10,2025-03-05-1332,
USAID,2/10/2025,24500000.0,2025-02-10,2025-03-05-1332,
USAID,2/10/2025,19526440.0,2025-02-10,2025-03-05-1332,
USAID,2/10/2025,1500000.0,2025-02-10,2025-03-05-1332,
USAID,2/10/2025,10000000.0,2025-02-10,2025-03-05-1332,
USAID,2/10/2025,1000000.0,2025-02-10,2025-03-05-1332,
USAID,2/10/2025,6000000.0,2025-02-10,2025-03-05-1332,
USAID,2/10/2025,28000000.0,2025-02-10,2025-03-05-1332,
USAID,2/10/2025,11000000.0,2025-02-10,2025-03-05-1332,
USAID,2/10/2025,15999654.0,2025-02-10,2025-03-05-1332,
USAID,2/10/2025,1466694.0,2025-02-10,2025-03-05-1332,
USAID,2/10/2025,185000.0,2025-02-10,2025-03-05-1332,
USAID,2/10/2025,16355000.0,2025-02-10,2025-03-05-1332,
USAID,2/10/2025,4700000.0,2025-02-10,2025-03-05-1332,
USAID,2/11/2025,21600000.0,2025-02-11,2025-03-05-1332,
USAID,2/11/2025,2399953.0,2025-02-11,2025-03-05-1332,
USAID,2/11/2025,26490383.0,2025-02-11,2025-03-05-1332,
USAID,2/11/2025,14950000.0,2025-02-11,2025-03-05-1332,
USAID,2/11/2025,500000.0,2025-02-11,2025-03-05-1332,
USAID,2/11/2025,14550000.0,2025-02-11,2025-03-05-1332,
USAID,2/11/2025,21000000.0,2025-02-11,2025-03-05-1332,
USAID,1/25/2025,9949533.0,2025-01-25,2025-03-05-1332,
USAID,2/11/2025,3020000.0,2025-02-11,2025-03-05-1332,
USAID,2/11/2025,1999451.0,2025-02-11,2025-03-05-1332,
USAID,2/11/2025,19800000.0,2025-02-11,2025-03-05-1332,
USAID,2/11/2025,4000000.0,2025-02-11,2025-03-05-1332,
USAID,2/11/2025,17500000.0,2025-02-11,2025-03-05-1332,
USAID,2/11/2025,6400000.0,2025-02-11,2025-03-05-1332,
USAID,2/11/2025,17000000.0,2025-02-11,2025-03-05-1332,
USAID,2/11/2025,24500000.0,2025-02-11,2025-03-05-1332,
USAID,2/11/2025,29000000.0,2025-02-11,2025-03-05-1332,
USAID,2/11/2025,25000000.0,2025-02-11,2025-03-05-1332,
USAID,2/11/2025,36000000.0,2025-02-11,2025-03-05-1332,
USAID,2/11/2025,20000000.0,2025-02-11,2025-03-05-1332,
USAID,2/11/2025,47000000.0,2025-02-11,2025-03-05-1332,
USAID,2/11/2025,4600000.0,2025-02-11,2025-03-05-1332,
USAID,2/11/2025,4186109.0,2025-02-11,2025-03-05-1332,
USAID,2/11/2025,10851354.0,2025-02-11,2025-03-05-1332,
USAID,2/11/2025,7000000.0,2025-02-11,2025-03-05-1332,
USAID,2/11/2025,20469999.0,2025-02-11,2025-03-05-1332,
USAID,2/11/2025,5000000.0,2025-02-11,2025-03-05-1332,
USAID,2/11/2025,26056000.0,2025-02-11,2025-03-05-1332,
USAID,1/30/2025,400000.0,2025-01-30,2025-03-05-1332,
USAID,2/11/2025,19477181.0,2025-02-11,2025-03-05-1332,
USAID,2/12/2025,2000000.0,2025-02-12,2025-03-05-1332,
USAID,2/12/2025,15550000.0,2025-02-12,2025-03-05-1332,
USAID,2/12/2025,19000000.0,2025-02-12,2025-03-05-1332,
USAID,2/12/2025,9500000.0,2025-02-12,2025-03-05-1332,
USAID,2/12/2025,17600000.0,2025-02-12,2025-03-05-1332,
USAID,2/12/2025,19600000.0,2025-02-12,2025-03-05-1332,
USAID,2/6/2025,1799150.0,2025-02-06,2025-03-05-1332,
USAID,2/10/2025,77500000.0,2025-02-10,2025-03-05-1332,
USAID,2/10/2025,62500000.0,2025-02-10,2025-03-05-1332,
USAID,2/6/2025,7500000.0,2025-02-06,2025-03-05-1332,
USAID,2/6/2025,49964668.0,2025-02-06,2025-03-05-1332,
USAID,2/6/2025,199251.0,2025-02-06,2025-03-05-1332,
USAID,2/10/2025,4377394.0,2025-02-10,2025-03-05-1332,
USAID,2/10/2025,2499995.0,2025-02-10,2025-03-05-1332,
USAID,2/10/2025,899858.0,2025-02-10,2025-03-05-1332,
USAID,2/10/2025,18735000.0,2025-02-10,2025-03-05-1332,
USAID,2/10/2025,700000.0,2025-02-10,2025-03-05-1332,
USAID,2/10/2025,5000000.0,2025-02-10,2025-03-05-1332,
USAID,2/10/2025,8250000.0,2025-02-10,2025-03-05-1332,
USAID,2/10/2025,2500000.0,2025-02-10,2025-03-05-1332,
USAID,2/12/0205,59552142.0,,2025-03-05-1332,
USAID,2/11/2025,20100000.0,2025-02-11,2025-03-05-1332,
USAID,2/11/2025,70000000.0,2025-02-11,2025-03-05-1332,
USAID,2/11/2025,35000000.0,2025-02-11,2025-03-05-1332,
USAID,2/11/2025,53264317.0,2025-02-11,2025-03-05-1332,
USAID,2/11/2025,24999825.0,2025-02-11,2025-03-05-1332,
USAID,2/11/2025,40000000.0,2025-02-11,2025-03-05-1332,
USAID,2/11/2025,79249987.0,2025-02-11,2025-03-05-1332,
USAID,2/11/2025,62000000.0,2025-02-11,2025-03-05-1332,
USAID,2/11/2025,42217035.0,2025-02-11,2025-03-05-1332,
USAID,2/11/2025,43000000.0,2025-02-11,2025-03-05-1332,
USAID,2/11/2025,49500000.0,2025-02-11,2025-03-05-1332,
USAID,2/11/2025,43568610.0,2025-02-11,2025-03-05-1332,
USAID,2/11/2025,54992940.0,2025-02-11,2025-03-05-1332,
USAID,2/11/2025,128500000.0,2025-02-11,2025-03-05-1332,
USAID,2/6/2025,1800000.0,2025-02-06,2025-03-05-1332,
USAID,2/11/2025,62900000.0,2025-02-11,2025-03-05-1332,
USAID,2/11/2025,38000000.0,2025-02-11,2025-03-05-1332,
USAID,2/11/2025,1323093.0,2025-02-11,2025-03-05-1332,
USAID,2/12/2025,93599994.0,2025-02-12,2025-03-05-1332,
USAID,2/12/2025,96999895.0,2025-02-12,2025-03-05-1332,
USAID,2/12/2025,47500000.0,2025-02-12,2025-03-05-1332,
USAID,2/12/2025,37495000.0,2025-02-12,2025-03-05-1332,
USAID,2/12/2025,60000000.0,2025-02-12,2025-03-05-1332,
USAID,2/6/2025,1500000.0,2025-02-06,2025-03-05-1332,
USAID,2/12/2025,25635960.0,2025-02-12,2025-03-05-1332,
USAID,2/6/2025,3467480.0,2025-02-06,2025-03-05-1332,
USAID,2/6/2025,1195836.0,2025-02-06,2025-03-05-1332,
USAID,2/7/2025,500000.0,2025-02-07,2025-03-05-1332,
USAID,2/10/2025,21823000.0,2025-02-10,2025-03-05-1332,
USAID,2/10/2025,40000000.0,2025-02-10,2025-03-05-1332,
USAID,2/10/2025,90000000.0,2025-02-10,2025-03-05-1332,
USAID,2/10/2025,55000000.0,2025-02-10,2025-03-05-1332,
USAID,2/11/2025,14500000.0,2025-02-11,2025-03-05-1332,
USAID,2/6/2025,318653764.0,2025-02-06,2025-03-05-1332,
USAID,2/11/2025,29946856.0,2025-02-11,2025-03-05-1332,
USAID,2/6/2025,30000000.0,2025-02-06,2025-03-05-1332,
USAID,2/6/2025,20759.0,2025-02-06,2025-03-05-1332,
USAID,2/11/2025,39484357.0,2025-02-11,2025-03-05-1332,
USAID,2/13/2025,60000000.0,2025-02-13,2025-03-05-1332,
USAID,2/13/2025,51310195.0,2025-02-13,2025-03-05-1332,
DEPARTMENT OF EDUCATION,2/12/2025,2165033.0,2025-02-12,2025-03-05-1332,
DEPARTMENT OF EDUCATION,2/12/2025,4882350.0,2025-02-12,2025-03-05-1332,
DEPARTMENT OF EDUCATION,2/12/2025,3692915.0,2025-02-12,2025-03-05-1332,
DEPARTMENT OF EDUCATION,2/12/2025,2371270.0,2025-02-12,2025-03-05-1332,
DEPARTMENT OF EDUCATION,2/12/2025,2804102.0,2025-02-12,2025-03-05-1332,
DEPARTMENT OF EDUCATION,2/12/2025,6513745.0,2025-02-12,2025-03-05-1332,
DEPARTMENT OF EDUCATION,2/12/2025,7117470.0,2025-02-12,2025-03-05-1332,
DEPARTMENT OF EDUCATION,2/12/2025,6657837.0,2025-02-12,2025-03-05-1332,
DEPARTMENT OF EDUCATION,2/12/2025,6568462.0,2025-02-12,2025-03-05-1332,
DEPARTMENT OF EDUCATION,2/12/2025,1319977.0,2025-02-12,2025-03-05-1332,
DEPARTMENT OF EDUCATION,2/12/2025,5930962.0,2025-02-12,2025-03-05-1332,
DEPARTMENT OF EDUCATION,2/12/2025,8378847.0,2025-02-12,2025-03-05-1332,
DEPARTMENT OF EDUCATION,2/12/2025,3050976.0,2025-02-12,2025-03-05-1332,
DEPARTMENT OF EDUCATION,2/12/2025,4006731.0,2025-02-12,2025-03-05-1332,
DEPARTMENT OF EDUCATION,2/12/2025,2370130.0,2025-02-12,2025-03-05-1332,
DEPARTMENT OF EDUCATION,2/12/2025,8389304.0,2025-02-12,2025-03-05-1332,
DEPARTMENT OF EDUCATION,2/12/2025,6007002.0,2025-02-12,2025-03-05-1332,
DEPARTMENT OF EDUCATION,2/12/2025,6241763.0,2025-02-12,2025-03-05-1332,
DEPARTMENT OF EDUCATION,2/12/2025,2616124.0,2025-02-12,2025-03-05-1332,
DEPARTMENT OF EDUCATION,2/12/2025,4171894.0,2025-02-12,2025-03-05-1332,
DEPARTMENT OF EDUCATION,2/12/2025,8545893.0,2025-02-12,2025-03-05-1332,
DEPARTMENT OF EDUCATION,2/12/2025,1414373.0,2025-02-12,2025-03-05-1332,
DEPARTMENT OF EDUCATION,2/12/2025,5649324.0,2025-02-12,2025-03-05-1332,
DEPARTMENT OF EDUCATION,2/12/2025,1106304.0,2025-02-12,2025-03-05-1332,
DEPARTMENT OF EDUCATION,2/12/2025,5293227.0,2025-02-12,2025-03-05-1332,
DEPARTMENT OF EDUCATION,2/12/2025,3335348.0,2025-02-12,2025-03-05-1332,
DEPARTMENT OF EDUCATION,2/12/2025,4503669.0,2025-02-12,2025-03-05-1332,
DEPARTMENT OF EDUCATION,2/12/2025,7878539.0,2025-02-12,2025-03-05-1332,
DEPARTMENT OF EDUCATION,2/12/2025,4228801.0,2025-02-12,2025-03-05-1332,
DEPARTMENT OF EDUCATION,2/12/2025,2375747.0,2025-02-12,2025-03-05-1332,
DEPARTMENT OF EDUCATION,2/12/2025,3356160.0,2025-02-12,2025-03-05-1332,
DEPARTMENT OF EDUCATION,2/12/2025,9719230.0,2025-02-12,2025-03-05-1332,
DEPARTMENT OF EDUCATION,2/12/2025,1303909.0,2025-02-12,2025-03-05-1332,
DEPARTMENT OF EDUCATION,2/12/2025,2294738.0,2025-02-12,2025-03-05-1332,
DEPARTMENT OF EDUCATION,2/12/2025,3285709.0,2025-02-12,2025-03-05-1332,
DEPARTMENT OF EDUCATION,2/12/2025,1261718.0,2025-02-12,2025-03-05-1332,
DEPARTMENT OF EDUCATION,2/12/2025,1186935.0,2025-02-12,2025-03-05-1332,
DEPARTMENT OF EDUCATION,2/12/2025,487807.0,2025-02-12,2025-03-05-1332,
DEPARTMENT OF EDUCATION,2/12/2025,3524401.0,2025-02-12,2025-03-05-1332,
DEPARTMENT OF EDUCATION,2/12/2025,1849011.0,2025-02-12,2025-03-05-1332,
DEPARTMENT OF EDUCATION,2/12/2025,4073691.0,2025-02-12,2025-03-05-1332,
DEPARTMENT OF EDUCATION,2/12/2025,1797750.0,2025-02-12,2025-03-05-1332,
DEPARTMENT OF EDUCATION,2/12/2025,3844820.0,2025-02-12,2025-03-05-1332,
DEPARTMENT OF EDUCATION,2/12/2025,8044648.0,2025-02-12,2025-03-05-1332,
DEPARTMENT OF EDUCATION,2/12/2025,3499999.0,2025-02-12,2025-03-05-1332,
DEPARTMENT OF EDUCATION,2/12/2025,4719035.0,2025-02-12,2025-03-05-1332,
DEPARTMENT OF EDUCATION,2/12/2025,5898695.0,2025-02-12,2025-03-05-1332,
DEPARTMENT OF EDUCATION,2/12/2025,7487510.0,2025-02-12,2025-03-05-1332,
DEPARTMENT OF EDUCATION,2/12/2025,631843.0,2025-02-12,2025-03-05-1332,
DEPARTMENT OF EDUCATION,2/12/2025,3791664.0,2025-02-12,2025-03-05-1332,
DEPARTMENT OF EDUCATION,2/12/2025,1184430.0,2025-02-12,2025-03-05-1332,
DEPARTMENT OF EDUCATION,2/12/2025,7469325.0,2025-02-12,2025-03-05-1332,
DEPARTMENT OF EDUCATION,2/12/2025,9306229.0,2025-02-12,2025-03-05-1332,
DEPARTMENT OF EDUCATION,2/12/2025,5747655.0,2025-02-12,2025-03-05-1332,
DEPARTMENT OF EDUCATION,2/12/2025,7975521.0,2025-02-12,2025-03-05-1332,
DEPARTMENT OF EDUCATION,2/12/2025,2361400.0,2025-02-12,2025-03-05-1332,
DEPARTMENT OF EDUCATION,2/12/2025,9056449.0,2025-02-12,2025-03-05-1332,
DEPARTMENT OF EDUCATION,2/12/2025,2158238.0,2025-02-12,2025-03-05-1332,
DEPARTMENT OF EDUCATION,2/12/2025,8502340.0,2025-02-12,2025-03-05-1332,
DEPARTMENT OF EDUCATION,2/12/2025,4676106.0,2025-02-12,2025-03-05-1332,
DEPARTMENT OF EDUCATION,2/12/2025,4237200.0,2025-02-12,2025-03-05-1332,
DEPARTMENT OF EDUCATION,2/12/2025,9258547.0,2025-02-12,2025-03-05-1332,
DEPARTMENT OF EDUCATION,2/12/2025,7988347.0,2025-02-12,2025-03-05-1332,
DEPARTMENT OF EDUCATION,2/12/2025,5153884.0,2025-02-12,2025-03-05-1332,
DEPARTMENT OF EDUCATION,2/12/2025,8017306.0,2025-02-12,2025-03-05-1332,
DEPARTMENT OF EDUCATION,2/12/2025,3380649.0,2025-02-12,2025-03-05-1332,
DEPARTMENT OF EDUCATION,2/12/2025,8407872.0,2025-02-12,2025-03-05-1332,
DEPARTMENT OF EDUCATION,2/12/2025,9913020.0,2025-02-12,2025-03-05-1332,
DEPARTMENT OF EDUCATION,2/12/2025,3067134.0,2025-02-12,2025-03-05-1332,
DEPARTMENT OF EDUCATION,2/12/2025,8510029.0,2025-02-12,2025-03-05-1332,
DEPARTMENT OF EDUCATION,2/13/2025,8218498.0,2025-02-13,2025-03-05-1332,
DEPARTMENT OF EDUCATION,2/13/2025,8226640.0,2025-02-13,2025-03-05-1332,
DEPARTMENT OF EDUCATION,2/13/2025,8294184.0,2025-02-13,2025-03-05-1332,
DEPARTMENT OF EDUCATION,2/13/2025,8107355.0,2025-02-13,2025-03-05-1332,
DEPARTMENT OF EDUCATION,2/18/2025,11396794.0,2025-02-18,2025-03-05-1332,
DEPARTMENT OF EDUCATION,2/18/2025,14126498.0,2025-02-18,2025-03-05-1332,
DEPARTMENT OF EDUCATION,2/18/2025,12144894.0,2025-02-18,2025-03-05-1332,
DEPARTMENT OF EDUCATION,2/18/2025,17763689.0,2025-02-18,2025-03-05-1332,
DEPARTMENT OF EDUCATION,2/18/2025,9022106.0,2025-02-18,2025-03-05-1332,
DEPARTMENT OF EDUCATION,2/18/2025,3610469.0,2025-02-18,2025-03-05-1332,
DEPARTMENT OF EDUCATION,2/18/2025,21275095.0,2025-02-18,2025-03-05-1332,
DEPARTMENT OF EDUCATION,2/18/2025,10270782.0,2025-02-18,2025-03-05-1332,
DEPARTMENT OF EDUCATION,2/18/2025,5715777.0,2025-02-18,2025-03-05-1332,
DEPARTMENT OF EDUCATION,2/18/2025,1763513.0,2025-02-18,2025-03-05-1332,
DEPARTMENT OF EDUCATION,2/18/2025,939768.0,2025-02-18,2025-03-05-1332,
DEPARTMENT OF EDUCATION,2/18/2025,6535968.0,2025-02-18,2025-03-05-1332,
DEPARTMENT OF EDUCATION,2/18/2025,12519835.0,2025-02-18,2025-03-05-1332,
DEPARTMENT OF EDUCATION,2/18/2025,6319419.0,2025-02-18,2025-03-05-1332,
DEPARTMENT OF EDUCATION,2/18/2025,7750850.0,2025-02-18,2025-03-05-1332,
DEPARTMENT OF EDUCATION,2/18/2025,8563751.0,2025-02-18,2025-03-05-1332,
DEPARTMENT OF EDUCATION,2/18/2025,6879974.0,2025-02-18,2025-03-05-1332,
DEPARTMENT OF EDUCATION,2/18/2025,10927183.0,2025-02-18,2025-03-05-1332,
DEPARTMENT OF EDUCATION,2/18/2025,7243753.0,2025-02-18,2025-03-05-1332,
DEPARTMENT OF EDUCATION,2/18/2025,17239813.0,2025-02-18,2025-03-05-1332,
DEPARTMENT OF EDUCATION,2/18/2025,1148881.0,2025-02-18,2025-03-05-1332,
DEPARTMENT OF EDUCATION,2/18/2025,11406253.0,2025-02-18,2025-03-05-1332,
DEPARTMENT OF EDUCATION,2/18/2025,6556437.0,2025-02-18,2025-03-05-1332,
DEPARTMENT OF EDUCATION,2/18/2025,5384154.0,2025-02-18,2025-03-05-1332,
DEPARTMENT OF EDUCATION,2/18/2025,13056227.0,2025-02-18,2025-03-05-1332,
DEPARTMENT OF EDUCATION,2/18/2025,2446069.0,2025-02-18,2025-03-05-1332,
DEPARTMENT OF EDUCATION,2/18/2025,13507563.0,2025-02-18,2025-03-05-1332,
DEPARTMENT OF EDUCATION,2/18/2025,7750000.0,2025-02-18,2025-03-05-1332,
DEPARTMENT OF EDUCATION,2/18/2025,9021560.0,2025-02-18,2025-03-05-1332,
DEPARTMENT OF EDUCATION,2/18/2025,25198845.0,2025-02-18,2025-03-05-1332,
DEPARTMENT OF EDUCATION,2/18/2025,22437090.0,2025-02-18,2025-03-05-1332,
DEPARTMENT OF EDUCATION,2/18/2025,30000000.0,2025-02-18,2025-03-05-1332,
DEPARTMENT OF EDUCATION,2/18/2025,5749996.0,2025-02-18,2025-03-05-1332,
DEPARTMENT OF EDUCATION,2/18/2025,12253440.0,2025-02-18,2025-03-05-1332,
DEPARTMENT OF EDUCATION,2/18/2025,11897855.0,2025-02-18,2025-03-05-1332,
DEPARTMENT OF EDUCATION,2/18/2025,23044104.0,2025-02-18,2025-03-05-1332,
DEPARTMENT OF EDUCATION,2/18/2025,9656886.9,2025-02-18,2025-03-05-1332,
DEPARTMENT OF EDUCATION,2/18/2025,11901866.0,2025-02-18,2025-03-05-1332,
DEPARTMENT OF EDUCATION,2/18/2025,11314749.0,2025-02-18,2025-03-05-1332,
DEPARTMENT OF EDUCATION,2/18/2025,15288255.0,2025-02-18,2025-03-05-1332,
DEPARTMENT OF EDUCATION,2/18/2025,5749999.0,2025-02-18,2025-03-05-1332,
DEPARTMENT OF EDUCATION,2/18/2025,5750000.0,2025-02-18,2025-03-05-1332,
DEPARTMENT OF HEALTH AND HUMAN SERVICES,2/20/2025,1000000.0,2025-02-20,2025-03-05-1332,
ENVIRONMENTAL PROTECTION AGENCY,2/22/2025,4000000.0,2025-02-22,2025-03-05-1332,
ENVIRONMENTAL PROTECTION AGENCY,2/22/2025,5100000.0,2025-02-22,2025-03-05-1332,
DEPARTMENT OF STATE,2/26/2025,22300.0,2025-02-26,2025-03-05-1332,
DEPARTMENT OF STATE,2/26/2025,250000000.0,2025-02-26,2025-03-05-1332,
DEPARTMENT OF STATE,2/26/2025,96325832.0,2025-02-26,2025-03-05-1332,
DEPARTMENT OF STATE,2/26/2025,63042000.0,2025-02-26,2025-03-05-1332,
DEPARTMENT OF STATE,2/26/2025,59250000.0,2025-02-26,2025-03-05-1332,
DEPARTMENT OF STATE,2/26/2025,53660000.0,2025-02-26,2025-03-05-1332,
DEPARTMENT OF STATE,2/26/2025,50850000.0,2025-02-26,2025-03-05-1332,
DEPARTMENT OF STATE,2/26/2025,50677151.0,2025-02-26,2025-03-05-1332,
DEPARTMENT OF STATE,2/26/2025,45000000.0,2025-02-26,2025-03-05-1332,
DEPARTMENT OF STATE,2/26/2025,43657781.0,2025-02-26,2025-03-05-1332,
DEPARTMENT OF STATE,2/26/2025,38213325.0,2025-02-26,2025-03-05-1332,
DEPARTMENT OF STATE,2/26/2025,35000000.0,2025-02-26,2025-03-05-1332,
DEPARTMENT OF STATE,2/26/2025,31510591.0,2025-02-26,2025-03-05-1332,
DEPARTMENT OF STATE,2/26/2025,30905027.0,2025-02-26,2025-03-05-1332,
DEPARTMENT OF STATE,2/26/2025,30147074.0,2025-02-26,2025-03-05-1332,
DEPARTMENT OF STATE,2/26/2025,30000000.0,2025-02-26,2025-03-05-1332,
DEPARTMENT OF STATE,2/26/2025,28410490.0,2025-02-26,2025-03-05-1332,
DEPARTMENT OF STATE,2/26/2025,28064399.0,2025-02-26,2025-03-05-1332,
DEPARTMENT OF STATE,2/26/2025,27729878.0,2025-02-26,2025-03-05-1332,
DEPARTMENT OF STATE,2/26/2025,25298782.0,2025-02-26,2025-03-05-1332,
DEPARTMENT OF STATE,2/26/2025,22469135.0,2025-02-26,2025-03-05-1332,
DEPARTMENT OF STATE,2/26/2025,21873120.0,2025-02-26,2025-03-05-1332,
DEPARTMENT OF STATE,2/26/2025,21728395.0,2025-02-26,2025-03-05-1332,
DEPARTMENT OF STATE,2/26/2025,20897571.0,2025-02-26,2025-03-05-1332,
DEPARTMENT OF STATE,2/26/2025,20450000.0,2025-02-26,2025-03-05-1332,
DEPARTMENT OF STATE,2/26/2025,20250000.0,2025-02-26,2025-03-05-1332,
DEPARTMENT OF STATE,2/26/2025,20176805.0,2025-02-26,2025-03-05-1332,
DEPARTMENT OF STATE,2/26/2025,19636020.0,2025-02-26,2025-03-05-1332,
DEPARTMENT OF STATE,2/26/2025,19119665.0,2025-02-26,2025-03-05-1332,
DEPARTMENT OF STATE,2/26/2025,19000000.0,2025-02-26,2025-03-05-1332,
DEPARTMENT OF STATE,2/26/2025,18930511.0,2025-02-26,2025-03-05-1332,
DEPARTMENT OF STATE,2/26/2025,18518518.0,2025-02-26,2025-03-05-1332,
DEPARTMENT OF STATE,2/26/2025,18390884.0,2025-02-26,2025-03-05-1332,
DEPARTMENT OF STATE,2/26/2025,18271605.0,2025-02-26,2025-03-05-1332,
DEPARTMENT OF STATE,2/26/2025,4885890.0,2025-02-26,2025-03-05-1332,
DEPARTMENT OF STATE,2/26/2025,18230357.0,2025-02-26,2025-03-05-1332,
DEPARTMENT OF STATE,2/26/2025,17981265.0,2025-02-26,2025-03-05-1332,
DEPARTMENT OF STATE,2/26/2025,17915753.0,2025-02-26,2025-03-05-1332,
DEPARTMENT OF STATE,2/26/2025,17500000.0,2025-02-26,2025-03-05-1332,
DEPARTMENT OF STATE,2/26/2025,17325101.0,2025-02-26,2025-03-05-1332,
DEPARTMENT OF STATE,2/26/2025,16218984.0,2025-02-26,2025-03-05-1332,
DEPARTMENT OF STATE,2/26/2025,16111638.0,2025-02-26,2025-03-05-1332,
DEPARTMENT OF STATE,2/26/2025,16045000.0,2025-02-26,2025-03-05-1332,
DEPARTMENT OF STATE,2/26/2025,15709203.0,2025-02-26,2025-03-05-1332,
DEPARTMENT OF STATE,2/26/2025,15331694.0,2025-02-26,2025-03-05-1332,
DEPARTMENT OF STATE,2/26/2025,15204563.0,2025-02-26,2025-03-05-1332,
DEPARTMENT OF STATE,2/26/2025,15111685.0,2025-02-26,2025-03-05-1332,
DEPARTMENT OF STATE,2/26/2025,14573933.0,2025-02-26,2025-03-05-1332,
DEPARTMENT OF STATE,2/26/2025,14469134.0,2025-02-26,2025-03-05-1332,
DEPARTMENT OF STATE,2/26/2025,13799360.0,2025-02-26,2025-03-05-1332,
DEPARTMENT OF STATE,2/26/2025,13749340.0,2025-02-26,2025-03-05-1332,
DEPARTMENT OF STATE,2/26/2025,13363942.39,2025-02-26,2025-03-05-1332,
DEPARTMENT OF STATE,2/26/2025,1958000.0,2025-02-26,2025-03-05-1332,
DEPARTMENT OF STATE,2/26/2025,13310000.0,2025-02-26,2025-03-05-1332,
DEPARTMENT OF STATE,2/26/2025,13216370.0,2025-02-26,2025-03-05-1332,
DEPARTMENT OF STATE,2/26/2025,16739.75,2025-02-26,2025-03-05-1332,
DEPARTMENT OF STATE,2/26/2025,12866082.0,2025-02-26,2025-03-05-1332,
DEPARTMENT OF STATE,2/26/2025,12819252.0,2025-02-26,2025-03-05-1332,
DEPARTMENT OF STATE,2/26/2025,12340000.0,2025-02-26,2025-03-05-1332,
DEPARTMENT OF STATE,2/26/2025,12218281.0,2025-02-26,2025-03-05-1332,
DEPARTMENT OF STATE,2/26/2025,11731000.0,2025-02-26,2025-03-05-1332,
DEPARTMENT OF STATE,2/26/2025,11417683.0,2025-02-26,2025-03-05-1332,
DEPARTMENT OF STATE,2/26/2025,10005000.0,2025-02-26,2025-03-05-1332,
DEPARTMENT OF STATE,2/26/2025,10000000.0,2025-02-26,2025-03-05-1332,
DEPARTMENT OF STATE,2/26/2025,9899333.57,2025-02-26,2025-03-05-1332,
DEPARTMENT OF STATE,2/26/2025,9816954.0,2025-02-26,2025-03-05-1332,
DEPARTMENT OF STATE,2/26/2025,9795900.0,2025-02-26,2025-03-05-1332,
DEPARTMENT OF STATE,2/26/2025,9693005.0,2025-02-26,2025-03-05-1332,
DEPARTMENT OF STATE,2/26/2025,9500000.0,2025-02-26,2025-03-05-1332,
DEPARTMENT OF STATE,2/26/2025,9410000.0,2025-02-26,2025-03-05-1332,
DEPARTMENT OF STATE,2/26/2025,9389378.0,2025-02-26,2025-03-05-1332,
DEPARTMENT OF STATE,2/26/2025,9277725.0,2025-02-26,2025-03-05-1332,
DEPARTMENT OF STATE,2/26/2025,8990000.0,2025-02-26,2025-03-05-1332,
DEPARTMENT OF STATE,2/26/2025,8887911.0,2025-02-26,2025-03-05-1332,
DEPARTMENT OF STATE,2/26/2025,8814297.0,2025-02-26,2025-03-05-1332,
DEPARTMENT OF STATE,2/26/2025,8600000.0,2025-02-26,2025-03-05-1332,
DEPARTMENT OF STATE,2/26/2025,8540733.23,2025-02-26,2025-03-05-1332,
DEPARTMENT OF STATE,2/26/2025,8520000.0,2025-02-26,2025-03-05-1332,
DEPARTMENT OF STATE,2/26/2025,8500000.0,2025-02-26,2025-03-05-1332,
DEPARTMENT OF STATE,2/26/2025,8391000.0,2025-02-26,2025-03-05-1332,
DEPARTMENT OF STATE,2/26/2025,8139420.17,2025-02-26,2025-03-05-1332,
DEPARTMENT OF STATE,2/26/2025,8138499.0,2025-02-26,2025-03-05-1332,
DEPARTMENT OF STATE,2/26/2025,7990009.0,2025-02-26,2025-03-05-1332,
DEPARTMENT OF STATE,2/26/2025,7986318.0,2025-02-26,2025-03-05-1332,
DEPARTMENT OF STATE,2/26/2025,7950000.0,2025-02-26,2025-03-05-1332,
DEPARTMENT OF STATE,2/26/2025,7582729.0,2025-02-26,2025-03-05-1332,
DEPARTMENT OF STATE,2/26/2025,7500000.0,2025-02-26,2025-03-05-1332,
DEPARTMENT OF STATE,2/26/2025,7326835.0,2025-02-26,2025-03-05-1332,
DEPARTMENT OF STATE,2/26/2025,7293296.0,2025-02-26,2025-03-05-1332,
DEPARTMENT OF STATE,2/26/2025,7166557.0,2025-02-26,2025-03-05-1332,
DEPARTMENT OF STATE,2/26/2025,7087124.0,2025-02-26,2025-03-05-1332,
DEPARTMENT OF STATE,2/26/2025,6925760.93,2025-02-26,2025-03-05-1332,
DEPARTMENT OF STATE,2/26/2025,6913580.0,2025-02-26,2025-03-05-1332,
DEPARTMENT OF STATE,2/26/2025,6905500.0,2025-02-26,2025-03-05-1332,
DEPARTMENT OF STATE,2/26/2025,6800000.0,2025-02-26,2025-03-05-1332,
DEPARTMENT OF STATE,2/26/2025,6707723.0,2025-02-26,2025-03-05-1332,
DEPARTMENT OF STATE,2/26/2025,6625000.0,2025-02-26,2025-03-05-1332,
DEPARTMENT OF STATE,2/26/2025,6542068.0,2025-02-26,2025-03-05-1332,
DEPARTMENT OF STATE,2/26/2025,6457794.0,2025-02-26,2025-03-05-1332,
DEPARTMENT OF STATE,2/26/2025,6341000.0,2025-02-26,2025-03-05-1332,
DEPARTMENT OF STATE,2/26/2025,159000.0,2025-02-26,2025-03-05-1332,
DEPARTMENT OF STATE,2/26/2025,109650.0,2025-02-26,2025-03-05-1332,
DEPARTMENT OF STATE,2/26/2025,6085000.0,2025-02-26,2025-03-05-1332,
DEPARTMENT OF STATE,2/26/2025,28816.0,2025-02-26,2025-03-05-1332,
DEPARTMENT OF STATE,2/26/2025,23095.0,2025-02-26,2025-03-05-1332,
DEPARTMENT OF STATE,2/26/2025,6050000.0,2025-02-26,2025-03-05-1332,
DEPARTMENT OF STATE,2/26/2025,6045060.0,2025-02-26,2025-03-05-1332,
DEPARTMENT OF STATE,2/26/2025,6041748.0,2025-02-26,2025-03-05-1332,
DEPARTMENT OF STATE,2/26/2025,6000000.0,2025-02-26,2025-03-05-1332,
DEPARTMENT OF STATE,2/26/2025,5836318.0,2025-02-26,2025-03-05-1332,
DEPARTMENT OF STATE,2/26/2025,5789800.0,2025-02-26,2025-03-05-1332,
DEPARTMENT OF STATE,2/26/2025,5565367.0,2025-02-26,2025-03-05-1332,
DEPARTMENT OF STATE,2/26/2025,5499726.0,2025-02-26,2025-03-05-1332,
DEPARTMENT OF STATE,2/26/2025,5414893.0,2025-02-26,2025-03-05-1332,
DEPARTMENT OF STATE,2/26/2025,5400000.0,2025-02-26,2025-03-05-1332,
DEPARTMENT OF STATE,2/26/2025,5376418.0,2025-02-26,2025-03-05-1332,
DEPARTMENT OF STATE,2/26/2025,5340035.0,2025-02-26,2025-03-05-1332,
DEPARTMENT OF STATE,2/26/2025,5149886.0,2025-02-26,2025-03-05-1332,
DEPARTMENT OF STATE,2/26/2025,5133841.42,2025-02-26,2025-03-05-1332,
DEPARTMENT OF STATE,2/26/2025,5030562.0,2025-02-26,2025-03-05-1332,
DEPARTMENT OF STATE,2/26/2025,5005429.0,2025-02-26,2025-03-05-1332,
DEPARTMENT OF STATE,2/26/2025,4996785.0,2025-02-26,2025-03-05-1332,
DEPARTMENT OF STATE,2/26/2025,4987388.0,2025-02-26,2025-03-05-1332,
DEPARTMENT OF STATE,2/26/2025,4980000.0,2025-02-26,2025-03-05-1332,
DEPARTMENT OF STATE,2/26/2025,4979989.0,2025-02-26,2025-03-05-1332,
DEPARTMENT OF STATE,2/26/2025,4941589.0,2025-02-26,2025-03-05-1332,
DEPARTMENT OF STATE,2/26/2025,4938271.0,2025-02-26,2025-03-05-1332,
DEPARTMENT OF STATE,2/26/2025,4937500.0,2025-02-26,2025-03-05-1332,
DEPARTMENT OF STATE,2/26/2025,4900564.0,2025-02-26,2025-03-05-1332,
DEPARTMENT OF STATE,2/26/2025,4858569.0,2025-02-26,2025-03-05-1332,
DEPARTMENT OF STATE,2/26/2025,4852008.0,2025-02-26,2025-03-05-1332,
DEPARTMENT OF STATE,2/26/2025,4800000.0,2025-02-26,2025-03-05-1332,
DEPARTMENT OF STATE,2/26/2025,4754102.84,2025-02-26,2025-03-05-1332,
DEPARTMENT OF STATE,2/26/2025,4724000.0,2025-02-26,2025-03-05-1332,
DEPARTMENT OF STATE,2/26/2025,4539983.0,2025-02-26,2025-03-05-1332,
DEPARTMENT OF STATE,2/26/2025,4511431.0,2025-02-26,2025-03-05-1332,
DEPARTMENT OF STATE,2/26/2025,19301992.0,2025-02-26,2025-03-05-1332,
DEPARTMENT OF STATE,2/26/2025,4438645.0,2025-02-26,2025-03-05-1332,
DEPARTMENT OF STATE,2/26/2025,4324707.0,2025-02-26,2025-03-05-1332,
DEPARTMENT OF STATE,2/26/2025,4317060.0,2025-02-26,2025-03-05-1332,
DEPARTMENT OF STATE,2/26/2025,4265431.0,2025-02-26,2025-03-05-1332,
DEPARTMENT OF STATE,2/26/2025,4210000.0,2025-02-26,2025-03-05-1332,
DEPARTMENT OF STATE,2/26/2025,4199999.0,2025-02-26,2025-03-05-1332,
DEPARTMENT OF STATE,2/26/2025,4186480.0,2025-02-26,2025-03-05-1332,
DEPARTMENT OF STATE,2/26/2025,4158651.12,2025-02-26,2025-03-05-1332,
DEPARTMENT OF STATE,2/26/2025,4041000.0,2025-02-26,2025-03-05-1332,
DEPARTMENT OF STATE,2/26/2025,3998275.0,2025-02-26,2025-03-05-1332,
DEPARTMENT OF STATE,2/26/2025,3994041.0,2025-02-26,2025-03-05-1332,
DEPARTMENT OF STATE,2/26/2025,3975000.0,2025-02-26,2025-03-05-1332,
DEPARTMENT OF STATE,2/26/2025,3950616.0,2025-02-26,2025-03-05-1332,
DEPARTMENT OF STATE,2/26/2025,3948659.0,2025-02-26,2025-03-05-1332,
DEPARTMENT OF STATE,2/26/2025,3946719.0,2025-02-26,2025-03-05-1332,
DEPARTMENT OF STATE,2/26/2025,3932537.0,2025-02-26,2025-03-05-1332,
DEPARTMENT OF STATE,2/26/2025,3918519.0,2025-02-26,2025-03-05-1332,
DEPARTMENT OF STATE,2/26/2025,13337000.0,2025-02-26,2025-03-05-1332,
DEPARTMENT OF STATE,2/26/2025,3916000.0,2025-02-26,2025-03-05-1332,
DEPARTMENT OF STATE,2/26/2025,3900000.0,2025-02-26,2025-03-05-1332,
DEPARTMENT OF STATE,2/26/2025,3897473.0,2025-02-26,2025-03-05-1332,
DEPARTMENT OF STATE,2/26/2025,3885437.0,2025-02-26,2025-03-05-1332,
DEPARTMENT OF STATE,2/26/2025,13000000.0,2025-02-26,2025-03-05-1332,
DEPARTMENT OF STATE,2/26/2025,8925000.0,2025-02-26,2025-03-05-1332,
DEPARTMENT OF STATE,2/26/2025,3737641.0,2025-02-26,2025-03-05-1332,
DEPARTMENT OF STATE,2/26/2025,3727605.0,2025-02-26,2025-03-05-1332,
DEPARTMENT OF STATE,2/26/2025,3715913.0,2025-02-26,2025-03-05-1332,
DEPARTMENT OF STATE,2/26/2025,3699375.0,2025-02-26,2025-03-05-1332,
DEPARTMENT OF STATE,2/26/2025,3645029.0,2025-02-26,2025-03-05-1332,
DEPARTMENT OF STATE,2/26/2025,3640607.0,2025-02-26,2025-03-05-1332,
DEPARTMENT OF STATE,2/26/2025,3600640.0,2025-02-26,2025-03-05-1332,
DEPARTMENT OF STATE,2/26/2025,3560436.0,2025-02-26,2025-03-05-1332,
DEPARTMENT OF STATE,2/26/2025,3553539.0,2025-02-26,2025-03-05-1332,
DEPARTMENT OF STATE,2/26/2025,3530553.0,2025-02-26,2025-03-05-1332,
DEPARTMENT OF STATE,2/26/2025,3525979.0,2025-02-26,2025-03-05-1332,
DEPARTMENT OF STATE,2/26/2025,3499997.0,2025-02-26,2025-03-05-1332,
DEPARTMENT OF STATE,2/26/2025,3499487.0,2025-02-26,2025-03-05-1332,
DEPARTMENT OF STATE,2/26/2025,3457200.0,2025-02-26,2025-03-05-1332,
DEPARTMENT OF STATE,2/26/2025,3450000.0,2025-02-26,2025-03-05-1332,
DEPARTMENT OF STATE,2/26/2025,3425000.0,2025-02-26,2025-03-05-1332,
DEPARTMENT OF STATE,2/26/2025,3417749.0,2025-02-26,2025-03-05-1332,
DEPARTMENT OF STATE,2/26/2025,3417254.0,2025-02-26,2025-03-05-1332,
DEPARTMENT OF STATE,2/26/2025,3389000.0,2025-02-26,2025-03-05-1332,
DEPARTMENT OF STATE,2/26/2025,3375000.0,2025-02-26,2025-03-05-1332,
DEPARTMENT OF STATE,2/26/2025,3345211.0,2025-02-26,2025-03-05-1332,
DEPARTMENT OF STATE,2/26/2025,3342839.34,2025-02-26,2025-03-05-1332,
DEPARTMENT OF STATE,2/26/2025,3250000.0,2025-02-26,2025-03-05-1332,
DEPARTMENT OF STATE,2/26/2025,3185945.0,2025-02-26,2025-03-05-1332,
DEPARTMENT OF STATE,2/26/2025,3049524.0,2025-02-26,2025-03-05-1332,
DEPARTMENT OF STATE,2/26/2025,3032476.0,2025-02-26,2025-03-05-1332,
DEPARTMENT OF STATE,2/26/2025,3012344.0,2025-02-26,2025-03-05-1332,
DEPARTMENT OF STATE,2/26/2025,3010574.0,2025-02-26,2025-03-05-1332,
DEPARTMENT OF STATE,2/26/2025,2999999.0,2025-02-26,2025-03-05-1332,
DEPARTMENT OF STATE,2/26/2025,2999975.0,2025-02-26,2025-03-05-1332,
DEPARTMENT OF STATE,2/26/2025,2999702.0,2025-02-26,2025-03-05-1332,
DEPARTMENT OF STATE,2/26/2025,2998720.0,2025-02-26,2025-03-05-1332,
DEPARTMENT OF STATE,2/26/2025,2997636.0,2025-02-26,2025-03-05-1332,
DEPARTMENT OF STATE,2/26/2025,2994938.2,2025-02-26,2025-03-05-1332,
DEPARTMENT OF STATE,2/26/2025,2990184.85,2025-02-26,2025-03-05-1332,
DEPARTMENT OF STATE,2/26/2025,2974991.0,2025-02-26,2025-03-05-1332,
DEPARTMENT OF STATE,2/26/2025,2964205.0,2025-02-26,2025-03-05-1332,
DEPARTMENT OF STATE,2/26/2025,5114355.0,2025-02-26,2025-03-05-1332,
DEPARTMENT OF STATE,2/26/2025,2962396.0,2025-02-26,2025-03-05-1332,
DEPARTMENT OF STATE,2/26/2025,2961849.0,2025-02-26,2025-03-05-1332,
DEPARTMENT OF STATE,2/26/2025,2961500.0,2025-02-26,2025-03-05-1332,
DEPARTMENT OF STATE,2/26/2025,2959500.0,2025-02-26,2025-03-05-1332,
DEPARTMENT OF STATE,2/26/2025,2950273.0,2025-02-26,2025-03-05-1332,
DEPARTMENT OF STATE,2/26/2025,2937678.0,2025-02-26,2025-03-05-1332,
DEPARTMENT OF STATE,2/26/2025,2935000.0,2025-02-26,2025-03-05-1332,
DEPARTMENT OF STATE,2/26/2025,2919988.3,2025-02-26,2025-03-05-1332,
DEPARTMENT OF STATE,2/26/2025,2912844.0,2025-02-26,2025-03-05-1332,
DEPARTMENT OF STATE,2/26/2025,2910830.0,2025-02-26,2025-03-05-1332,
DEPARTMENT OF STATE,2/26/2025,2882715.0,2025-02-26,2025-03-05-1332,
DEPARTMENT OF STATE,2/26/2025,2863075.0,2025-02-26,2025-03-05-1332,
DEPARTMENT OF STATE,2/26/2025,2732760.0,2025-02-26,2025-03-05-1332,
DEPARTMENT OF STATE,2/26/2025,2700000.0,2025-02-26,2025-03-05-1332,
DEPARTMENT OF STATE,2/26/2025,2696334.0,2025-02-26,2025-03-05-1332,
DEPARTMENT OF STATE,2/26/2025,2637000.0,2025-02-26,2025-03-05-1332,
DEPARTMENT OF STATE,2/26/2025,2634231.0,2025-02-26,2025-03-05-1332,
DEPARTMENT OF STATE,2/26/2025,2618023.68,2025-02-26,2025-03-05-1332,
DEPARTMENT OF STATE,2/26/2025,2601977.0,2025-02-26,2025-03-05-1332,
DEPARTMENT OF STATE,2/26/2025,2599951.0,2025-02-26,2025-03-05-1332,
DEPARTMENT OF STATE,2/26/2025,2589506.0,2025-02-26,2025-03-05-1332,
DEPARTMENT OF STATE,2/26/2025,2577419.0,2025-02-26,2025-03-05-1332,
DEPARTMENT OF STATE,2/26/2025,2576000.0,2025-02-26,2025-03-05-1332,
DEPARTMENT OF STATE,2/26/2025,2575000.0,2025-02-26,2025-03-05-1332,
DEPARTMENT OF STATE,2/26/2025,2568790.0,2025-02-26,2025-03-05-1332,
DEPARTMENT OF STATE,2/26/2025,2561100.0,2025-02-26,2025-03-05-1332,
DEPARTMENT OF STATE,2/26/2025,2530860.0,2025-02-26,2025-03-05-1332,
DEPARTMENT OF STATE,2/26/2025,2498123.0,2025-02-26,2025-03-05-1332,
DEPARTMENT OF STATE,2/26/2025,2469135.0,2025-02-26,2025-03-05-1332,
DEPARTMENT OF STATE,2/26/2025,2467280.0,2025-02-26,2025-03-05-1332,
DEPARTMENT OF STATE,2/26/2025,2453223.0,2025-02-26,2025-03-05-1332,
DEPARTMENT OF STATE,2/26/2025,2448492.0,2025-02-26,2025-03-05-1332,
DEPARTMENT OF STATE,2/26/2025,2446452.0,2025-02-26,2025-03-05-1332,
DEPARTMENT OF STATE,2/26/2025,2434835.0,2025-02-26,2025-03-05-1332,
DEPARTMENT OF STATE,2/26/2025,2432000.0,2025-02-26,2025-03-05-1332,
DEPARTMENT OF STATE,2/26/2025,3640000.0,2025-02-26,2025-03-05-1332,
DEPARTMENT OF STATE,2/26/2025,2420597.0,2025-02-26,2025-03-05-1332,
DEPARTMENT OF STATE,2/26/2025,2414000.0,2025-02-26,2025-03-05-1332,
DEPARTMENT OF STATE,2/26/2025,2407060.0,2025-02-26,2025-03-05-1332,
DEPARTMENT OF STATE,2/26/2025,2390369.0,2025-02-26,2025-03-05-1332,
DEPARTMENT OF STATE,2/26/2025,2385000.0,2025-02-26,2025-03-05-1332,
DEPARTMENT OF STATE,2/26/2025,2373575.0,2025-02-26,2025-03-05-1332,
DEPARTMENT OF STATE,2/26/2025,2368000.0,2025-02-26,2025-03-05-1332,
DEPARTMENT OF STATE,2/26/2025,2348446.0,2025-02-26,2025-03-05-1332,
DEPARTMENT OF STATE,2/26/2025,2338320.0,2025-02-26,2025-03-05-1332,
DEPARTMENT OF STATE,2/26/2025,2329219.0,2025-02-26,2025-03-05-1332,
DEPARTMENT OF STATE,2/26/2025,2303077.0,2025-02-26,2025-03-05-1332,
DEPARTMENT OF STATE,2/26/2025,2301911.0,2025-02-26,2025-03-05-1332,
DEPARTMENT OF STATE,2/26/2025,2301409.0,2025-02-26,2025-03-05-1332,
DEPARTMENT OF STATE,2/26/2025,2300094.0,2025-02-26,2025-03-05-1332,
DEPARTMENT OF STATE,2/26/2025,2300000.0,2025-02-26,2025-03-05-1332,
DEPARTMENT OF STATE,2/26/2025,2299778.3,2025-02-26,2025-03-05-1332,
DEPARTMENT OF STATE,2/26/2025,2281481.0,2025-02-26,2025-03-05-1332,
DEPARTMENT OF STATE,2/26/2025,2276628.0,2025-02-26,2025-03-05-1332,
DEPARTMENT OF STATE,2/26/2025,2276160.0,2025-02-26,2025-03-05-1332,
DEPARTMENT OF STATE,2/26/2025,2221235.0,2025-02-26,2025-03-05-1332,
DEPARTMENT OF STATE,2/26/2025,2211824.0,2025-02-26,2025-03-05-1332,
DEPARTMENT OF STATE,2/26/2025,2211616.0,2025-02-26,2025-03-05-1332,
DEPARTMENT OF STATE,2/26/2025,2198875.89,2025-02-26,2025-03-05-1332,
DEPARTMENT OF STATE,2/26/2025,2192919.0,2025-02-26,2025-03-05-1332,
DEPARTMENT OF STATE,2/26/2025,2182095.0,2025-02-26,2025-03-05-1332,
DEPARTMENT OF STATE,2/26/2025,2170993.0,2025-02-26,2025-03-05-1332,
DEPARTMENT OF STATE,2/26/2025,2170300.0,2025-02-26,2025-03-05-1332,
DEPARTMENT OF STATE,2/26/2025,2162675.0,2025-02-26,2025-03-05-1332,
DEPARTMENT OF STATE,2/26/2025,2124000.0,2025-02-26,2025-03-05-1332,
DEPARTMENT OF STATE,2/26/2025,2120493.0,2025-02-26,2025-03-05-1332,
DEPARTMENT OF STATE,2/26/2025,2120060.0,2025-02-26,2025-03-05-1332,
DEPARTMENT OF STATE,2/26/2025,2119944.0,2025-02-26,2025-03-05-1332,
DEPARTMENT OF STATE,2/26/2025,2103090.0,2025-02-26,2025-03-05-1332,
DEPARTMENT OF STATE,2/26/2025,2082734.0,2025-02-26,2025-03-05-1332,
DEPARTMENT OF STATE,2/26/2025,2077370.0,2025-02-26,2025-03-05-1332,
DEPARTMENT OF STATE,2/26/2025,2075000.0,2025-02-26,2025-03-05-1332,
DEPARTMENT OF STATE,2/26/2025,2073505.0,2025-02-26,2025-03-05-1332,
DEPARTMENT OF STATE,2/26/2025,2072928.9,2025-02-26,2025-03-05-1332,
DEPARTMENT OF STATE,2/26/2025,2070358.0,2025-02-26,2025-03-05-1332,
DEPARTMENT OF STATE,2/26/2025,2069335.37,2025-02-26,2025-03-05-1332,
DEPARTMENT OF STATE,2/26/2025,2055900.0,2025-02-26,2025-03-05-1332,
DEPARTMENT OF STATE,2/26/2025,2055414.71,2025-02-26,2025-03-05-1332,
DEPARTMENT OF STATE,2/26/2025,2053863.0,2025-02-26,2025-03-05-1332,
DEPARTMENT OF STATE,2/26/2025,2048416.0,2025-02-26,2025-03-05-1332,
DEPARTMENT OF STATE,2/26/2025,2020799.0,2025-02-26,2025-03-05-1332,
DEPARTMENT OF STATE,2/26/2025,2020768.0,2025-02-26,2025-03-05-1332,
DEPARTMENT OF STATE,2/26/2025,2020030.0,2025-02-26,2025-03-05-1332,
DEPARTMENT OF STATE,2/26/2025,2002343.0,2025-02-26,2025-03-05-1332,
DEPARTMENT OF STATE,2/26/2025,2962808.0,2025-02-26,2025-03-05-1332,
DEPARTMENT OF STATE,2/26/2025,1999999.35,2025-02-26,2025-03-05-1332,
DEPARTMENT OF STATE,2/26/2025,1999981.0,2025-02-26,2025-03-05-1332,
DEPARTMENT OF STATE,2/26/2025,1999720.0,2025-02-26,2025-03-05-1332,
DEPARTMENT OF STATE,2/26/2025,1996311.0,2025-02-26,2025-03-05-1332,
DEPARTMENT OF STATE,2/26/2025,1989694.32,2025-02-26,2025-03-05-1332,
DEPARTMENT OF STATE,2/26/2025,2900000.0,2025-02-26,2025-03-05-1332,
DEPARTMENT OF STATE,2/26/2025,1987206.0,2025-02-26,2025-03-05-1332,
DEPARTMENT OF STATE,2/26/2025,1986110.0,2025-02-26,2025-03-05-1332,
DEPARTMENT OF STATE,2/26/2025,1983288.0,2025-02-26,2025-03-05-1332,
DEPARTMENT OF STATE,2/26/2025,1975308.0,2025-02-26,2025-03-05-1332,
DEPARTMENT OF STATE,2/26/2025,1975305.0,2025-02-26,2025-03-05-1332,
DEPARTMENT OF STATE,2/26/2025,1975300.0,2025-02-26,2025-03-05-1332,
DEPARTMENT OF STATE,2/26/2025,1975000.0,2025-02-26,2025-03-05-1332,
DEPARTMENT OF STATE,2/26/2025,1974794.0,2025-02-26,2025-03-05-1332,
DEPARTMENT OF STATE,2/26/2025,1974590.0,2025-02-26,2025-03-05-1332,
DEPARTMENT OF STATE,2/26/2025,1973358.0,2025-02-26,2025-03-05-1332,
DEPARTMENT OF STATE,2/26/2025,1969991.0,2025-02-26,2025-03-05-1332,
DEPARTMENT OF STATE,2/26/2025,1969750.0,2025-02-26,2025-03-05-1332,
DEPARTMENT OF STATE,2/26/2025,1961389.0,2025-02-26,2025-03-05-1332,
DEPARTMENT OF STATE,2/26/2025,1950000.0,2025-02-26,2025-03-05-1332,
DEPARTMENT OF STATE,2/26/2025,1947890.0,2025-02-26,2025-03-05-1332,
DEPARTMENT OF STATE,2/26/2025,1947472.0,2025-02-26,2025-03-05-1332,
DEPARTMENT OF STATE,2/26/2025,1940000.0,2025-02-26,2025-03-05-1332,
DEPARTMENT OF STATE,2/26/2025,1939461.0,2025-02-26,2025-03-05-1332,
DEPARTMENT OF STATE,2/26/2025,1938972.0,2025-02-26,2025-03-05-1332,
DEPARTMENT OF STATE,2/26/2025,1938907.0,2025-02-26,2025-03-05-1332,
DEPARTMENT OF STATE,2/26/2025,1925925.0,2025-02-26,2025-03-05-1332,
DEPARTMENT OF STATE,2/26/2025,1924995.0,2025-02-26,2025-03-05-1332,
DEPARTMENT OF STATE,2/26/2025,1920510.0,2025-02-26,2025-03-05-1332,
DEPARTMENT OF STATE,2/26/2025,1914000.0,2025-02-26,2025-03-05-1332,
DEPARTMENT OF STATE,2/26/2025,1908827.0,2025-02-26,2025-03-05-1332,
DEPARTMENT OF STATE,2/26/2025,2667552.0,2025-02-26,2025-03-05-1332,
DEPARTMENT OF STATE,2/26/2025,1899982.92,2025-02-26,2025-03-05-1332,
DEPARTMENT OF STATE,2/26/2025,1899947.0,2025-02-26,2025-03-05-1332,
DEPARTMENT OF STATE,2/26/2025,1892839.0,2025-02-26,2025-03-05-1332,
DEPARTMENT OF STATE,2/26/2025,1891134.0,2025-02-26,2025-03-05-1332,
DEPARTMENT OF STATE,2/26/2025,1879489.0,2025-02-26,2025-03-05-1332,
DEPARTMENT OF STATE,2/26/2025,1876543.0,2025-02-26,2025-03-05-1332,
DEPARTMENT OF STATE,2/26/2025,1876540.0,2025-02-26,2025-03-05-1332,
DEPARTMENT OF STATE,2/26/2025,1875661.0,2025-02-26,2025-03-05-1332,
DEPARTMENT OF STATE,2/26/2025,1857862.0,2025-02-26,2025-03-05-1332,
DEPARTMENT OF STATE,2/26/2025,1856145.0,2025-02-26,2025-03-05-1332,
DEPARTMENT OF STATE,2/26/2025,1854957.0,2025-02-26,2025-03-05-1332,
DEPARTMENT OF STATE,2/26/2025,1854449.0,2025-02-26,2025-03-05-1332,
DEPARTMENT OF STATE,2/26/2025,1854000.0,2025-02-26,2025-03-05-1332,
DEPARTMENT OF STATE,2/26/2025,1852301.0,2025-02-26,2025-03-05-1332,
DEPARTMENT OF STATE,2/26/2025,1848868.0,2025-02-26,2025-03-05-1332,
DEPARTMENT OF STATE,2/26/2025,1832305.0,2025-02-26,2025-03-05-1332,
DEPARTMENT OF STATE,2/26/2025,1830198.0,2025-02-26,2025-03-05-1332,
DEPARTMENT OF STATE,2/26/2025,1826465.0,2025-02-26,2025-03-05-1332,
DEPARTMENT OF STATE,2/26/2025,1822987.0,2025-02-26,2025-03-05-1332,
DEPARTMENT OF STATE,2/26/2025,1805843.0,2025-02-26,2025-03-05-1332,
DEPARTMENT OF STATE,2/26/2025,1790733.2,2025-02-26,2025-03-05-1332,
DEPARTMENT OF STATE,2/26/2025,1784408.0,2025-02-26,2025-03-05-1332,
DEPARTMENT OF STATE,2/26/2025,1780138.0,2025-02-26,2025-03-05-1332,
DEPARTMENT OF STATE,2/26/2025,1779174.0,2025-02-26,2025-03-05-1332,
DEPARTMENT OF STATE,2/26/2025,1777776.0,2025-02-26,2025-03-05-1332,
DEPARTMENT OF STATE,2/26/2025,1776854.0,2025-02-26,2025-03-05-1332,
DEPARTMENT OF STATE,2/26/2025,1776023.0,2025-02-26,2025-03-05-1332,
DEPARTMENT OF STATE,2/26/2025,1745802.0,2025-02-26,2025-03-05-1332,
DEPARTMENT OF STATE,2/26/2025,1740000.0,2025-02-26,2025-03-05-1332,
DEPARTMENT OF STATE,2/26/2025,1737654.0,2025-02-26,2025-03-05-1332,
DEPARTMENT OF STATE,2/26/2025,1735000.0,2025-02-26,2025-03-05-1332,
DEPARTMENT OF STATE,2/26/2025,1728150.0,2025-02-26,2025-03-05-1332,
DEPARTMENT OF STATE,2/26/2025,1727375.0,2025-02-26,2025-03-05-1332,
DEPARTMENT OF STATE,2/26/2025,1725654.0,2025-02-26,2025-03-05-1332,
DEPARTMENT OF STATE,2/26/2025,1688438.0,2025-02-26,2025-03-05-1332,
DEPARTMENT OF STATE,2/26/2025,1685000.0,2025-02-26,2025-03-05-1332,
DEPARTMENT OF STATE,2/26/2025,1680864.0,2025-02-26,2025-03-05-1332,
DEPARTMENT OF STATE,2/26/2025,1663062.57,2025-02-26,2025-03-05-1332,
DEPARTMENT OF STATE,2/26/2025,1652027.0,2025-02-26,2025-03-05-1332,
DEPARTMENT OF STATE,2/26/2025,1650000.0,2025-02-26,2025-03-05-1332,
DEPARTMENT OF STATE,2/26/2025,1642510.0,2025-02-26,2025-03-05-1332,
DEPARTMENT OF STATE,2/26/2025,1641000.0,2025-02-26,2025-03-05-1332,
DEPARTMENT OF STATE,2/26/2025,1637513.0,2025-02-26,2025-03-05-1332,
DEPARTMENT OF STATE,2/26/2025,1629625.0,2025-02-26,2025-03-05-1332,
DEPARTMENT OF STATE,2/26/2025,1628751.0,2025-02-26,2025-03-05-1332,
DEPARTMENT OF STATE,2/26/2025,1626908.0,2025-02-26,2025-03-05-1332,
DEPARTMENT OF STATE,2/26/2025,1603942.32,2025-02-26,2025-03-05-1332,
DEPARTMENT OF STATE,2/26/2025,1584205.0,2025-02-26,2025-03-05-1332,
DEPARTMENT OF STATE,2/26/2025,1583030.0,2025-02-26,2025-03-05-1332,
DEPARTMENT OF STATE,2/26/2025,1579419.0,2025-02-26,2025-03-05-1332,
DEPARTMENT OF STATE,2/26/2025,1558642.0,2025-02-26,2025-03-05-1332,
DEPARTMENT OF STATE,2/26/2025,1556642.0,2025-02-26,2025-03-05-1332,
DEPARTMENT OF STATE,2/26/2025,1550000.0,2025-02-26,2025-03-05-1332,
DEPARTMENT OF STATE,2/26/2025,1537836.45,2025-02-26,2025-03-05-1332,
DEPARTMENT OF STATE,2/26/2025,1530374.0,2025-02-26,2025-03-05-1332,
DEPARTMENT OF STATE,2/26/2025,1511991.0,2025-02-26,2025-03-05-1332,
DEPARTMENT OF STATE,2/26/2025,1511150.0,2025-02-26,2025-03-05-1332,
DEPARTMENT OF STATE,2/26/2025,1507500.0,2025-02-26,2025-03-05-1332,
DEPARTMENT OF STATE,2/26/2025,2424725.0,2025-02-26,2025-03-05-1332,
DEPARTMENT OF STATE,2/26/2025,2349967.0,2025-02-26,2025-03-05-1332,
DEPARTMENT OF STATE,2/26/2025,1499939.0,2025-02-26,2025-03-05-1332,
DEPARTMENT OF STATE,2/26/2025,1499888.0,2025-02-26,2025-03-05-1332,
DEPARTMENT OF STATE,2/26/2025,1495061.0,2025-02-26,2025-03-05-1332,
DEPARTMENT OF STATE,2/26/2025,1490989.0,2025-02-26,2025-03-05-1332,
DEPARTMENT OF STATE,2/26/2025,1487500.0,2025-02-26,2025-03-05-1332,
DEPARTMENT OF STATE,2/26/2025,1486110.0,2025-02-26,2025-03-05-1332,
DEPARTMENT OF STATE,2/26/2025,1485000.0,2025-02-26,2025-03-05-1332,
DEPARTMENT OF STATE,2/26/2025,1484000.0,2025-02-26,2025-03-05-1332,
DEPARTMENT OF STATE,2/26/2025,1483690.0,2025-02-26,2025-03-05-1332,
DEPARTMENT OF STATE,2/26/2025,1481480.0,2025-02-26,2025-03-05-1332,
DEPARTMENT OF STATE,2/26/2025,1481466.67,2025-02-26,2025-03-05-1332,
DEPARTMENT OF STATE,2/26/2025,1481250.0,2025-02-26,2025-03-05-1332,
DEPARTMENT OF STATE,2/26/2025,1480993.0,2025-02-26,2025-03-05-1332,
DEPARTMENT OF STATE,2/26/2025,1480785.0,2025-02-26,2025-03-05-1332,
DEPARTMENT OF STATE,2/26/2025,1480740.0,2025-02-26,2025-03-05-1332,
DEPARTMENT OF STATE,2/26/2025,1480625.0,2025-02-26,2025-03-05-1332,
DEPARTMENT OF STATE,2/26/2025,1480019.73,2025-02-26,2025-03-05-1332,
DEPARTMENT OF STATE,2/26/2025,1479387.0,2025-02-26,2025-03-05-1332,
DEPARTMENT OF STATE,2/26/2025,1478324.0,2025-02-26,2025-03-05-1332,
DEPARTMENT OF STATE,2/26/2025,1475898.07,2025-02-26,2025-03-05-1332,
DEPARTMENT OF STATE,2/26/2025,1470000.0,2025-02-26,2025-03-05-1332,
DEPARTMENT OF STATE,2/26/2025,1464945.0,2025-02-26,2025-03-05-1332,
DEPARTMENT OF STATE,2/26/2025,1462945.0,2025-02-26,2025-03-05-1332,
DEPARTMENT OF STATE,2/26/2025,1457204.0,2025-02-26,2025-03-05-1332,
DEPARTMENT OF STATE,2/26/2025,1454835.0,2025-02-26,2025-03-05-1332,
DEPARTMENT OF STATE,2/26/2025,1449724.0,2025-02-26,2025-03-05-1332,
DEPARTMENT OF STATE,2/26/2025,1442592.0,2025-02-26,2025-03-05-1332,
DEPARTMENT OF STATE,2/26/2025,1440000.0,2025-02-26,2025-03-05-1332,
DEPARTMENT OF STATE,2/26/2025,1439000.0,2025-02-26,2025-03-05-1332,
DEPARTMENT OF STATE,2/26/2025,1434422.0,2025-02-26,2025-03-05-1332,
DEPARTMENT OF STATE,2/26/2025,1431945.0,2025-02-26,2025-03-05-1332,
DEPARTMENT OF STATE,2/26/2025,1431756.0,2025-02-26,2025-03-05-1332,
DEPARTMENT OF STATE,2/26/2025,1431752.0,2025-02-26,2025-03-05-1332,
DEPARTMENT OF STATE,2/26/2025,1431415.0,2025-02-26,2025-03-05-1332,
DEPARTMENT OF STATE,2/26/2025,1425000.0,2025-02-26,2025-03-05-1332,
DEPARTMENT OF STATE,2/26/2025,1424490.0,2025-02-26,2025-03-05-1332,
DEPARTMENT OF STATE,2/26/2025,1415821.0,2025-02-26,2025-03-05-1332,
DEPARTMENT OF STATE,2/26/2025,1412390.0,2025-02-26,2025-03-05-1332,
DEPARTMENT OF STATE,2/26/2025,2145375.0,2025-02-26,2025-03-05-1332,
DEPARTMENT OF STATE,2/26/2025,1404796.0,2025-02-26,2025-03-05-1332,
DEPARTMENT OF STATE,2/26/2025,1390000.0,2025-02-26,2025-03-05-1332,
DEPARTMENT OF STATE,2/26/2025,1388888.0,2025-02-26,2025-03-05-1332,
DEPARTMENT OF STATE,2/26/2025,1382965.0,2025-02-26,2025-03-05-1332,
DEPARTMENT OF STATE,2/26/2025,1379650.0,2025-02-26,2025-03-05-1332,
DEPARTMENT OF STATE,2/26/2025,1375000.0,2025-02-26,2025-03-05-1332,
DEPARTMENT OF STATE,2/26/2025,1364778.0,2025-02-26,2025-03-05-1332,
DEPARTMENT OF STATE,2/26/2025,1360889.0,2025-02-26,2025-03-05-1332,
DEPARTMENT OF STATE,2/26/2025,1358259.0,2025-02-26,2025-03-05-1332,
DEPARTMENT OF STATE,2/26/2025,1357760.0,2025-02-26,2025-03-05-1332,
DEPARTMENT OF STATE,2/26/2025,1987540.0,2025-02-26,2025-03-05-1332,
DEPARTMENT OF STATE,2/26/2025,1333330.0,2025-02-26,2025-03-05-1332,
DEPARTMENT OF STATE,2/26/2025,1317564.0,2025-02-26,2025-03-05-1332,
DEPARTMENT OF STATE,2/26/2025,1309514.0,2025-02-26,2025-03-05-1332,
DEPARTMENT OF STATE,2/26/2025,1299674.0,2025-02-26,2025-03-05-1332,
DEPARTMENT OF STATE,2/26/2025,1298000.0,2025-02-26,2025-03-05-1332,
DEPARTMENT OF STATE,2/26/2025,1293165.0,2025-02-26,2025-03-05-1332,
DEPARTMENT OF STATE,2/26/2025,1286594.0,2025-02-26,2025-03-05-1332,
DEPARTMENT OF STATE,2/26/2025,1284000.0,2025-02-26,2025-03-05-1332,
DEPARTMENT OF STATE,2/26/2025,1282683.0,2025-02-26,2025-03-05-1332,
DEPARTMENT OF STATE,2/26/2025,1281402.0,2025-02-26,2025-03-05-1332,
DEPARTMENT OF STATE,2/26/2025,1278000.0,2025-02-26,2025-03-05-1332,
DEPARTMENT OF STATE,2/26/2025,1271611.0,2025-02-26,2025-03-05-1332,
DEPARTMENT OF STATE,2/26/2025,1270818.0,2025-02-26,2025-03-05-1332,
DEPARTMENT OF STATE,2/26/2025,1262547.0,2025-02-26,2025-03-05-1332,
DEPARTMENT OF STATE,2/26/2025,1900000.0,2025-02-26,2025-03-05-1332,
DEPARTMENT OF STATE,2/26/2025,1259062.5,2025-02-26,2025-03-05-1332,
DEPARTMENT OF STATE,2/26/2025,1256975.0,2025-02-26,2025-03-05-1332,
DEPARTMENT OF STATE,2/26/2025,1252401.0,2025-02-26,2025-03-05-1332,
DEPARTMENT OF STATE,2/26/2025,493250.0,2025-02-26,2025-03-05-1332,
DEPARTMENT OF STATE,2/26/2025,1787500.0,2025-02-26,2025-03-05-1332,
DEPARTMENT OF STATE,2/26/2025,1246174.0,2025-02-26,2025-03-05-1332,
DEPARTMENT OF STATE,2/26/2025,1556420.0,2025-02-26,2025-03-05-1332,
DEPARTMENT OF STATE,2/26/2025,1234490.0,2025-02-26,2025-03-05-1332,
DEPARTMENT OF STATE,2/26/2025,1234079.0,2025-02-26,2025-03-05-1332,
DEPARTMENT OF STATE,2/26/2025,1233350.0,2025-02-26,2025-03-05-1332,
DEPARTMENT OF STATE,2/26/2025,1233335.0,2025-02-26,2025-03-05-1332,
DEPARTMENT OF STATE,2/26/2025,1230495.0,2025-02-26,2025-03-05-1332,
DEPARTMENT OF STATE,2/26/2025,1214975.0,2025-02-26,2025-03-05-1332,
DEPARTMENT OF STATE,2/26/2025,1203521.0,2025-02-26,2025-03-05-1332,
DEPARTMENT OF STATE,2/26/2025,1199999.0,2025-02-26,2025-03-05-1332,
DEPARTMENT OF STATE,2/26/2025,1199000.0,2025-02-26,2025-03-05-1332,
DEPARTMENT OF STATE,2/26/2025,1185122.0,2025-02-26,2025-03-05-1332,
DEPARTMENT OF STATE,2/26/2025,1174999.0,2025-02-26,2025-03-05-1332,
DEPARTMENT OF STATE,2/26/2025,1167089.0,2025-02-26,2025-03-05-1332,
DEPARTMENT OF STATE,2/26/2025,1155000.0,2025-02-26,2025-03-05-1332,
DEPARTMENT OF STATE,2/26/2025,1147740.0,2025-02-26,2025-03-05-1332,
DEPARTMENT OF STATE,2/26/2025,1147122.0,2025-02-26,2025-03-05-1332,
DEPARTMENT OF STATE,2/26/2025,1145000.0,2025-02-26,2025-03-05-1332,
DEPARTMENT OF STATE,2/26/2025,1135740.0,2025-02-26,2025-03-05-1332,
DEPARTMENT OF STATE,2/26/2025,1135355.0,2025-02-26,2025-03-05-1332,
DEPARTMENT OF STATE,2/26/2025,1130000.0,2025-02-26,2025-03-05-1332,
DEPARTMENT OF STATE,2/26/2025,1128133.0,2025-02-26,2025-03-05-1332,
DEPARTMENT OF STATE,2/26/2025,1126498.0,2025-02-26,2025-03-05-1332,
DEPARTMENT OF STATE,2/26/2025,1125000.0,2025-02-26,2025-03-05-1332,
DEPARTMENT OF STATE,2/26/2025,1123766.0,2025-02-26,2025-03-05-1332,
DEPARTMENT OF STATE,2/26/2025,1105325.0,2025-02-26,2025-03-05-1332,
DEPARTMENT OF STATE,2/26/2025,1100281.46,2025-02-26,2025-03-05-1332,
DEPARTMENT OF STATE,2/26/2025,1098701.0,2025-02-26,2025-03-05-1332,
DEPARTMENT OF STATE,2/26/2025,1095378.0,2025-02-26,2025-03-05-1332,
DEPARTMENT OF STATE,2/26/2025,1086243.0,2025-02-26,2025-03-05-1332,
DEPARTMENT OF STATE,2/26/2025,1075000.0,2025-02-26,2025-03-05-1332,
DEPARTMENT OF STATE,2/26/2025,1071707.0,2025-02-26,2025-03-05-1332,
DEPARTMENT OF STATE,2/26/2025,1070731.0,2025-02-26,2025-03-05-1332,
DEPARTMENT OF STATE,2/26/2025,1070000.0,2025-02-26,2025-03-05-1332,
DEPARTMENT OF STATE,2/26/2025,1060000.0,2025-02-26,2025-03-05-1332,
DEPARTMENT OF STATE,2/26/2025,1059958.0,2025-02-26,2025-03-05-1332,
DEPARTMENT OF STATE,2/26/2025,1056158.0,2025-02-26,2025-03-05-1332,
DEPARTMENT OF STATE,2/26/2025,1987654.0,2025-02-26,2025-03-05-1332,
DEPARTMENT OF STATE,2/26/2025,1045250.0,2025-02-26,2025-03-05-1332,
DEPARTMENT OF STATE,2/26/2025,1045193.0,2025-02-26,2025-03-05-1332,
DEPARTMENT OF STATE,2/26/2025,1041860.0,2025-02-26,2025-03-05-1332,
DEPARTMENT OF STATE,2/26/2025,1032253.04,2025-02-26,2025-03-05-1332,
DEPARTMENT OF STATE,2/26/2025,1027940.0,2025-02-26,2025-03-05-1332,
DEPARTMENT OF STATE,2/26/2025,1027159.0,2025-02-26,2025-03-05-1332,
DEPARTMENT OF STATE,2/26/2025,1025000.0,2025-02-26,2025-03-05-1332,
DEPARTMENT OF STATE,2/26/2025,1008823.0,2025-02-26,2025-03-05-1332,
DEPARTMENT OF STATE,2/26/2025,1499219.0,2025-02-26,2025-03-05-1332,
DEPARTMENT OF STATE,2/26/2025,1409689.6,2025-02-26,2025-03-05-1332,
DEPARTMENT OF STATE,2/26/2025,1260549.0,2025-02-26,2025-03-05-1332,
DEPARTMENT OF STATE,2/26/2025,1450000.0,2025-02-26,2025-03-05-1332,
DEPARTMENT OF STATE,2/26/2025,999999.0,2025-02-26,2025-03-05-1332,
DEPARTMENT OF STATE,2/26/2025,999998.0,2025-02-26,2025-03-05-1332,
DEPARTMENT OF STATE,2/26/2025,999962.04,2025-02-26,2025-03-05-1332,
DEPARTMENT OF STATE,2/26/2025,999960.0,2025-02-26,2025-03-05-1332,
DEPARTMENT OF STATE,2/26/2025,999465.54,2025-02-26,2025-03-05-1332,
DEPARTMENT OF STATE,2/26/2025,999172.0,2025-02-26,2025-03-05-1332,
DEPARTMENT OF STATE,2/26/2025,996500.0,2025-02-26,2025-03-05-1332,
DEPARTMENT OF STATE,2/26/2025,996486.86,2025-02-26,2025-03-05-1332,
DEPARTMENT OF STATE,2/26/2025,994991.32,2025-02-26,2025-03-05-1332,
DEPARTMENT OF STATE,2/26/2025,992099.0,2025-02-26,2025-03-05-1332,
DEPARTMENT OF STATE,2/26/2025,987653.55,2025-02-26,2025-03-05-1332,
DEPARTMENT OF STATE,2/26/2025,987562.0,2025-02-26,2025-03-05-1332,
DEPARTMENT OF STATE,2/26/2025,987540.0,2025-02-26,2025-03-05-1332,
DEPARTMENT OF STATE,2/26/2025,987522.0,2025-02-26,2025-03-05-1332,
DEPARTMENT OF STATE,2/26/2025,987409.0,2025-02-26,2025-03-05-1332,
DEPARTMENT OF STATE,2/26/2025,987166.0,2025-02-26,2025-03-05-1332,
DEPARTMENT OF STATE,2/26/2025,987163.0,2025-02-26,2025-03-05-1332,
DEPARTMENT OF STATE,2/26/2025,987161.0,2025-02-26,2025-03-05-1332,
DEPARTMENT OF STATE,2/26/2025,987000.0,2025-02-26,2025-03-05-1332,
DEPARTMENT OF STATE,2/26/2025,986679.0,2025-02-26,2025-03-05-1332,
DEPARTMENT OF STATE,2/26/2025,985007.0,2025-02-26,2025-03-05-1332,
DEPARTMENT OF STATE,2/26/2025,983666.0,2025-02-26,2025-03-05-1332,
DEPARTMENT OF STATE,2/26/2025,983527.0,2025-02-26,2025-03-05-1332,
DEPARTMENT OF STATE,2/26/2025,983269.0,2025-02-26,2025-03-05-1332,
DEPARTMENT OF STATE,2/26/2025,979580.0,2025-02-26,2025-03-05-1332,
DEPARTMENT OF STATE,2/26/2025,978000.0,2025-02-26,2025-03-05-1332,
DEPARTMENT OF STATE,2/26/2025,975500.0,2025-02-26,2025-03-05-1332,
DEPARTMENT OF STATE,2/26/2025,975000.0,2025-02-26,2025-03-05-1332,
DEPARTMENT OF STATE,2/26/2025,970874.0,2025-02-26,2025-03-05-1332,
DEPARTMENT OF STATE,2/26/2025,969890.0,2025-02-26,2025-03-05-1332,
DEPARTMENT OF STATE,2/26/2025,964337.1,2025-02-26,2025-03-05-1332,
DEPARTMENT OF STATE,2/26/2025,954016.0,2025-02-26,2025-03-05-1332,
DEPARTMENT OF STATE,2/26/2025,951561.0,2025-02-26,2025-03-05-1332,
DEPARTMENT OF STATE,2/26/2025,949991.0,2025-02-26,2025-03-05-1332,
DEPARTMENT OF STATE,2/26/2025,944719.0,2025-02-26,2025-03-05-1332,
DEPARTMENT OF STATE,2/26/2025,943111.0,2025-02-26,2025-03-05-1332,
DEPARTMENT OF STATE,2/26/2025,940741.0,2025-02-26,2025-03-05-1332,
DEPARTMENT OF STATE,2/26/2025,939709.0,2025-02-26,2025-03-05-1332,
DEPARTMENT OF STATE,2/26/2025,934200.0,2025-02-26,2025-03-05-1332,
DEPARTMENT OF STATE,2/26/2025,932911.0,2025-02-26,2025-03-05-1332,
DEPARTMENT OF STATE,2/26/2025,932136.0,2025-02-26,2025-03-05-1332,
DEPARTMENT OF STATE,2/26/2025,928395.0,2025-02-26,2025-03-05-1332,
DEPARTMENT OF STATE,2/26/2025,925850.0,2025-02-26,2025-03-05-1332,
DEPARTMENT OF STATE,2/26/2025,925000.0,2025-02-26,2025-03-05-1332,
DEPARTMENT OF STATE,2/26/2025,919588.0,2025-02-26,2025-03-05-1332,
DEPARTMENT OF STATE,2/26/2025,916000.0,2025-02-26,2025-03-05-1332,
DEPARTMENT OF STATE,2/26/2025,914076.0,2025-02-26,2025-03-05-1332,
DEPARTMENT OF STATE,2/26/2025,909254.0,2025-02-26,2025-03-05-1332,
DEPARTMENT OF STATE,2/26/2025,901951.0,2025-02-26,2025-03-05-1332,
DEPARTMENT OF STATE,2/26/2025,901443.0,2025-02-26,2025-03-05-1332,
DEPARTMENT OF STATE,2/26/2025,900004.0,2025-02-26,2025-03-05-1332,
DEPARTMENT OF STATE,2/26/2025,899998.31,2025-02-26,2025-03-05-1332,
DEPARTMENT OF STATE,2/26/2025,893574.0,2025-02-26,2025-03-05-1332,
DEPARTMENT OF STATE,2/26/2025,891876.0,2025-02-26,2025-03-05-1332,
DEPARTMENT OF STATE,2/26/2025,890000.0,2025-02-26,2025-03-05-1332,
DEPARTMENT OF STATE,2/26/2025,888877.0,2025-02-26,2025-03-05-1332,
DEPARTMENT OF STATE,2/26/2025,887781.6,2025-02-26,2025-03-05-1332,
DEPARTMENT OF STATE,2/26/2025,887530.69,2025-02-26,2025-03-05-1332,
DEPARTMENT OF STATE,2/26/2025,883139.0,2025-02-26,2025-03-05-1332,
DEPARTMENT OF STATE,2/26/2025,875000.0,2025-02-26,2025-03-05-1332,
DEPARTMENT OF STATE,2/26/2025,874804.0,2025-02-26,2025-03-05-1332,
DEPARTMENT OF STATE,2/26/2025,869170.0,2025-02-26,2025-03-05-1332,
DEPARTMENT OF STATE,2/26/2025,869041.0,2025-02-26,2025-03-05-1332,
DEPARTMENT OF STATE,2/26/2025,868278.0,2025-02-26,2025-03-05-1332,
DEPARTMENT OF STATE,2/26/2025,865005.0,2025-02-26,2025-03-05-1332,
DEPARTMENT OF STATE,2/26/2025,864060.0,2025-02-26,2025-03-05-1332,
DEPARTMENT OF STATE,2/26/2025,860000.0,2025-02-26,2025-03-05-1332,
DEPARTMENT OF STATE,2/26/2025,855620.0,2025-02-26,2025-03-05-1332,
DEPARTMENT OF STATE,2/26/2025,848566.0,2025-02-26,2025-03-05-1332,
DEPARTMENT OF STATE,2/26/2025,845597.17,2025-02-26,2025-03-05-1332,
DEPARTMENT OF STATE,2/26/2025,843000.0,2025-02-26,2025-03-05-1332,
DEPARTMENT OF STATE,2/26/2025,839272.0,2025-02-26,2025-03-05-1332,
DEPARTMENT OF STATE,2/26/2025,838677.0,2025-02-26,2025-03-05-1332,
DEPARTMENT OF STATE,2/26/2025,824083.0,2025-02-26,2025-03-05-1332,
DEPARTMENT OF STATE,2/26/2025,820000.0,2025-02-26,2025-03-05-1332,
DEPARTMENT OF STATE,2/26/2025,816795.0,2025-02-26,2025-03-05-1332,
DEPARTMENT OF STATE,2/26/2025,815028.0,2025-02-26,2025-03-05-1332,
DEPARTMENT OF STATE,2/26/2025,1086196.0,2025-02-26,2025-03-05-1332,
DEPARTMENT OF STATE,2/26/2025,808086.0,2025-02-26,2025-03-05-1332,
DEPARTMENT OF STATE,2/26/2025,806995.0,2025-02-26,2025-03-05-1332,
DEPARTMENT OF STATE,2/26/2025,802066.0,2025-02-26,2025-03-05-1332,
DEPARTMENT OF STATE,2/26/2025,801450.0,2025-02-26,2025-03-05-1332,
DEPARTMENT OF STATE,2/26/2025,799999.0,2025-02-26,2025-03-05-1332,
DEPARTMENT OF STATE,2/26/2025,799976.01,2025-02-26,2025-03-05-1332,
DEPARTMENT OF STATE,2/26/2025,799959.0,2025-02-26,2025-03-05-1332,
DEPARTMENT OF STATE,2/26/2025,799855.0,2025-02-26,2025-03-05-1332,
DEPARTMENT OF STATE,2/26/2025,799614.0,2025-02-26,2025-03-05-1332,
DEPARTMENT OF STATE,2/26/2025,794620.0,2025-02-26,2025-03-05-1332,
DEPARTMENT OF STATE,2/26/2025,790120.0,2025-02-26,2025-03-05-1332,
DEPARTMENT OF STATE,2/26/2025,789343.0,2025-02-26,2025-03-05-1332,
DEPARTMENT OF STATE,2/26/2025,789177.0,2025-02-26,2025-03-05-1332,
DEPARTMENT OF STATE,2/26/2025,785053.0,2025-02-26,2025-03-05-1332,
DEPARTMENT OF STATE,2/26/2025,784825.0,2025-02-26,2025-03-05-1332,
DEPARTMENT OF STATE,2/26/2025,776919.0,2025-02-26,2025-03-05-1332,
DEPARTMENT OF STATE,2/26/2025,771441.0,2025-02-26,2025-03-05-1332,
DEPARTMENT OF STATE,2/26/2025,765000.0,2025-02-26,2025-03-05-1332,
DEPARTMENT OF STATE,2/26/2025,761665.0,2025-02-26,2025-03-05-1332,
DEPARTMENT OF STATE,2/26/2025,759067.0,2025-02-26,2025-03-05-1332,
DEPARTMENT OF STATE,2/26/2025,756000.0,2025-02-26,2025-03-05-1332,
DEPARTMENT OF STATE,2/26/2025,754951.1,2025-02-26,2025-03-05-1332,
DEPARTMENT OF STATE,2/26/2025,754480.0,2025-02-26,2025-03-05-1332,
DEPARTMENT OF STATE,2/26/2025,749996.0,2025-02-26,2025-03-05-1332,
DEPARTMENT OF STATE,2/26/2025,749932.0,2025-02-26,2025-03-05-1332,
DEPARTMENT OF STATE,2/26/2025,749918.12,2025-02-26,2025-03-05-1332,
DEPARTMENT OF STATE,2/26/2025,749890.0,2025-02-26,2025-03-05-1332,
DEPARTMENT OF STATE,2/26/2025,749358.0,2025-02-26,2025-03-05-1332,
DEPARTMENT OF STATE,2/26/2025,748374.0,2025-02-26,2025-03-05-1332,
DEPARTMENT OF STATE,2/26/2025,747583.21,2025-02-26,2025-03-05-1332,
DEPARTMENT OF STATE,2/26/2025,741887.0,2025-02-26,2025-03-05-1332,
DEPARTMENT OF STATE,2/26/2025,741300.0,2025-02-26,2025-03-05-1332,
DEPARTMENT OF STATE,2/26/2025,740644.0,2025-02-26,2025-03-05-1332,
DEPARTMENT OF STATE,2/26/2025,740335.0,2025-02-26,2025-03-05-1332,
DEPARTMENT OF STATE,2/26/2025,740009.0,2025-02-26,2025-03-05-1332,
DEPARTMENT OF STATE,2/26/2025,740000.0,2025-02-26,2025-03-05-1332,
DEPARTMENT OF STATE,2/26/2025,728804.0,2025-02-26,2025-03-05-1332,
DEPARTMENT OF STATE,2/26/2025,725000.0,2025-02-26,2025-03-05-1332,
DEPARTMENT OF STATE,2/26/2025,723389.0,2025-02-26,2025-03-05-1332,
DEPARTMENT OF STATE,2/26/2025,714853.0,2025-02-26,2025-03-05-1332,
DEPARTMENT OF STATE,2/26/2025,714237.0,2025-02-26,2025-03-05-1332,
DEPARTMENT OF STATE,2/26/2025,712803.0,2025-02-26,2025-03-05-1332,
DEPARTMENT OF STATE,2/26/2025,709450.0,2025-02-26,2025-03-05-1332,
DEPARTMENT OF STATE,2/26/2025,709140.0,2025-02-26,2025-03-05-1332,
DEPARTMENT OF STATE,2/26/2025,707832.0,2025-02-26,2025-03-05-1332,
DEPARTMENT OF STATE,2/26/2025,707000.0,2025-02-26,2025-03-05-1332,
DEPARTMENT OF STATE,2/26/2025,703645.0,2025-02-26,2025-03-05-1332,
DEPARTMENT OF STATE,2/26/2025,702308.0,2025-02-26,2025-03-05-1332,
DEPARTMENT OF STATE,2/26/2025,695018.0,2025-02-26,2025-03-05-1332,
DEPARTMENT OF STATE,2/26/2025,692295.0,2025-02-26,2025-03-05-1332,
DEPARTMENT OF STATE,2/26/2025,691250.0,2025-02-26,2025-03-05-1332,
DEPARTMENT OF STATE,2/26/2025,690009.0,2025-02-26,2025-03-05-1332,
DEPARTMENT OF STATE,2/26/2025,677726.0,2025-02-26,2025-03-05-1332,
DEPARTMENT OF STATE,2/26/2025,676384.0,2025-02-26,2025-03-05-1332,
DEPARTMENT OF STATE,2/26/2025,674000.0,2025-02-26,2025-03-05-1332,
DEPARTMENT OF STATE,2/26/2025,670547.0,2025-02-26,2025-03-05-1332,
DEPARTMENT OF STATE,2/26/2025,670000.0,2025-02-26,2025-03-05-1332,
DEPARTMENT OF STATE,2/26/2025,666969.0,2025-02-26,2025-03-05-1332,
DEPARTMENT OF STATE,2/26/2025,664930.0,2025-02-26,2025-03-05-1332,
DEPARTMENT OF STATE,2/26/2025,663704.0,2025-02-26,2025-03-05-1332,
DEPARTMENT OF STATE,2/26/2025,663266.45,2025-02-26,2025-03-05-1332,
DEPARTMENT OF STATE,2/26/2025,659961.0,2025-02-26,2025-03-05-1332,
DEPARTMENT OF STATE,2/26/2025,659486.0,2025-02-26,2025-03-05-1332,
DEPARTMENT OF STATE,2/26/2025,659032.0,2025-02-26,2025-03-05-1332,
DEPARTMENT OF STATE,2/26/2025,657665.0,2025-02-26,2025-03-05-1332,
DEPARTMENT OF STATE,2/26/2025,652675.0,2025-02-26,2025-03-05-1332,
DEPARTMENT OF STATE,2/26/2025,651477.0,2025-02-26,2025-03-05-1332,
DEPARTMENT OF STATE,2/26/2025,650000.0,2025-02-26,2025-03-05-1332,
DEPARTMENT OF STATE,2/26/2025,649993.7,2025-02-26,2025-03-05-1332,
DEPARTMENT OF STATE,2/26/2025,649216.0,2025-02-26,2025-03-05-1332,
DEPARTMENT OF STATE,2/26/2025,648342.0,2025-02-26,2025-03-05-1332,
DEPARTMENT OF STATE,2/26/2025,645033.06,2025-02-26,2025-03-05-1332,
DEPARTMENT OF STATE,2/26/2025,644037.0,2025-02-26,2025-03-05-1332,
DEPARTMENT OF STATE,2/26/2025,642710.0,2025-02-26,2025-03-05-1332,
DEPARTMENT OF STATE,2/26/2025,641975.0,2025-02-26,2025-03-05-1332,
DEPARTMENT OF STATE,2/26/2025,641745.0,2025-02-26,2025-03-05-1332,
DEPARTMENT OF STATE,2/26/2025,640600.0,2025-02-26,2025-03-05-1332,
DEPARTMENT OF STATE,2/26/2025,635928.0,2025-02-26,2025-03-05-1332,
DEPARTMENT OF STATE,2/26/2025,635365.0,2025-02-26,2025-03-05-1332,
DEPARTMENT OF STATE,2/26/2025,626218.95,2025-02-26,2025-03-05-1332,
DEPARTMENT OF STATE,2/26/2025,625000.0,2025-02-26,2025-03-05-1332,
DEPARTMENT OF STATE,2/26/2025,620000.0,2025-02-26,2025-03-05-1332,
DEPARTMENT OF STATE,2/26/2025,618928.0,2025-02-26,2025-03-05-1332,
DEPARTMENT OF STATE,2/26/2025,612233.0,2025-02-26,2025-03-05-1332,
DEPARTMENT OF STATE,2/26/2025,3917825.0,2025-02-26,2025-03-05-1332,
DEPARTMENT OF STATE,2/26/2025,604273.0,2025-02-26,2025-03-05-1332,
DEPARTMENT OF STATE,2/26/2025,599827.0,2025-02-26,2025-03-05-1332,
DEPARTMENT OF STATE,2/26/2025,594550.0,2025-02-26,2025-03-05-1332,
DEPARTMENT OF STATE,2/26/2025,592500.0,2025-02-26,2025-03-05-1332,
DEPARTMENT OF STATE,2/26/2025,581300.0,2025-02-26,2025-03-05-1332,
DEPARTMENT OF STATE,2/26/2025,575160.0,2025-02-26,2025-03-05-1332,
DEPARTMENT OF STATE,2/26/2025,574564.0,2025-02-26,2025-03-05-1332,
DEPARTMENT OF STATE,2/26/2025,574562.0,2025-02-26,2025-03-05-1332,
DEPARTMENT OF STATE,2/26/2025,573783.0,2025-02-26,2025-03-05-1332,
DEPARTMENT OF STATE,2/26/2025,565915.0,2025-02-26,2025-03-05-1332,
DEPARTMENT OF STATE,2/26/2025,562731.93,2025-02-26,2025-03-05-1332,
DEPARTMENT OF STATE,2/26/2025,562125.0,2025-02-26,2025-03-05-1332,
DEPARTMENT OF STATE,2/26/2025,561194.0,2025-02-26,2025-03-05-1332,
DEPARTMENT OF STATE,2/26/2025,560628.0,2025-02-26,2025-03-05-1332,
DEPARTMENT OF STATE,2/26/2025,560000.0,2025-02-26,2025-03-05-1332,
DEPARTMENT OF STATE,2/26/2025,558008.0,2025-02-26,2025-03-05-1332,
DEPARTMENT OF STATE,2/26/2025,553413.0,2025-02-26,2025-03-05-1332,
DEPARTMENT OF STATE,2/26/2025,552114.6,2025-02-26,2025-03-05-1332,
DEPARTMENT OF STATE,2/26/2025,550750.0,2025-02-26,2025-03-05-1332,
DEPARTMENT OF STATE,2/26/2025,550000.0,2025-02-26,2025-03-05-1332,
DEPARTMENT OF STATE,2/26/2025,549160.0,2025-02-26,2025-03-05-1332,
DEPARTMENT OF STATE,2/26/2025,549069.0,2025-02-26,2025-03-05-1332,
DEPARTMENT OF STATE,2/26/2025,546660.0,2025-02-26,2025-03-05-1332,
DEPARTMENT OF STATE,2/26/2025,543086.5,2025-02-26,2025-03-05-1332,
DEPARTMENT OF STATE,2/26/2025,541983.0,2025-02-26,2025-03-05-1332,
DEPARTMENT OF STATE,2/26/2025,540000.0,2025-02-26,2025-03-05-1332,
DEPARTMENT OF STATE,2/26/2025,30021.0,2025-02-26,2025-03-05-1332,
DEPARTMENT OF STATE,2/26/2025,530000.0,2025-02-26,2025-03-05-1332,
DEPARTMENT OF STATE,2/26/2025,526176.0,2025-02-26,2025-03-05-1332,
DEPARTMENT OF STATE,2/26/2025,524990.52,2025-02-26,2025-03-05-1332,
DEPARTMENT OF STATE,2/26/2025,522089.0,2025-02-26,2025-03-05-1332,
DEPARTMENT OF STATE,2/26/2025,522082.0,2025-02-26,2025-03-05-1332,
DEPARTMENT OF STATE,2/26/2025,520255.0,2025-02-26,2025-03-05-1332,
DEPARTMENT OF STATE,2/26/2025,518997.0,2025-02-26,2025-03-05-1332,
DEPARTMENT OF STATE,2/26/2025,513065.0,2025-02-26,2025-03-05-1332,
DEPARTMENT OF STATE,2/26/2025,512635.0,2025-02-26,2025-03-05-1332,
DEPARTMENT OF STATE,2/26/2025,511557.0,2025-02-26,2025-03-05-1332,
DEPARTMENT OF STATE,2/26/2025,510610.0,2025-02-26,2025-03-05-1332,
DEPARTMENT OF STATE,2/26/2025,510070.0,2025-02-26,2025-03-05-1332,
DEPARTMENT OF STATE,2/26/2025,506250.0,2025-02-26,2025-03-05-1332,
DEPARTMENT OF STATE,2/26/2025,505306.5,2025-02-26,2025-03-05-1332,
DEPARTMENT OF STATE,2/26/2025,499970.0,2025-02-26,2025-03-05-1332,
DEPARTMENT OF STATE,2/26/2025,499938.0,2025-02-26,2025-03-05-1332,
DEPARTMENT OF STATE,2/26/2025,499927.0,2025-02-26,2025-03-05-1332,
DEPARTMENT OF STATE,2/26/2025,499923.0,2025-02-26,2025-03-05-1332,
DEPARTMENT OF STATE,2/26/2025,499851.0,2025-02-26,2025-03-05-1332,
DEPARTMENT OF STATE,2/26/2025,499765.0,2025-02-26,2025-03-05-1332,
DEPARTMENT OF STATE,2/26/2025,499713.0,2025-02-26,2025-03-05-1332,
DEPARTMENT OF STATE,2/26/2025,499680.0,2025-02-26,2025-03-05-1332,
DEPARTMENT OF STATE,2/26/2025,499663.91,2025-02-26,2025-03-05-1332,
DEPARTMENT OF STATE,2/26/2025,499651.0,2025-02-26,2025-03-05-1332,
DEPARTMENT OF STATE,2/26/2025,499396.0,2025-02-26,2025-03-05-1332,
DEPARTMENT OF STATE,2/26/2025,499390.0,2025-02-26,2025-03-05-1332,
DEPARTMENT OF STATE,2/26/2025,499043.0,2025-02-26,2025-03-05-1332,
DEPARTMENT OF STATE,2/26/2025,498788.0,2025-02-26,2025-03-05-1332,
DEPARTMENT OF STATE,2/26/2025,498271.0,2025-02-26,2025-03-05-1332,
DEPARTMENT OF STATE,2/26/2025,496478.0,2025-02-26,2025-03-05-1332,
DEPARTMENT OF STATE,2/26/2025,496007.0,2025-02-26,2025-03-05-1332,
DEPARTMENT OF STATE,2/26/2025,495985.0,2025-02-26,2025-03-05-1332,
DEPARTMENT OF STATE,2/26/2025,495401.0,2025-02-26,2025-03-05-1332,
DEPARTMENT OF STATE,2/26/2025,493339.0,2025-02-26,2025-03-05-1332,
DEPARTMENT OF STATE,2/26/2025,492132.0,2025-02-26,2025-03-05-1332,
DEPARTMENT OF STATE,2/26/2025,491850.0,2025-02-26,2025-03-05-1332,
DEPARTMENT OF STATE,2/26/2025,490712.0,2025-02-26,2025-03-05-1332,
DEPARTMENT OF STATE,2/26/2025,490000.0,2025-02-26,2025-03-05-1332,
DEPARTMENT OF STATE,2/26/2025,480994.0,2025-02-26,2025-03-05-1332,
DEPARTMENT OF STATE,2/26/2025,480000.0,2025-02-26,2025-03-05-1332,
DEPARTMENT OF STATE,2/26/2025,479774.0,2025-02-26,2025-03-05-1332,
DEPARTMENT OF STATE,2/26/2025,478960.0,2025-02-26,2025-03-05-1332,
DEPARTMENT OF STATE,2/26/2025,478290.0,2025-02-26,2025-03-05-1332,
DEPARTMENT OF STATE,2/26/2025,477991.0,2025-02-26,2025-03-05-1332,
DEPARTMENT OF STATE,2/26/2025,475980.0,2025-02-26,2025-03-05-1332,
DEPARTMENT OF STATE,2/26/2025,473850.0,2025-02-26,2025-03-05-1332,
DEPARTMENT OF STATE,2/26/2025,471352.0,2025-02-26,2025-03-05-1332,
DEPARTMENT OF STATE,2/26/2025,470177.0,2025-02-26,2025-03-05-1332,
DEPARTMENT OF STATE,2/26/2025,469611.0,2025-02-26,2025-03-05-1332,
DEPARTMENT OF STATE,2/26/2025,464492.0,2025-02-26,2025-03-05-1332,
DEPARTMENT OF STATE,2/26/2025,463450.0,2025-02-26,2025-03-05-1332,
DEPARTMENT OF STATE,2/26/2025,463300.0,2025-02-26,2025-03-05-1332,
DEPARTMENT OF STATE,2/26/2025,459982.0,2025-02-26,2025-03-05-1332,
DEPARTMENT OF STATE,2/26/2025,459259.0,2025-02-26,2025-03-05-1332,
DEPARTMENT OF STATE,2/26/2025,458365.0,2025-02-26,2025-03-05-1332,
DEPARTMENT OF STATE,2/26/2025,450682.06,2025-02-26,2025-03-05-1332,
DEPARTMENT OF STATE,2/26/2025,449981.0,2025-02-26,2025-03-05-1332,
DEPARTMENT OF STATE,2/26/2025,449027.0,2025-02-26,2025-03-05-1332,
DEPARTMENT OF STATE,2/26/2025,445182.0,2025-02-26,2025-03-05-1332,
DEPARTMENT OF STATE,2/26/2025,444334.0,2025-02-26,2025-03-05-1332,
DEPARTMENT OF STATE,2/26/2025,444005.0,2025-02-26,2025-03-05-1332,
DEPARTMENT OF STATE,2/26/2025,441462.08,2025-02-26,2025-03-05-1332,
DEPARTMENT OF STATE,2/26/2025,440824.0,2025-02-26,2025-03-05-1332,
DEPARTMENT OF STATE,2/26/2025,440440.0,2025-02-26,2025-03-05-1332,
DEPARTMENT OF STATE,2/26/2025,439560.0,2025-02-26,2025-03-05-1332,
DEPARTMENT OF STATE,2/26/2025,435575.0,2025-02-26,2025-03-05-1332,
DEPARTMENT OF STATE,2/26/2025,435224.0,2025-02-26,2025-03-05-1332,
DEPARTMENT OF STATE,2/26/2025,435180.0,2025-02-26,2025-03-05-1332,
DEPARTMENT OF STATE,2/26/2025,434098.0,2025-02-26,2025-03-05-1332,
DEPARTMENT OF STATE,2/26/2025,432995.38,2025-02-26,2025-03-05-1332,
DEPARTMENT OF STATE,2/26/2025,430537.6,2025-02-26,2025-03-05-1332,
DEPARTMENT OF STATE,2/26/2025,429250.0,2025-02-26,2025-03-05-1332,
DEPARTMENT OF STATE,2/26/2025,428437.0,2025-02-26,2025-03-05-1332,
DEPARTMENT OF STATE,2/26/2025,428134.0,2025-02-26,2025-03-05-1332,
DEPARTMENT OF STATE,2/26/2025,428000.0,2025-02-26,2025-03-05-1332,
DEPARTMENT OF STATE,2/26/2025,427021.0,2025-02-26,2025-03-05-1332,
DEPARTMENT OF STATE,2/26/2025,426757.0,2025-02-26,2025-03-05-1332,
DEPARTMENT OF STATE,2/26/2025,420000.0,2025-02-26,2025-03-05-1332,
DEPARTMENT OF STATE,2/26/2025,419802.21,2025-02-26,2025-03-05-1332,
DEPARTMENT OF STATE,2/26/2025,416854.0,2025-02-26,2025-03-05-1332,
DEPARTMENT OF STATE,2/26/2025,415093.43,2025-02-26,2025-03-05-1332,
DEPARTMENT OF STATE,2/26/2025,414750.0,2025-02-26,2025-03-05-1332,
DEPARTMENT OF STATE,2/26/2025,413558.0,2025-02-26,2025-03-05-1332,
DEPARTMENT OF STATE,2/26/2025,410778.0,2025-02-26,2025-03-05-1332,
DEPARTMENT OF STATE,2/26/2025,409794.0,2025-02-26,2025-03-05-1332,
DEPARTMENT OF STATE,2/26/2025,408610.0,2025-02-26,2025-03-05-1332,
DEPARTMENT OF STATE,2/26/2025,408451.0,2025-02-26,2025-03-05-1332,
DEPARTMENT OF STATE,2/26/2025,405000.0,2025-02-26,2025-03-05-1332,
DEPARTMENT OF STATE,2/26/2025,400175.0,2025-02-26,2025-03-05-1332,
DEPARTMENT OF STATE,2/26/2025,399995.0,2025-02-26,2025-03-05-1332,
DEPARTMENT OF STATE,2/26/2025,399975.0,2025-02-26,2025-03-05-1332,
DEPARTMENT OF STATE,2/26/2025,399867.0,2025-02-26,2025-03-05-1332,
DEPARTMENT OF STATE,2/26/2025,399203.0,2025-02-26,2025-03-05-1332,
DEPARTMENT OF STATE,2/26/2025,398803.0,2025-02-26,2025-03-05-1332,
DEPARTMENT OF STATE,2/26/2025,398765.0,2025-02-26,2025-03-05-1332,
DEPARTMENT OF STATE,2/26/2025,397200.0,2025-02-26,2025-03-05-1332,
DEPARTMENT OF STATE,2/26/2025,396123.4,2025-02-26,2025-03-05-1332,
DEPARTMENT OF STATE,2/26/2025,394671.0,2025-02-26,2025-03-05-1332,
DEPARTMENT OF STATE,2/26/2025,394220.0,2025-02-26,2025-03-05-1332,
DEPARTMENT OF STATE,2/26/2025,392941.0,2025-02-26,2025-03-05-1332,
DEPARTMENT OF STATE,2/26/2025,390000.0,2025-02-26,2025-03-05-1332,
DEPARTMENT OF STATE,2/26/2025,387309.0,2025-02-26,2025-03-05-1332,
DEPARTMENT OF STATE,2/26/2025,384900.0,2025-02-26,2025-03-05-1332,
DEPARTMENT OF STATE,2/26/2025,382000.0,2025-02-26,2025-03-05-1332,
DEPARTMENT OF STATE,2/26/2025,381954.0,2025-02-26,2025-03-05-1332,
DEPARTMENT OF STATE,2/26/2025,377000.0,2025-02-26,2025-03-05-1332,
DEPARTMENT OF STATE,2/26/2025,376622.0,2025-02-26,2025-03-05-1332,
DEPARTMENT OF STATE,2/26/2025,375000.0,2025-02-26,2025-03-05-1332,
DEPARTMENT OF STATE,2/26/2025,371196.0,2025-02-26,2025-03-05-1332,
DEPARTMENT OF STATE,2/26/2025,370322.74,2025-02-26,2025-03-05-1332,
DEPARTMENT OF STATE,2/26/2025,370000.0,2025-02-26,2025-03-05-1332,
DEPARTMENT OF STATE,2/26/2025,17700.0,2025-02-26,2025-03-05-1332,
DEPARTMENT OF STATE,2/26/2025,362468.55,2025-02-26,2025-03-05-1332,
DEPARTMENT OF STATE,2/26/2025,359926.0,2025-02-26,2025-03-05-1332,
DEPARTMENT OF STATE,2/26/2025,358840.0,2025-02-26,2025-03-05-1332,
DEPARTMENT OF STATE,2/26/2025,353880.0,2025-02-26,2025-03-05-1332,
DEPARTMENT OF STATE,2/26/2025,352494.16,2025-02-26,2025-03-05-1332,
DEPARTMENT OF STATE,2/26/2025,351592.74,2025-02-26,2025-03-05-1332,
DEPARTMENT OF STATE,2/26/2025,350241.0,2025-02-26,2025-03-05-1332,
DEPARTMENT OF STATE,2/26/2025,348987.0,2025-02-26,2025-03-05-1332,
DEPARTMENT OF STATE,2/26/2025,348040.0,2025-02-26,2025-03-05-1332,
DEPARTMENT OF STATE,2/26/2025,343750.0,2025-02-26,2025-03-05-1332,
DEPARTMENT OF STATE,2/26/2025,340541.0,2025-02-26,2025-03-05-1332,
DEPARTMENT OF STATE,2/26/2025,340308.0,2025-02-26,2025-03-05-1332,
DEPARTMENT OF STATE,2/26/2025,332349.0,2025-02-26,2025-03-05-1332,
DEPARTMENT OF STATE,2/26/2025,330097.0,2025-02-26,2025-03-05-1332,
DEPARTMENT OF STATE,2/26/2025,329951.0,2025-02-26,2025-03-05-1332,
DEPARTMENT OF STATE,2/26/2025,324954.25,2025-02-26,2025-03-05-1332,
DEPARTMENT OF STATE,2/26/2025,320000.0,2025-02-26,2025-03-05-1332,
DEPARTMENT OF STATE,2/26/2025,317386.0,2025-02-26,2025-03-05-1332,
DEPARTMENT OF STATE,2/26/2025,316000.0,2025-02-26,2025-03-05-1332,
DEPARTMENT OF STATE,2/26/2025,311748.0,2025-02-26,2025-03-05-1332,
DEPARTMENT OF STATE,2/26/2025,308881.0,2025-02-26,2025-03-05-1332,
DEPARTMENT OF STATE,2/26/2025,308005.0,2025-02-26,2025-03-05-1332,
DEPARTMENT OF STATE,2/26/2025,307446.0,2025-02-26,2025-03-05-1332,
DEPARTMENT OF STATE,2/26/2025,306561.0,2025-02-26,2025-03-05-1332,
DEPARTMENT OF STATE,2/26/2025,303050.0,2025-02-26,2025-03-05-1332,
DEPARTMENT OF STATE,2/26/2025,301278.0,2025-02-26,2025-03-05-1332,
DEPARTMENT OF STATE,2/26/2025,300704.0,2025-02-26,2025-03-05-1332,
DEPARTMENT OF STATE,2/26/2025,300003.42,2025-02-26,2025-03-05-1332,
DEPARTMENT OF STATE,2/26/2025,299998.88,2025-02-26,2025-03-05-1332,
DEPARTMENT OF STATE,2/26/2025,299996.0,2025-02-26,2025-03-05-1332,
DEPARTMENT OF STATE,2/26/2025,299995.89,2025-02-26,2025-03-05-1332,
DEPARTMENT OF STATE,2/26/2025,299995.2,2025-02-26,2025-03-05-1332,
DEPARTMENT OF STATE,2/26/2025,298499.5,2025-02-26,2025-03-05-1332,
DEPARTMENT OF STATE,2/26/2025,298160.0,2025-02-26,2025-03-05-1332,
DEPARTMENT OF STATE,2/26/2025,296284.0,2025-02-26,2025-03-05-1332,
DEPARTMENT OF STATE,2/26/2025,295112.0,2025-02-26,2025-03-05-1332,
DEPARTMENT OF STATE,2/26/2025,293360.0,2025-02-26,2025-03-05-1332,
DEPARTMENT OF STATE,2/26/2025,290700.0,2025-02-26,2025-03-05-1332,
DEPARTMENT OF STATE,2/26/2025,290000.0,2025-02-26,2025-03-05-1332,
DEPARTMENT OF STATE,2/26/2025,289887.0,2025-02-26,2025-03-05-1332,
DEPARTMENT OF STATE,2/26/2025,288854.0,2025-02-26,2025-03-05-1332,
DEPARTMENT OF STATE,2/26/2025,288546.0,2025-02-26,2025-03-05-1332,
DEPARTMENT OF STATE,2/26/2025,287779.0,2025-02-26,2025-03-05-1332,
DEPARTMENT OF STATE,2/26/2025,285888.0,2025-02-26,2025-03-05-1332,
DEPARTMENT OF STATE,2/26/2025,285046.0,2025-02-26,2025-03-05-1332,
DEPARTMENT OF STATE,2/26/2025,285000.0,2025-02-26,2025-03-05-1332,
DEPARTMENT OF STATE,2/26/2025,279725.0,2025-02-26,2025-03-05-1332,
DEPARTMENT OF STATE,2/26/2025,278918.0,2025-02-26,2025-03-05-1332,
DEPARTMENT OF STATE,2/26/2025,276325.0,2025-02-26,2025-03-05-1332,
DEPARTMENT OF STATE,2/26/2025,276038.0,2025-02-26,2025-03-05-1332,
DEPARTMENT OF STATE,2/26/2025,272321.0,2025-02-26,2025-03-05-1332,
DEPARTMENT OF STATE,2/26/2025,266996.5,2025-02-26,2025-03-05-1332,
DEPARTMENT OF STATE,2/26/2025,266970.0,2025-02-26,2025-03-05-1332,
DEPARTMENT OF STATE,2/26/2025,265000.0,2025-02-26,2025-03-05-1332,
DEPARTMENT OF STATE,2/26/2025,262979.0,2025-02-26,2025-03-05-1332,
DEPARTMENT OF STATE,2/26/2025,260870.0,2025-02-26,2025-03-05-1332,
DEPARTMENT OF STATE,2/26/2025,259996.13,2025-02-26,2025-03-05-1332,
DEPARTMENT OF STATE,2/26/2025,259864.0,2025-02-26,2025-03-05-1332,
DEPARTMENT OF STATE,2/26/2025,258966.39,2025-02-26,2025-03-05-1332,
DEPARTMENT OF STATE,2/26/2025,258866.0,2025-02-26,2025-03-05-1332,
DEPARTMENT OF STATE,2/26/2025,255574.0,2025-02-26,2025-03-05-1332,
DEPARTMENT OF STATE,2/26/2025,254300.0,2025-02-26,2025-03-05-1332,
DEPARTMENT OF STATE,2/26/2025,253000.0,2025-02-26,2025-03-05-1332,
DEPARTMENT OF STATE,2/26/2025,21270.0,2025-02-26,2025-03-05-1332,
DEPARTMENT OF STATE,2/26/2025,199099.0,2025-02-26,2025-03-05-1332,
DEPARTMENT OF STATE,2/26/2025,249999.92,2025-02-26,2025-03-05-1332,
DEPARTMENT OF STATE,2/26/2025,249999.64,2025-02-26,2025-03-05-1332,
DEPARTMENT OF STATE,2/26/2025,249999.0,2025-02-26,2025-03-05-1332,
DEPARTMENT OF STATE,2/26/2025,249997.0,2025-02-26,2025-03-05-1332,
DEPARTMENT OF STATE,2/26/2025,249986.0,2025-02-26,2025-03-05-1332,
DEPARTMENT OF STATE,2/26/2025,249964.0,2025-02-26,2025-03-05-1332,
DEPARTMENT OF STATE,2/26/2025,249960.0,2025-02-26,2025-03-05-1332,
DEPARTMENT OF STATE,2/26/2025,249940.0,2025-02-26,2025-03-05-1332,
DEPARTMENT OF STATE,2/26/2025,249925.0,2025-02-26,2025-03-05-1332,
DEPARTMENT OF STATE,2/26/2025,249912.0,2025-02-26,2025-03-05-1332,
DEPARTMENT OF STATE,2/26/2025,249903.5,2025-02-26,2025-03-05-1332,
DEPARTMENT OF STATE,2/26/2025,249887.51,2025-02-26,2025-03-05-1332,
DEPARTMENT OF STATE,2/26/2025,249866.0,2025-02-26,2025-03-05-1332,
DEPARTMENT OF STATE,2/26/2025,249834.0,2025-02-26,2025-03-05-1332,
DEPARTMENT OF STATE,2/26/2025,249807.07,2025-02-26,2025-03-05-1332,
DEPARTMENT OF STATE,2/26/2025,249780.0,2025-02-26,2025-03-05-1332,
DEPARTMENT OF STATE,2/26/2025,249488.0,2025-02-26,2025-03-05-1332,
DEPARTMENT OF STATE,2/26/2025,249470.5,2025-02-26,2025-03-05-1332,
DEPARTMENT OF STATE,2/26/2025,249259.8,2025-02-26,2025-03-05-1332,
DEPARTMENT OF STATE,2/26/2025,249047.0,2025-02-26,2025-03-05-1332,
DEPARTMENT OF STATE,2/26/2025,248640.0,2025-02-26,2025-03-05-1332,
DEPARTMENT OF STATE,2/26/2025,248391.0,2025-02-26,2025-03-05-1332,
DEPARTMENT OF STATE,2/26/2025,248022.0,2025-02-26,2025-03-05-1332,
DEPARTMENT OF STATE,2/26/2025,247982.1,2025-02-26,2025-03-05-1332,
DEPARTMENT OF STATE,2/26/2025,247966.08,2025-02-26,2025-03-05-1332,
DEPARTMENT OF STATE,2/26/2025,247000.0,2025-02-26,2025-03-05-1332,
DEPARTMENT OF STATE,2/26/2025,246921.0,2025-02-26,2025-03-05-1332,
DEPARTMENT OF STATE,2/26/2025,246750.0,2025-02-26,2025-03-05-1332,
DEPARTMENT OF STATE,2/26/2025,246577.0,2025-02-26,2025-03-05-1332,
DEPARTMENT OF STATE,2/26/2025,246295.5,2025-02-26,2025-03-05-1332,
DEPARTMENT OF STATE,2/26/2025,246030.0,2025-02-26,2025-03-05-1332,
DEPARTMENT OF STATE,2/26/2025,245000.0,2025-02-26,2025-03-05-1332,
DEPARTMENT OF STATE,2/26/2025,244798.0,2025-02-26,2025-03-05-1332,
DEPARTMENT OF STATE,2/26/2025,244182.0,2025-02-26,2025-03-05-1332,
DEPARTMENT OF STATE,2/26/2025,243066.0,2025-02-26,2025-03-05-1332,
DEPARTMENT OF STATE,2/26/2025,242437.0,2025-02-26,2025-03-05-1332,
DEPARTMENT OF STATE,2/26/2025,241542.0,2025-02-26,2025-03-05-1332,
DEPARTMENT OF STATE,2/26/2025,238970.0,2025-02-26,2025-03-05-1332,
DEPARTMENT OF STATE,2/26/2025,238100.0,2025-02-26,2025-03-05-1332,
DEPARTMENT OF STATE,2/26/2025,236123.0,2025-02-26,2025-03-05-1332,
DEPARTMENT OF STATE,2/26/2025,4190346.64,2025-02-26,2025-03-05-1332,
DEPARTMENT OF STATE,2/26/2025,235200.0,2025-02-26,2025-03-05-1332,
DEPARTMENT OF STATE,2/26/2025,229389.0,2025-02-26,2025-03-05-1332,
DEPARTMENT OF STATE,2/26/2025,226252.0,2025-02-26,2025-03-05-1332,
DEPARTMENT OF STATE,2/26/2025,225460.0,2025-02-26,2025-03-05-1332,
DEPARTMENT OF STATE,2/26/2025,224610.65,2025-02-26,2025-03-05-1332,
DEPARTMENT OF STATE,2/26/2025,223000.0,2025-02-26,2025-03-05-1332,
DEPARTMENT OF STATE,2/26/2025,222187.0,2025-02-26,2025-03-05-1332,
DEPARTMENT OF STATE,2/26/2025,220809.26,2025-02-26,2025-03-05-1332,
DEPARTMENT OF STATE,2/26/2025,216750.0,2025-02-26,2025-03-05-1332,
DEPARTMENT OF STATE,2/26/2025,216540.0,2025-02-26,2025-03-05-1332,
DEPARTMENT OF STATE,2/26/2025,215518.11,2025-02-26,2025-03-05-1332,
DEPARTMENT OF STATE,2/26/2025,215000.66,2025-02-26,2025-03-05-1332,
DEPARTMENT OF STATE,2/26/2025,214246.0,2025-02-26,2025-03-05-1332,
DEPARTMENT OF STATE,2/26/2025,212500.0,2025-02-26,2025-03-05-1332,
DEPARTMENT OF STATE,2/26/2025,209650.0,2025-02-26,2025-03-05-1332,
DEPARTMENT OF STATE,2/26/2025,208760.0,2025-02-26,2025-03-05-1332,
DEPARTMENT OF STATE,2/26/2025,206080.0,2025-02-26,2025-03-05-1332,
DEPARTMENT OF STATE,2/26/2025,205908.0,2025-02-26,2025-03-05-1332,
DEPARTMENT OF STATE,2/26/2025,204487.0,2025-02-26,2025-03-05-1332,
DEPARTMENT OF STATE,2/26/2025,204120.0,2025-02-26,2025-03-05-1332,
DEPARTMENT OF STATE,2/26/2025,202754.0,2025-02-26,2025-03-05-1332,
DEPARTMENT OF STATE,2/26/2025,202530.0,2025-02-26,2025-03-05-1332,
DEPARTMENT OF STATE,2/26/2025,202250.0,2025-02-26,2025-03-05-1332,
DEPARTMENT OF STATE,2/26/2025,202000.0,2025-02-26,2025-03-05-1332,
DEPARTMENT OF STATE,2/26/2025,201774.0,2025-02-26,2025-03-05-1332,
DEPARTMENT OF STATE,2/26/2025,201012.0,2025-02-26,2025-03-05-1332,
DEPARTMENT OF STATE,2/26/2025,200561.3,2025-02-26,2025-03-05-1332,
DEPARTMENT OF STATE,2/26/2025,199994.0,2025-02-26,2025-03-05-1332,
DEPARTMENT OF STATE,2/26/2025,199848.74,2025-02-26,2025-03-05-1332,
DEPARTMENT OF STATE,2/26/2025,199826.0,2025-02-26,2025-03-05-1332,
DEPARTMENT OF STATE,2/26/2025,199100.0,2025-02-26,2025-03-05-1332,
DEPARTMENT OF STATE,2/26/2025,199000.0,2025-02-26,2025-03-05-1332,
DEPARTMENT OF STATE,2/26/2025,198052.0,2025-02-26,2025-03-05-1332,
DEPARTMENT OF STATE,2/26/2025,197761.58,2025-02-26,2025-03-05-1332,
DEPARTMENT OF STATE,2/26/2025,195781.3,2025-02-26,2025-03-05-1332,
DEPARTMENT OF STATE,2/26/2025,194759.04,2025-02-26,2025-03-05-1332,
DEPARTMENT OF STATE,2/26/2025,192115.0,2025-02-26,2025-03-05-1332,
DEPARTMENT OF STATE,2/26/2025,190738.2,2025-02-26,2025-03-05-1332,
DEPARTMENT OF STATE,2/26/2025,190123.0,2025-02-26,2025-03-05-1332,
DEPARTMENT OF STATE,2/26/2025,190120.0,2025-02-26,2025-03-05-1332,
DEPARTMENT OF STATE,2/26/2025,189805.5,2025-02-26,2025-03-05-1332,
DEPARTMENT OF STATE,2/26/2025,188660.0,2025-02-26,2025-03-05-1332,
DEPARTMENT OF STATE,2/26/2025,188055.0,2025-02-26,2025-03-05-1332,
DEPARTMENT OF STATE,2/26/2025,188000.0,2025-02-26,2025-03-05-1332,
DEPARTMENT OF STATE,2/26/2025,187107.3,2025-02-26,2025-03-05-1332,
DEPARTMENT OF STATE,2/26/2025,185938.5,2025-02-26,2025-03-05-1332,
DEPARTMENT OF STATE,2/26/2025,185000.0,2025-02-26,2025-03-05-1332,
DEPARTMENT OF STATE,2/26/2025,184276.0,2025-02-26,2025-03-05-1332,
DEPARTMENT OF STATE,2/26/2025,181000.0,2025-02-26,2025-03-05-1332,
DEPARTMENT OF STATE,2/26/2025,180400.0,2025-02-26,2025-03-05-1332,
DEPARTMENT OF STATE,2/26/2025,180116.0,2025-02-26,2025-03-05-1332,
DEPARTMENT OF STATE,2/26/2025,180000.0,2025-02-26,2025-03-05-1332,
DEPARTMENT OF STATE,2/26/2025,176991.0,2025-02-26,2025-03-05-1332,
DEPARTMENT OF STATE,2/26/2025,176651.54,2025-02-26,2025-03-05-1332,
DEPARTMENT OF STATE,2/26/2025,176268.0,2025-02-26,2025-03-05-1332,
DEPARTMENT OF STATE,2/26/2025,176074.0,2025-02-26,2025-03-05-1332,
DEPARTMENT OF STATE,2/26/2025,175010.0,2025-02-26,2025-03-05-1332,
DEPARTMENT OF STATE,2/26/2025,174681.04,2025-02-26,2025-03-05-1332,
DEPARTMENT OF STATE,2/26/2025,173004.0,2025-02-26,2025-03-05-1332,
DEPARTMENT OF STATE,2/26/2025,172944.0,2025-02-26,2025-03-05-1332,
DEPARTMENT OF STATE,2/26/2025,172192.2,2025-02-26,2025-03-05-1332,
DEPARTMENT OF STATE,2/26/2025,171070.0,2025-02-26,2025-03-05-1332,
DEPARTMENT OF STATE,2/26/2025,169100.0,2025-02-26,2025-03-05-1332,
DEPARTMENT OF STATE,2/26/2025,168341.0,2025-02-26,2025-03-05-1332,
DEPARTMENT OF STATE,2/26/2025,168085.66,2025-02-26,2025-03-05-1332,
DEPARTMENT OF STATE,2/26/2025,167410.0,2025-02-26,2025-03-05-1332,
DEPARTMENT OF STATE,2/26/2025,166834.5,2025-02-26,2025-03-05-1332,
DEPARTMENT OF STATE,2/26/2025,166730.8,2025-02-26,2025-03-05-1332,
DEPARTMENT OF STATE,2/26/2025,165157.0,2025-02-26,2025-03-05-1332,
DEPARTMENT OF STATE,2/26/2025,165053.0,2025-02-26,2025-03-05-1332,
DEPARTMENT OF STATE,2/26/2025,164950.5,2025-02-26,2025-03-05-1332,
DEPARTMENT OF STATE,2/26/2025,163290.0,2025-02-26,2025-03-05-1332,
DEPARTMENT OF STATE,2/26/2025,162813.0,2025-02-26,2025-03-05-1332,
DEPARTMENT OF STATE,2/26/2025,162131.07,2025-02-26,2025-03-05-1332,
DEPARTMENT OF STATE,2/26/2025,161847.62,2025-02-26,2025-03-05-1332,
DEPARTMENT OF STATE,2/26/2025,161400.0,2025-02-26,2025-03-05-1332,
DEPARTMENT OF STATE,2/26/2025,161153.5,2025-02-26,2025-03-05-1332,
DEPARTMENT OF STATE,2/26/2025,160000.0,2025-02-26,2025-03-05-1332,
DEPARTMENT OF STATE,2/26/2025,159376.4,2025-02-26,2025-03-05-1332,
DEPARTMENT OF STATE,2/26/2025,914000.0,2025-02-26,2025-03-05-1332,
DEPARTMENT OF STATE,2/26/2025,158255.0,2025-02-26,2025-03-05-1332,
DEPARTMENT OF STATE,2/26/2025,157499.9,2025-02-26,2025-03-05-1332,
DEPARTMENT OF STATE,2/26/2025,157499.32,2025-02-26,2025-03-05-1332,
DEPARTMENT OF STATE,2/26/2025,156955.0,2025-02-26,2025-03-05-1332,
DEPARTMENT OF STATE,2/26/2025,156544.0,2025-02-26,2025-03-05-1332,
DEPARTMENT OF STATE,2/26/2025,156250.0,2025-02-26,2025-03-05-1332,
DEPARTMENT OF STATE,2/26/2025,154130.0,2025-02-26,2025-03-05-1332,
DEPARTMENT OF STATE,2/26/2025,152590.0,2025-02-26,2025-03-05-1332,
DEPARTMENT OF STATE,2/26/2025,152500.0,2025-02-26,2025-03-05-1332,
DEPARTMENT OF STATE,2/26/2025,152012.0,2025-02-26,2025-03-05-1332,
DEPARTMENT OF STATE,2/26/2025,151795.44,2025-02-26,2025-03-05-1332,
DEPARTMENT OF STATE,2/26/2025,150453.0,2025-02-26,2025-03-05-1332,
DEPARTMENT OF STATE,2/26/2025,78526.0,2025-02-26,2025-03-05-1332,
DEPARTMENT OF STATE,2/26/2025,814000.0,2025-02-26,2025-03-05-1332,
DEPARTMENT OF STATE,2/26/2025,149998.8,2025-02-26,2025-03-05-1332,
DEPARTMENT OF STATE,2/26/2025,149998.45,2025-02-26,2025-03-05-1332,
DEPARTMENT OF STATE,2/26/2025,149996.25,2025-02-26,2025-03-05-1332,
DEPARTMENT OF STATE,2/26/2025,149970.0,2025-02-26,2025-03-05-1332,
DEPARTMENT OF STATE,2/26/2025,149968.88,2025-02-26,2025-03-05-1332,
DEPARTMENT OF STATE,2/26/2025,149903.45,2025-02-26,2025-03-05-1332,
DEPARTMENT OF STATE,2/26/2025,149653.56,2025-02-26,2025-03-05-1332,
DEPARTMENT OF STATE,2/26/2025,149644.5,2025-02-26,2025-03-05-1332,
DEPARTMENT OF STATE,2/26/2025,149303.85,2025-02-26,2025-03-05-1332,
DEPARTMENT OF STATE,2/26/2025,149189.0,2025-02-26,2025-03-05-1332,
DEPARTMENT OF STATE,2/26/2025,148428.68,2025-02-26,2025-03-05-1332,
DEPARTMENT OF STATE,2/26/2025,147394.0,2025-02-26,2025-03-05-1332,
DEPARTMENT OF STATE,2/26/2025,145958.0,2025-02-26,2025-03-05-1332,
DEPARTMENT OF STATE,2/26/2025,144767.54,2025-02-26,2025-03-05-1332,
DEPARTMENT OF STATE,2/26/2025,143616.95,2025-02-26,2025-03-05-1332,
DEPARTMENT OF STATE,2/26/2025,141108.0,2025-02-26,2025-03-05-1332,
DEPARTMENT OF STATE,2/26/2025,140790.0,2025-02-26,2025-03-05-1332,
DEPARTMENT OF STATE,2/26/2025,139997.16,2025-02-26,2025-03-05-1332,
DEPARTMENT OF STATE,2/26/2025,139650.04,2025-02-26,2025-03-05-1332,
DEPARTMENT OF STATE,2/26/2025,138667.0,2025-02-26,2025-03-05-1332,
DEPARTMENT OF STATE,2/26/2025,138515.0,2025-02-26,2025-03-05-1332,
DEPARTMENT OF STATE,2/26/2025,138400.23,2025-02-26,2025-03-05-1332,
DEPARTMENT OF STATE,2/26/2025,136296.0,2025-02-26,2025-03-05-1332,
DEPARTMENT OF STATE,2/26/2025,135000.0,2025-02-26,2025-03-05-1332,
DEPARTMENT OF STATE,2/26/2025,134508.25,2025-02-26,2025-03-05-1332,
DEPARTMENT OF STATE,2/26/2025,134340.0,2025-02-26,2025-03-05-1332,
DEPARTMENT OF STATE,2/26/2025,133576.0,2025-02-26,2025-03-05-1332,
DEPARTMENT OF STATE,2/26/2025,133540.0,2025-02-26,2025-03-05-1332,
DEPARTMENT OF STATE,2/26/2025,132500.0,2025-02-26,2025-03-05-1332,
DEPARTMENT OF STATE,2/26/2025,132380.0,2025-02-26,2025-03-05-1332,
DEPARTMENT OF STATE,2/26/2025,131500.0,2025-02-26,2025-03-05-1332,
DEPARTMENT OF STATE,2/26/2025,130804.0,2025-02-26,2025-03-05-1332,
DEPARTMENT OF STATE,2/26/2025,130192.92,2025-02-26,2025-03-05-1332,
DEPARTMENT OF STATE,2/26/2025,130000.0,2025-02-26,2025-03-05-1332,
DEPARTMENT OF STATE,2/26/2025,129925.0,2025-02-26,2025-03-05-1332,
DEPARTMENT OF STATE,2/26/2025,128483.0,2025-02-26,2025-03-05-1332,
DEPARTMENT OF STATE,2/26/2025,128060.0,2025-02-26,2025-03-05-1332,
DEPARTMENT OF STATE,2/26/2025,127294.0,2025-02-26,2025-03-05-1332,
DEPARTMENT OF STATE,2/26/2025,127152.55,2025-02-26,2025-03-05-1332,
DEPARTMENT OF STATE,2/26/2025,126500.0,2025-02-26,2025-03-05-1332,
DEPARTMENT OF STATE,2/26/2025,126286.0,2025-02-26,2025-03-05-1332,
DEPARTMENT OF STATE,2/26/2025,126000.0,2025-02-26,2025-03-05-1332,
DEPARTMENT OF STATE,2/26/2025,125125.0,2025-02-26,2025-03-05-1332,
DEPARTMENT OF STATE,2/26/2025,125050.0,2025-02-26,2025-03-05-1332,
DEPARTMENT OF STATE,2/26/2025,124978.35,2025-02-26,2025-03-05-1332,
DEPARTMENT OF STATE,2/26/2025,124806.0,2025-02-26,2025-03-05-1332,
DEPARTMENT OF STATE,2/26/2025,124575.0,2025-02-26,2025-03-05-1332,
DEPARTMENT OF STATE,2/26/2025,124000.0,2025-02-26,2025-03-05-1332,
DEPARTMENT OF STATE,2/26/2025,123980.0,2025-02-26,2025-03-05-1332,
DEPARTMENT OF STATE,2/26/2025,123450.0,2025-02-26,2025-03-05-1332,
DEPARTMENT OF STATE,2/26/2025,122842.8,2025-02-26,2025-03-05-1332,
DEPARTMENT OF STATE,2/26/2025,122700.0,2025-02-26,2025-03-05-1332,
DEPARTMENT OF STATE,2/26/2025,121125.0,2025-02-26,2025-03-05-1332,
DEPARTMENT OF STATE,2/26/2025,121114.0,2025-02-26,2025-03-05-1332,
DEPARTMENT OF STATE,2/26/2025,120716.78,2025-02-26,2025-03-05-1332,
DEPARTMENT OF STATE,2/26/2025,120250.5,2025-02-26,2025-03-05-1332,
DEPARTMENT OF STATE,2/26/2025,120000.0,2025-02-26,2025-03-05-1332,
DEPARTMENT OF STATE,2/26/2025,119999.0,2025-02-26,2025-03-05-1332,
DEPARTMENT OF STATE,2/26/2025,119460.0,2025-02-26,2025-03-05-1332,
DEPARTMENT OF STATE,2/26/2025,118871.39,2025-02-26,2025-03-05-1332,
DEPARTMENT OF STATE,2/26/2025,117500.0,2025-02-26,2025-03-05-1332,
DEPARTMENT OF STATE,2/26/2025,116518.0,2025-02-26,2025-03-05-1332,
DEPARTMENT OF STATE,2/26/2025,113831.0,2025-02-26,2025-03-05-1332,
DEPARTMENT OF STATE,2/26/2025,112863.0,2025-02-26,2025-03-05-1332,
DEPARTMENT OF STATE,2/26/2025,111900.0,2025-02-26,2025-03-05-1332,
DEPARTMENT OF STATE,2/26/2025,111843.0,2025-02-26,2025-03-05-1332,
DEPARTMENT OF STATE,2/26/2025,110870.0,2025-02-26,2025-03-05-1332,
DEPARTMENT OF STATE,2/26/2025,107032.3,2025-02-26,2025-03-05-1332,
DEPARTMENT OF STATE,2/26/2025,106000.0,2025-02-26,2025-03-05-1332,
DEPARTMENT OF STATE,2/26/2025,105139.0,2025-02-26,2025-03-05-1332,
DEPARTMENT OF STATE,2/26/2025,105035.0,2025-02-26,2025-03-05-1332,
DEPARTMENT OF STATE,2/26/2025,105000.0,2025-02-26,2025-03-05-1332,
DEPARTMENT OF STATE,2/26/2025,104993.82,2025-02-26,2025-03-05-1332,
DEPARTMENT OF STATE,2/26/2025,103553.0,2025-02-26,2025-03-05-1332,
DEPARTMENT OF STATE,2/26/2025,102934.0,2025-02-26,2025-03-05-1332,
DEPARTMENT OF STATE,2/26/2025,101491.0,2025-02-26,2025-03-05-1332,
DEPARTMENT OF STATE,2/26/2025,101188.0,2025-02-26,2025-03-05-1332,
DEPARTMENT OF STATE,2/26/2025,100931.0,2025-02-26,2025-03-05-1332,
DEPARTMENT OF STATE,2/26/2025,100820.0,2025-02-26,2025-03-05-1332,
DEPARTMENT OF STATE,2/26/2025,100710.0,2025-02-26,2025-03-05-1332,
DEPARTMENT OF STATE,2/26/2025,100309.0,2025-02-26,2025-03-05-1332,
DEPARTMENT OF STATE,2/26/2025,100245.0,2025-02-26,2025-03-05-1332,
DEPARTMENT OF STATE,2/26/2025,100185.0,2025-02-26,2025-03-05-1332,
DEPARTMENT OF STATE,2/26/2025,1546296.0,2025-02-26,2025-03-05-1332,
DEPARTMENT OF STATE,2/26/2025,567901.0,2025-02-26,2025-03-05-1332,
DEPARTMENT OF STATE,2/26/2025,99997.2,2025-02-26,2025-03-05-1332,
DEPARTMENT OF STATE,2/26/2025,99996.72,2025-02-26,2025-03-05-1332,
DEPARTMENT OF STATE,2/26/2025,99990.0,2025-02-26,2025-03-05-1332,
DEPARTMENT OF STATE,2/26/2025,99984.42,2025-02-26,2025-03-05-1332,
DEPARTMENT OF STATE,2/26/2025,99978.9,2025-02-26,2025-03-05-1332,
DEPARTMENT OF STATE,2/26/2025,99964.31,2025-02-26,2025-03-05-1332,
DEPARTMENT OF STATE,2/26/2025,99964.23,2025-02-26,2025-03-05-1332,
DEPARTMENT OF STATE,2/26/2025,99934.0,2025-02-26,2025-03-05-1332,
DEPARTMENT OF STATE,2/26/2025,99924.0,2025-02-26,2025-03-05-1332,
DEPARTMENT OF STATE,2/26/2025,99788.0,2025-02-26,2025-03-05-1332,
DEPARTMENT OF STATE,2/26/2025,99787.41,2025-02-26,2025-03-05-1332,
DEPARTMENT OF STATE,2/26/2025,99764.23,2025-02-26,2025-03-05-1332,
DEPARTMENT OF STATE,2/26/2025,99505.0,2025-02-26,2025-03-05-1332,
DEPARTMENT OF STATE,2/26/2025,99445.0,2025-02-26,2025-03-05-1332,
DEPARTMENT OF STATE,2/26/2025,99151.19,2025-02-26,2025-03-05-1332,
DEPARTMENT OF STATE,2/26/2025,99000.0,2025-02-26,2025-03-05-1332,
DEPARTMENT OF STATE,2/26/2025,98700.0,2025-02-26,2025-03-05-1332,
DEPARTMENT OF STATE,2/26/2025,98670.69,2025-02-26,2025-03-05-1332,
DEPARTMENT OF STATE,2/26/2025,98500.0,2025-02-26,2025-03-05-1332,
DEPARTMENT OF STATE,2/26/2025,98000.0,2025-02-26,2025-03-05-1332,
DEPARTMENT OF STATE,2/26/2025,97200.0,2025-02-26,2025-03-05-1332,
DEPARTMENT OF STATE,2/26/2025,97007.5,2025-02-26,2025-03-05-1332,
DEPARTMENT OF STATE,2/26/2025,96460.0,2025-02-26,2025-03-05-1332,
DEPARTMENT OF STATE,2/26/2025,94909.0,2025-02-26,2025-03-05-1332,
DEPARTMENT OF STATE,2/26/2025,94664.0,2025-02-26,2025-03-05-1332,
DEPARTMENT OF STATE,2/26/2025,94357.0,2025-02-26,2025-03-05-1332,
DEPARTMENT OF STATE,2/26/2025,93907.0,2025-02-26,2025-03-05-1332,
DEPARTMENT OF STATE,2/26/2025,93333.0,2025-02-26,2025-03-05-1332,
DEPARTMENT OF STATE,2/26/2025,93000.0,2025-02-26,2025-03-05-1332,
DEPARTMENT OF STATE,2/26/2025,92544.0,2025-02-26,2025-03-05-1332,
DEPARTMENT OF STATE,2/26/2025,91397.0,2025-02-26,2025-03-05-1332,
DEPARTMENT OF STATE,2/26/2025,91100.0,2025-02-26,2025-03-05-1332,
DEPARTMENT OF STATE,2/26/2025,91000.0,2025-02-26,2025-03-05-1332,
DEPARTMENT OF STATE,2/26/2025,90909.0,2025-02-26,2025-03-05-1332,
DEPARTMENT OF STATE,2/26/2025,89895.0,2025-02-26,2025-03-05-1332,
DEPARTMENT OF STATE,2/26/2025,89804.0,2025-02-26,2025-03-05-1332,
DEPARTMENT OF STATE,2/26/2025,89712.0,2025-02-26,2025-03-05-1332,
DEPARTMENT OF STATE,2/26/2025,89412.0,2025-02-26,2025-03-05-1332,
DEPARTMENT OF STATE,2/26/2025,89000.0,2025-02-26,2025-03-05-1332,
DEPARTMENT OF STATE,2/26/2025,87598.0,2025-02-26,2025-03-05-1332,
DEPARTMENT OF STATE,2/26/2025,87360.0,2025-02-26,2025-03-05-1332,
DEPARTMENT OF STATE,2/26/2025,87215.34,2025-02-26,2025-03-05-1332,
DEPARTMENT OF STATE,2/26/2025,87000.0,2025-02-26,2025-03-05-1332,
DEPARTMENT OF STATE,2/26/2025,86994.0,2025-02-26,2025-03-05-1332,
DEPARTMENT OF STATE,2/26/2025,86818.0,2025-02-26,2025-03-05-1332,
DEPARTMENT OF STATE,2/26/2025,86730.0,2025-02-26,2025-03-05-1332,
DEPARTMENT OF STATE,2/26/2025,86698.0,2025-02-26,2025-03-05-1332,
DEPARTMENT OF STATE,2/26/2025,86482.0,2025-02-26,2025-03-05-1332,
DEPARTMENT OF STATE,2/26/2025,86119.81,2025-02-26,2025-03-05-1332,
DEPARTMENT OF STATE,2/26/2025,85439.0,2025-02-26,2025-03-05-1332,
DEPARTMENT OF STATE,2/26/2025,43420.0,2025-02-26,2025-03-05-1332,
DEPARTMENT OF STATE,2/26/2025,85100.0,2025-02-26,2025-03-05-1332,
DEPARTMENT OF STATE,2/26/2025,85023.0,2025-02-26,2025-03-05-1332,
DEPARTMENT OF STATE,2/26/2025,84333.0,2025-02-26,2025-03-05-1332,
DEPARTMENT OF STATE,2/26/2025,83497.0,2025-02-26,2025-03-05-1332,
DEPARTMENT OF STATE,2/26/2025,82566.96,2025-02-26,2025-03-05-1332,
DEPARTMENT OF STATE,2/26/2025,82540.0,2025-02-26,2025-03-05-1332,
DEPARTMENT OF STATE,2/26/2025,82500.0,2025-02-26,2025-03-05-1332,
DEPARTMENT OF STATE,2/26/2025,81900.0,2025-02-26,2025-03-05-1332,
DEPARTMENT OF STATE,2/26/2025,81363.0,2025-02-26,2025-03-05-1332,
DEPARTMENT OF STATE,2/26/2025,81300.0,2025-02-26,2025-03-05-1332,
DEPARTMENT OF STATE,2/26/2025,446776.0,2025-02-26,2025-03-05-1332,
DEPARTMENT OF STATE,2/26/2025,36742.04,2025-02-26,2025-03-05-1332,
DEPARTMENT OF STATE,2/26/2025,79955.07,2025-02-26,2025-03-05-1332,
DEPARTMENT OF STATE,2/26/2025,79673.0,2025-02-26,2025-03-05-1332,
DEPARTMENT OF STATE,2/26/2025,79630.0,2025-02-26,2025-03-05-1332,
DEPARTMENT OF STATE,2/26/2025,78880.0,2025-02-26,2025-03-05-1332,
DEPARTMENT OF STATE,2/26/2025,78050.0,2025-02-26,2025-03-05-1332,
DEPARTMENT OF STATE,2/26/2025,78000.0,2025-02-26,2025-03-05-1332,
DEPARTMENT OF STATE,2/26/2025,77775.0,2025-02-26,2025-03-05-1332,
DEPARTMENT OF STATE,2/26/2025,77600.0,2025-02-26,2025-03-05-1332,
DEPARTMENT OF STATE,2/26/2025,77082.0,2025-02-26,2025-03-05-1332,
DEPARTMENT OF STATE,2/26/2025,77055.0,2025-02-26,2025-03-05-1332,
DEPARTMENT OF STATE,2/26/2025,76641.0,2025-02-26,2025-03-05-1332,
DEPARTMENT OF STATE,2/26/2025,75990.0,2025-02-26,2025-03-05-1332,
DEPARTMENT OF STATE,2/26/2025,75729.0,2025-02-26,2025-03-05-1332,
DEPARTMENT OF STATE,2/26/2025,75340.0,2025-02-26,2025-03-05-1332,
DEPARTMENT OF STATE,2/26/2025,75267.82,2025-02-26,2025-03-05-1332,
DEPARTMENT OF STATE,2/26/2025,75225.0,2025-02-26,2025-03-05-1332,
DEPARTMENT OF STATE,2/26/2025,74999.58,2025-02-26,2025-03-05-1332,
DEPARTMENT OF STATE,2/26/2025,74992.0,2025-02-26,2025-03-05-1332,
DEPARTMENT OF STATE,2/26/2025,74950.0,2025-02-26,2025-03-05-1332,
DEPARTMENT OF STATE,2/26/2025,74949.0,2025-02-26,2025-03-05-1332,
DEPARTMENT OF STATE,2/26/2025,74900.0,2025-02-26,2025-03-05-1332,
DEPARTMENT OF STATE,2/26/2025,74827.0,2025-02-26,2025-03-05-1332,
DEPARTMENT OF STATE,2/26/2025,74824.28,2025-02-26,2025-03-05-1332,
DEPARTMENT OF STATE,2/26/2025,74818.0,2025-02-26,2025-03-05-1332,
DEPARTMENT OF STATE,2/26/2025,74750.0,2025-02-26,2025-03-05-1332,
DEPARTMENT OF STATE,2/26/2025,74641.0,2025-02-26,2025-03-05-1332,
DEPARTMENT OF STATE,2/26/2025,74000.0,2025-02-26,2025-03-05-1332,
DEPARTMENT OF STATE,2/26/2025,73800.0,2025-02-26,2025-03-05-1332,
DEPARTMENT OF STATE,2/26/2025,73721.83,2025-02-26,2025-03-05-1332,
DEPARTMENT OF STATE,2/26/2025,73598.6,2025-02-26,2025-03-05-1332,
DEPARTMENT OF STATE,2/26/2025,73366.0,2025-02-26,2025-03-05-1332,
DEPARTMENT OF STATE,2/26/2025,73140.0,2025-02-26,2025-03-05-1332,
DEPARTMENT OF STATE,2/26/2025,73139.0,2025-02-26,2025-03-05-1332,
DEPARTMENT OF STATE,2/26/2025,73113.8,2025-02-26,2025-03-05-1332,
DEPARTMENT OF STATE,2/26/2025,73000.0,2025-02-26,2025-03-05-1332,
DEPARTMENT OF STATE,2/26/2025,72900.0,2025-02-26,2025-03-05-1332,
DEPARTMENT OF STATE,2/26/2025,71000.0,2025-02-26,2025-03-05-1332,
DEPARTMENT OF STATE,2/26/2025,121400.0,2025-02-26,2025-03-05-1332,
DEPARTMENT OF STATE,2/26/2025,69993.0,2025-02-26,2025-03-05-1332,
DEPARTMENT OF STATE,2/26/2025,69949.0,2025-02-26,2025-03-05-1332,
DEPARTMENT OF STATE,2/26/2025,69901.0,2025-02-26,2025-03-05-1332,
DEPARTMENT OF STATE,2/26/2025,69584.53,2025-02-26,2025-03-05-1332,
DEPARTMENT OF STATE,2/26/2025,69440.0,2025-02-26,2025-03-05-1332,
DEPARTMENT OF STATE,2/26/2025,68937.54,2025-02-26,2025-03-05-1332,
DEPARTMENT OF STATE,2/26/2025,68000.0,2025-02-26,2025-03-05-1332,
DEPARTMENT OF STATE,2/26/2025,67700.0,2025-02-26,2025-03-05-1332,
DEPARTMENT OF STATE,2/26/2025,67183.0,2025-02-26,2025-03-05-1332,
DEPARTMENT OF STATE,2/26/2025,67058.2,2025-02-26,2025-03-05-1332,
DEPARTMENT OF STATE,2/26/2025,67000.0,2025-02-26,2025-03-05-1332,
DEPARTMENT OF STATE,2/26/2025,66926.0,2025-02-26,2025-03-05-1332,
DEPARTMENT OF STATE,2/26/2025,66217.0,2025-02-26,2025-03-05-1332,
DEPARTMENT OF STATE,2/26/2025,66100.0,2025-02-26,2025-03-05-1332,
DEPARTMENT OF STATE,2/26/2025,65560.81,2025-02-26,2025-03-05-1332,
DEPARTMENT OF STATE,2/26/2025,65542.0,2025-02-26,2025-03-05-1332,
DEPARTMENT OF STATE,2/26/2025,65220.0,2025-02-26,2025-03-05-1332,
DEPARTMENT OF STATE,2/26/2025,85397.0,2025-02-26,2025-03-05-1332,
DEPARTMENT OF STATE,2/26/2025,64973.0,2025-02-26,2025-03-05-1332,
DEPARTMENT OF STATE,2/26/2025,64951.0,2025-02-26,2025-03-05-1332,
DEPARTMENT OF STATE,2/26/2025,64935.0,2025-02-26,2025-03-05-1332,
DEPARTMENT OF STATE,2/26/2025,64730.6,2025-02-26,2025-03-05-1332,
DEPARTMENT OF STATE,2/26/2025,64635.0,2025-02-26,2025-03-05-1332,
DEPARTMENT OF STATE,2/26/2025,64520.0,2025-02-26,2025-03-05-1332,
DEPARTMENT OF STATE,2/26/2025,64475.0,2025-02-26,2025-03-05-1332,
DEPARTMENT OF STATE,2/26/2025,64448.0,2025-02-26,2025-03-05-1332,
DEPARTMENT OF STATE,2/26/2025,64159.0,2025-02-26,2025-03-05-1332,
DEPARTMENT OF STATE,2/26/2025,64000.0,2025-02-26,2025-03-05-1332,
DEPARTMENT OF STATE,2/26/2025,63618.0,2025-02-26,2025-03-05-1332,
DEPARTMENT OF STATE,2/26/2025,63540.0,2025-02-26,2025-03-05-1332,
DEPARTMENT OF STATE,2/26/2025,63250.0,2025-02-26,2025-03-05-1332,
DEPARTMENT OF STATE,2/26/2025,62896.0,2025-02-26,2025-03-05-1332,
DEPARTMENT OF STATE,2/26/2025,62700.0,2025-02-26,2025-03-05-1332,
DEPARTMENT OF STATE,2/26/2025,62600.0,2025-02-26,2025-03-05-1332,
DEPARTMENT OF STATE,2/26/2025,62200.0,2025-02-26,2025-03-05-1332,
DEPARTMENT OF STATE,2/26/2025,60716.0,2025-02-26,2025-03-05-1332,
DEPARTMENT OF STATE,2/26/2025,60314.52,2025-02-26,2025-03-05-1332,
DEPARTMENT OF STATE,2/26/2025,60300.0,2025-02-26,2025-03-05-1332,
DEPARTMENT OF STATE,2/26/2025,59979.0,2025-02-26,2025-03-05-1332,
DEPARTMENT OF STATE,2/26/2025,59942.0,2025-02-26,2025-03-05-1332,
DEPARTMENT OF STATE,2/26/2025,59610.0,2025-02-26,2025-03-05-1332,
DEPARTMENT OF STATE,2/26/2025,59500.0,2025-02-26,2025-03-05-1332,
DEPARTMENT OF STATE,2/26/2025,59000.0,2025-02-26,2025-03-05-1332,
DEPARTMENT OF STATE,2/26/2025,58000.0,2025-02-26,2025-03-05-1332,
DEPARTMENT OF STATE,2/26/2025,57980.0,2025-02-26,2025-03-05-1332,
DEPARTMENT OF STATE,2/26/2025,57900.0,2025-02-26,2025-03-05-1332,
DEPARTMENT OF STATE,2/26/2025,57607.0,2025-02-26,2025-03-05-1332,
DEPARTMENT OF STATE,2/26/2025,57372.0,2025-02-26,2025-03-05-1332,
DEPARTMENT OF STATE,2/26/2025,57364.0,2025-02-26,2025-03-05-1332,
DEPARTMENT OF STATE,2/26/2025,57198.0,2025-02-26,2025-03-05-1332,
